,taxon_name_w_authors,v11_accepted_name_w_author,v12_taxon_name_w_authors,v12_chained_accepted_name_w_author,v12_chained_accepted_species_w_author,v12_direct_accepted_name_w_author,v12_direct_accepted_species_w_author
107,Sedum taiwanianum S.S.Ying,Sedum nokoense Yamam.,Sedum nokoense Yamam.,Sedum nokoense Yamam.,Sedum nokoense Yamam.,Sedum taiwanianum S.S.Ying,Sedum taiwanianum S.S.Ying
1047,Racosperma centrinervium (Maiden & Blakely) Pedley,Acacia lineata A.Cunn. ex G.Don,Acacia lineata A.Cunn. ex G.Don,Acacia lineata A.Cunn. ex G.Don,Acacia lineata A.Cunn. ex G.Don,Acacia centrinervia Maiden & Blakely,Acacia centrinervia Maiden & Blakely
1214,Viola filipes Greene,Viola canina subsp. canina,Viola canina subsp. canina,Viola canina subsp. canina,Viola canina L.,Viola adunca Sm.,Viola adunca Sm.
1839,Conohoria passoura DC.,Rinorea flavescens (Aubl.) Kuntze,Rinorea flavescens (Aubl.) Kuntze,Rinorea flavescens (Aubl.) Kuntze,Rinorea flavescens (Aubl.) Kuntze,Rinorea pubiflora (Benth.) Sprague & Sandwith,Rinorea pubiflora (Benth.) Sprague & Sandwith
1999,Cyathea insularis Domin,Alsophila bullata Baker,Alsophila bullata Baker,,,Gymnosphaera boivinii var. boivinii,Gymnosphaera boivinii (Mett. ex Ettingsh.) Tardieu
2034,Capsicum conicum Vell.,Capsicum baccatum var. baccatum,Capsicum baccatum var. baccatum,Capsicum baccatum var. baccatum,Capsicum baccatum L.,Capsicum chinense Jacq.,Capsicum chinense Jacq.
5870,Angraecum longinode Frapp. ex Cordem.,Angraecum patens Frapp. ex Cordem.,Angraecum patens Frapp. ex Cordem.,Angraecum patens Frapp. ex Cordem.,Angraecum patens Frapp. ex Cordem.,Angraecum costatum Frapp. ex Cordem.,Angraecum costatum Frapp. ex Cordem.
5943,Mystacidium spicatum Cordem.,Angraecum tenellum (Ridl.) Schltr.,Angraecum tenellum (Ridl.) Schltr.,Angraecum tenellum (Ridl.) Schltr.,Angraecum tenellum (Ridl.) Schltr.,Angraecum parvulum Ayres ex S.Moore,Angraecum parvulum Ayres ex S.Moore
8359,Aspidosperma marcgravianum Woodson,Aspidosperma excelsum Benth.,Aspidosperma excelsum Benth.,Aspidosperma excelsum Benth.,Aspidosperma excelsum Benth.,Aspidosperma marcgravianum Woodson,Aspidosperma marcgravianum Woodson
12036,Trias pusilla J.Joseph & H.Deka,Bulbophyllum moniliforme C.S.P.Parish & Rchb.f.,Bulbophyllum moniliforme C.S.P.Parish & Rchb.f.,Bulbophyllum moniliforme C.S.P.Parish & Rchb.f.,Bulbophyllum moniliforme C.S.P.Parish & Rchb.f.,"Bulbophyllum jejosephii J.J.Verm., Schuit. & de Vogel","Bulbophyllum jejosephii J.J.Verm., Schuit. & de Vogel"
13926,Calanthe candida Bosser,Calanthe sylvatica (Thouars) Lindl.,Calanthe sylvatica (Thouars) Lindl.,Calanthe sylvatica (Thouars) Lindl.,Calanthe sylvatica (Thouars) Lindl.,Calanthe candida Bosser,Calanthe candida Bosser
13967,Calanthe nephroglossa Schltr.,Calanthe triplicata (Willemet) Ames,Calanthe triplicata (Willemet) Ames,Calanthe triplicata (Willemet) Ames,Calanthe triplicata (Willemet) Ames,Calanthe nephroglossa Schltr.,Calanthe nephroglossa Schltr.
18727,Exorrhiza vaupelii Burret,Clinostigma warburgii Becc.,Clinostigma warburgii Becc.,Clinostigma warburgii Becc.,Clinostigma warburgii Becc.,Clinostigma savaiiense Christoph.,Clinostigma savaiiense Christoph.
18728,Clinostigma vaupelii Burret,Clinostigma warburgii Becc.,Clinostigma warburgii Becc.,Clinostigma warburgii Becc.,Clinostigma warburgii Becc.,Clinostigma savaiiense Christoph.,Clinostigma savaiiense Christoph.
18730,Clinostigma savaiiense Christoph.,Clinostigma warburgii Becc.,Clinostigma warburgii Becc.,Clinostigma warburgii Becc.,Clinostigma warburgii Becc.,Clinostigma savaiiense Christoph.,Clinostigma savaiiense Christoph.
20646,Eucalyptus variegata F.Muell.,Corymbia citriodora (Hook.) K.D.Hill & L.A.S.Johnson,Corymbia citriodora (Hook.) K.D.Hill & L.A.S.Johnson,Corymbia citriodora (Hook.) K.D.Hill & L.A.S.Johnson,Corymbia citriodora (Hook.) K.D.Hill & L.A.S.Johnson,Corymbia variegata (F.Muell.) K.D.Hill & L.A.S.Johnson,Corymbia variegata (F.Muell.) K.D.Hill & L.A.S.Johnson
20659,Eucalyptus capricornia D.J.Carr & S.G.M.Carr,Corymbia dichromophloia (F.Muell.) K.D.Hill & L.A.S.Johnson,Corymbia dichromophloia (F.Muell.) K.D.Hill & L.A.S.Johnson,Corymbia dichromophloia (F.Muell.) K.D.Hill & L.A.S.Johnson,Corymbia dichromophloia (F.Muell.) K.D.Hill & L.A.S.Johnson,Corymbia capricornia (D.J.Carr & S.G.M.Carr) K.D.Hill & L.A.S.Johnson,Corymbia capricornia (D.J.Carr & S.G.M.Carr) K.D.Hill & L.A.S.Johnson
20661,Corymbia capricornia (D.J.Carr & S.G.M.Carr) K.D.Hill & L.A.S.Johnson,Corymbia dichromophloia (F.Muell.) K.D.Hill & L.A.S.Johnson,Corymbia dichromophloia (F.Muell.) K.D.Hill & L.A.S.Johnson,Corymbia dichromophloia (F.Muell.) K.D.Hill & L.A.S.Johnson,Corymbia dichromophloia (F.Muell.) K.D.Hill & L.A.S.Johnson,Corymbia capricornia (D.J.Carr & S.G.M.Carr) K.D.Hill & L.A.S.Johnson,Corymbia capricornia (D.J.Carr & S.G.M.Carr) K.D.Hill & L.A.S.Johnson
20662,Eucalyptus drysdalensis D.J.Carr & S.G.M.Carr,Corymbia dichromophloia (F.Muell.) K.D.Hill & L.A.S.Johnson,Corymbia dichromophloia (F.Muell.) K.D.Hill & L.A.S.Johnson,Corymbia dichromophloia (F.Muell.) K.D.Hill & L.A.S.Johnson,Corymbia dichromophloia (F.Muell.) K.D.Hill & L.A.S.Johnson,Corymbia drysdalensis (D.J.Carr & S.G.M.Carr) K.D.Hill & L.A.S.Johnson,Corymbia drysdalensis (D.J.Carr & S.G.M.Carr) K.D.Hill & L.A.S.Johnson
21487,Croton cascarilla Lam.,Croton flavens L.,Croton flavens L.,Croton flavens L.,Croton flavens L.,Croton eluteria (L.) W.Wright,Croton eluteria (L.) W.Wright
21488,Croton albidus Müll.Arg.,Croton flavens L.,Croton flavens L.,Croton flavens L.,Croton flavens L.,Croton humilis L.,Croton humilis L.
21494,Croton lamarckianus Moldenke,Croton flavens L.,Croton flavens L.,Croton flavens L.,Croton flavens L.,Croton eluteria (L.) W.Wright,Croton eluteria (L.) W.Wright
21501,Oxydectes albida (Müll.Arg.) Kuntze,Croton flavens L.,Croton flavens L.,Croton flavens L.,Croton flavens L.,Croton humilis L.,Croton humilis L.
22955,Hemiperis micrantha Frapp. ex Cordem.,Cynorkis falcata (Frapp. ex Cordem.) Schltr.,Cynorkis falcata (Frapp. ex Cordem.) Schltr.,Cynorkis falcata (Frapp. ex Cordem.) Schltr.,Cynorkis falcata (Frapp. ex Cordem.) Schltr.,Cynorkis micrantha (Frapp. ex Cordem.) Schltr.,Cynorkis micrantha (Frapp. ex Cordem.) Schltr.
30599,Eucalyptus subcaerulea K.D.Hill,Eucalyptus agglomerata Maiden,Eucalyptus agglomerata Maiden,Eucalyptus agglomerata Maiden,Eucalyptus agglomerata Maiden,Eucalyptus subcaerulea K.D.Hill,Eucalyptus subcaerulea K.D.Hill
30885,Eucalyptus leptophylla var. floribunda Blakely,Eucalyptus leptophylla F.Muell. ex Miq.,Eucalyptus leptophylla F.Muell. ex Miq.,Eucalyptus leptophylla F.Muell. ex Miq.,Eucalyptus leptophylla F.Muell. ex Miq.,Eucalyptus efflorescens L.A.S.Johnson & K.D.Hill ex D.Nicolle & M.E.French,Eucalyptus efflorescens L.A.S.Johnson & K.D.Hill ex D.Nicolle & M.E.French
31005,Eucalyptus fergusonii R.T.Baker,Eucalyptus paniculata Sm.,Eucalyptus paniculata Sm.,Eucalyptus paniculata Sm.,Eucalyptus paniculata Sm.,Eucalyptus fergusonii R.T.Baker,Eucalyptus fergusonii R.T.Baker
31006,Eucalyptus fergusonii subsp. dorsiventralis L.A.S.Johnson & K.D.Hill,Eucalyptus paniculata Sm.,Eucalyptus paniculata Sm.,Eucalyptus paniculata Sm.,Eucalyptus paniculata Sm.,Eucalyptus fergusonii subsp. dorsiventralis L.A.S.Johnson & K.D.Hill,Eucalyptus fergusonii R.T.Baker
31130,Eucalyptus pseudoglobulus Naudin ex Maiden,Eucalyptus stjohnii (F.Muell. ex R.T.Baker) R.T.Baker,Eucalyptus stjohnii (F.Muell. ex R.T.Baker) R.T.Baker,,,Eucalyptus pseudoglobulus Naudin ex Maiden,Eucalyptus pseudoglobulus Naudin ex Maiden
31135,Eucalyptus spectatrix L.A.S.Johnson & Blaxell,Eucalyptus stricta Sieber ex Spreng.,Eucalyptus stricta Sieber ex Spreng.,Eucalyptus stricta Sieber ex Spreng.,Eucalyptus stricta Sieber ex Spreng.,Eucalyptus spectatrix L.A.S.Johnson & Blaxell,Eucalyptus spectatrix L.A.S.Johnson & Blaxell
31194,Eucalyptus aenea K.D.Hill,Eucalyptus viridis R.T.Baker,Eucalyptus viridis R.T.Baker,Eucalyptus viridis R.T.Baker,Eucalyptus viridis R.T.Baker,Eucalyptus aenea K.D.Hill,Eucalyptus aenea K.D.Hill
31904,Eugenia pisonis O.Berg,Eugenia moschata (Aubl.) Nied. ex T.Durand & B.D.Jacks.,Eugenia moschata (Aubl.) Nied. ex T.Durand & B.D.Jacks.,Eugenia moschata (Aubl.) Nied. ex T.Durand & B.D.Jacks.,Eugenia moschata (Aubl.) Nied. ex T.Durand & B.D.Jacks.,Eugenia pisonis O.Berg,Eugenia pisonis O.Berg
32216,Eugenia doniana O.Berg,Eugenia stictopetala DC.,Eugenia stictopetala DC.,Eugenia stictopetala DC.,Eugenia stictopetala DC.,Myrcia doniana O.Berg,Myrcia doniana O.Berg
34540,Euphorbia latimammillaris Croizat,Euphorbia mammillaris L.,Euphorbia mammillaris L.,Euphorbia mammillaris L.,Euphorbia mammillaris L.,Euphorbia pseudoglobosa subsp. nesemannii (R.A.Dyer) Bruyns,Euphorbia pseudoglobosa Marloth
34564,Euphorbia currorii N.E.Br.,Euphorbia matabelensis Pax,Euphorbia matabelensis Pax,Euphorbia matabelensis Pax,Euphorbia matabelensis Pax,Euphorbia currorii N.E.Br.,Euphorbia currorii N.E.Br.
34746,Euphorbia cucumerina Willd.,Euphorbia obesa Hook.f.,Euphorbia obesa Hook.f.,Euphorbia obesa Hook.f.,Euphorbia obesa Hook.f.,Euphorbia polygona Haw.,Euphorbia polygona Haw.
36217,Faramea tenuifolia Rusby,Faramea occidentalis (L.) A.Rich.,Faramea occidentalis (L.) A.Rich.,Faramea occidentalis (L.) A.Rich.,Faramea occidentalis (L.) A.Rich.,Faramea tenuifolia Rusby,Faramea tenuifolia Rusby
37861,Gastrodia foetida Koidz.,Gastrodia nipponica (Honda) Tuyama,Gastrodia nipponica (Honda) Tuyama,Gastrodia nipponica (Honda) Tuyama,Gastrodia nipponica (Honda) Tuyama,Gastrodia foetida Koidz.,Gastrodia foetida Koidz.
41444,Homalomena tonkinensis Engl.,Homalomena cochinchinensis Engl.,Homalomena cochinchinensis Engl.,Homalomena occulta (Lour.) Schott,Homalomena occulta (Lour.) Schott,Homalomena tonkinensis Engl.,Homalomena tonkinensis Engl.
44262,Lantana sellowiana f. planifolia Cham.,Lantana montevidensis (Spreng.) Briq.,Lantana montevidensis (Spreng.) Briq.,Lantana montevidensis (Spreng.) Briq.,Lantana montevidensis (Spreng.) Briq.,Lantana planifolia (Cham.) Briq.,Lantana planifolia (Cham.) Briq.
45024,Lepanthes doloma Luer & R.Vásquez,Lepanthes intonsa Luer,Lepanthes intonsa Luer,Lepanthes intonsa Luer,Lepanthes intonsa Luer,Lepanthes doloma Luer & R.Vásquez,Lepanthes doloma Luer & R.Vásquez
48232,Cameraria guianensis Aubl.,Malouetia tamaquarina var. tamaquarina,Malouetia tamaquarina var. tamaquarina,Malouetia tamaquarina var. tamaquarina,Malouetia tamaquarina (Aubl.) A.DC.,Malouetia guianensis (Aubl.) Miers,Malouetia guianensis (Aubl.) Miers
48239,Malouetia guianensis (Aubl.) Miers,Malouetia tamaquarina var. tamaquarina,Malouetia tamaquarina var. tamaquarina,Malouetia tamaquarina var. tamaquarina,Malouetia tamaquarina (Aubl.) A.DC.,Malouetia guianensis (Aubl.) Miers,Malouetia guianensis (Aubl.) Miers
52620,Sideroxylon rugosum var. parviflorum Miq.,Micropholis rugosa (Sw.) Pierre,Micropholis rugosa (Sw.) Pierre,Micropholis rugosa (Sw.) Pierre,Micropholis rugosa (Sw.) Pierre,Micropholis melinoniana Pierre,Micropholis melinoniana Pierre
56232,Angraecum pescatorianum Lindl.,Oeoniella polystachys (Thouars) Schltr.,Oeoniella polystachys (Thouars) Schltr.,Oeoniella polystachys (Thouars) Schltr.,Oeoniella polystachys (Thouars) Schltr.,Listrostachys pertusa (Lindl.) Rchb.f.,Listrostachys pertusa (Lindl.) Rchb.f.
60568,Eria matthewsii Rchb.f.,Phreatia inversa Schltr.,Phreatia inversa Schltr.,Phreatia inversa Schltr.,Phreatia inversa Schltr.,Phreatia matthewsii Rchb.f.,Phreatia matthewsii Rchb.f.
62349,"Platanthera lesbiaca Devillers-Tersch., Devillers, Dedroog, Baeten & Flausch",Platanthera chlorantha (Custer) Rchb.,Platanthera chlorantha (Custer) Rchb.,Platanthera chlorantha (Custer) Rchb.,Platanthera chlorantha (Custer) Rchb.,Platanthera holmboei H.Lindb.,Platanthera holmboei H.Lindb.
66887,Uragoga pobeguinii De Wild.,Psychotria peduncularis var. peduncularis,Psychotria peduncularis var. peduncularis,Psychotria peduncularis var. peduncularis,Psychotria peduncularis (Salisb.) Steyerm.,Psychotria mildbraedii (K.Krause) O.Lachenaud,Psychotria mildbraedii (K.Krause) O.Lachenaud
66895,Uragoga multinervata De Wild.,Psychotria peduncularis var. peduncularis,Psychotria peduncularis var. peduncularis,Psychotria peduncularis var. peduncularis,Psychotria peduncularis (Salisb.) Steyerm.,Psychotria mildbraedii (K.Krause) O.Lachenaud,Psychotria mildbraedii (K.Krause) O.Lachenaud
66899,Uragoga gumola De Wild.,Psychotria peduncularis var. peduncularis,Psychotria peduncularis var. peduncularis,Psychotria peduncularis var. peduncularis,Psychotria peduncularis (Salisb.) Steyerm.,Psychotria mildbraedii (K.Krause) O.Lachenaud,Psychotria mildbraedii (K.Krause) O.Lachenaud
66903,Uragoga densifolia De Wild.,Psychotria peduncularis var. peduncularis,Psychotria peduncularis var. peduncularis,Psychotria peduncularis var. peduncularis,Psychotria peduncularis (Salisb.) Steyerm.,Psychotria mildbraedii (K.Krause) O.Lachenaud,Psychotria mildbraedii (K.Krause) O.Lachenaud
66910,Uragoga seretii De Wild.,Psychotria peduncularis var. peduncularis,Psychotria peduncularis var. peduncularis,Psychotria peduncularis var. peduncularis,Psychotria peduncularis (Salisb.) Steyerm.,Psychotria mildbraedii (K.Krause) O.Lachenaud,Psychotria mildbraedii (K.Krause) O.Lachenaud
69030,Quercus pubescens var. appenina (Lam.) Wenz.,Quercus pubescens subsp. pubescens,Quercus pubescens subsp. pubescens,Quercus pubescens subsp. pubescens,Quercus pubescens Willd.,Quercus robur subsp. robur,Quercus robur L.
69249,Quercus appenina Lam.,Quercus pubescens subsp. pubescens,Quercus pubescens subsp. pubescens,Quercus pubescens subsp. pubescens,Quercus pubescens Willd.,Quercus robur subsp. robur,Quercus robur L.
71689,Salvia campanulata var. hirtella E.Peter,Salvia campanulata Wall. ex Benth.,Salvia campanulata Wall. ex Benth.,Salvia campanulata Wall. ex Benth.,Salvia campanulata Wall. ex Benth.,Salvia clementiae Pendry & Y.K.Wei,Salvia clementiae Pendry & Y.K.Wei
76164,Stelis sotoana Solano,Stelis purpurascens A.Rich. & Galeotti,Stelis purpurascens A.Rich. & Galeotti,Stelis purpurascens A.Rich. & Galeotti,Stelis purpurascens A.Rich. & Galeotti,Stelis sotoana Solano,Stelis sotoana Solano
76169,Stelis chiapensis Solano,Stelis purpurascens A.Rich. & Galeotti,Stelis purpurascens A.Rich. & Galeotti,Stelis purpurascens A.Rich. & Galeotti,Stelis purpurascens A.Rich. & Galeotti,Stelis chiapensis Solano,Stelis chiapensis Solano
77561,Eugenia egensis var. tenuiramis (Miq.) O.Berg,Syzygium zeylanicum (L.) DC.,Syzygium zeylanicum (L.) DC.,Syzygium zeylanicum (L.) DC.,Syzygium zeylanicum (L.) DC.,Eugenia egensis DC.,Eugenia egensis DC.
77566,Eugenia tenuiramis Miq.,Syzygium zeylanicum (L.) DC.,Syzygium zeylanicum (L.) DC.,Syzygium zeylanicum (L.) DC.,Syzygium zeylanicum (L.) DC.,Eugenia egensis DC.,Eugenia egensis DC.
77950,Sarcochilus aphyllus Makino,Taeniophyllum glandulosum Blume,Taeniophyllum glandulosum Blume,Taeniophyllum glandulosum Blume,Taeniophyllum glandulosum Blume,Taeniophyllum aphyllum Makino,Taeniophyllum aphyllum Makino
77955,Cryptorchis aphylla Makino,Taeniophyllum glandulosum Blume,Taeniophyllum glandulosum Blume,Taeniophyllum glandulosum Blume,Taeniophyllum glandulosum Blume,Taeniophyllum aphyllum Makino,Taeniophyllum aphyllum Makino
78630,Teucrium cubense subsp. depressum (Small) E.M.McClint. & Epling,Teucrium cubense Jacq.,Teucrium cubense Jacq.,Teucrium cubense Jacq.,Teucrium cubense Jacq.,Teucrium depressum Small,Teucrium depressum Small
79343,Thymus euboeus Halácsy,Thymus dolopicus Formánek,Thymus dolopicus Formánek,Thymus dolopicus Formánek,Thymus dolopicus Formánek,Thymus leucotrichus subsp. leucotrichus,Thymus leucotrichus Halácsy
83477,Restrepia liebmanniana Kraenzl.,Acianthera strupifolia (Lindl.) Pridgeon & M.W.Chase,Acianthera strupifolia (Lindl.) Pridgeon & M.W.Chase,Acianthera strupifolia (Lindl.) Pridgeon & M.W.Chase,Acianthera strupifolia (Lindl.) Pridgeon & M.W.Chase,Andreettaea marginata (Rich.) A.Doucette,Andreettaea marginata (Rich.) A.Doucette
84249,Pleurothallis guentheri Schltr.,Anathallis obovata (Lindl.) Pridgeon & M.W.Chase,Anathallis obovata (Lindl.) Pridgeon & M.W.Chase,Anathallis obovata (Lindl.) Pridgeon & M.W.Chase,Anathallis obovata (Lindl.) Pridgeon & M.W.Chase,Anathallis citrina (Schltr.) Pridgeon & M.W.Chase,Anathallis citrina (Schltr.) Pridgeon & M.W.Chase
84250,Pleurothallis citrina Schltr.,Anathallis obovata (Lindl.) Pridgeon & M.W.Chase,Anathallis obovata (Lindl.) Pridgeon & M.W.Chase,Anathallis obovata (Lindl.) Pridgeon & M.W.Chase,Anathallis obovata (Lindl.) Pridgeon & M.W.Chase,Anathallis citrina (Schltr.) Pridgeon & M.W.Chase,Anathallis citrina (Schltr.) Pridgeon & M.W.Chase
84251,Pleurothallis brachyantha Schltr.,Anathallis obovata (Lindl.) Pridgeon & M.W.Chase,Anathallis obovata (Lindl.) Pridgeon & M.W.Chase,Anathallis obovata (Lindl.) Pridgeon & M.W.Chase,Anathallis obovata (Lindl.) Pridgeon & M.W.Chase,Anathallis citrina (Schltr.) Pridgeon & M.W.Chase,Anathallis citrina (Schltr.) Pridgeon & M.W.Chase
84252,Pleurothallis angustilabia Hoehne & Schltr.,Anathallis obovata (Lindl.) Pridgeon & M.W.Chase,Anathallis obovata (Lindl.) Pridgeon & M.W.Chase,Anathallis obovata (Lindl.) Pridgeon & M.W.Chase,Anathallis obovata (Lindl.) Pridgeon & M.W.Chase,Anathallis citrina (Schltr.) Pridgeon & M.W.Chase,Anathallis citrina (Schltr.) Pridgeon & M.W.Chase
84254,Pleurothallis stenoglossa Pabst,Anathallis obovata (Lindl.) Pridgeon & M.W.Chase,Anathallis obovata (Lindl.) Pridgeon & M.W.Chase,Anathallis obovata (Lindl.) Pridgeon & M.W.Chase,Anathallis obovata (Lindl.) Pridgeon & M.W.Chase,Anathallis citrina (Schltr.) Pridgeon & M.W.Chase,Anathallis citrina (Schltr.) Pridgeon & M.W.Chase
91813,Cyperus planifolius var. pickelii Gross ex Kük.,Cyperus planifolius Rich.,Cyperus planifolius Rich.,Cyperus planifolius Rich.,Cyperus planifolius Rich.,"Cyperus potiguar A.R.O.Ribeiro, M.Alves & R.C.Oliveira","Cyperus potiguar A.R.O.Ribeiro, M.Alves & R.C.Oliveira"
97324,Musa paramjitiana L.J.Singh,"Musa balbisiana var. andamanica D.B.Singh, Sreek., T.V.R.S.Sharma & A.K.Bandyop.","Musa balbisiana var. andamanica D.B.Singh, Sreek., T.V.R.S.Sharma & A.K.Bandyop.",Musa balbisiana var. balbisiana,Musa balbisiana Colla,Musa paramjitiana L.J.Singh,Musa paramjitiana L.J.Singh
98017,Paepalanthus elongatus var. glabrescens Moldenke,Paepalanthus elongatus (Bong.) Körn.,Paepalanthus elongatus (Bong.) Körn.,Paepalanthus elongatus (Bong.) Körn.,Paepalanthus elongatus (Bong.) Körn.,Paepalanthus politus Trovó,Paepalanthus politus Trovó
98152,Paepalanthus pulchellus var. puberulentus Moldenke,Paepalanthus pulchellus Herzog,Paepalanthus pulchellus Herzog,Paepalanthus pulchellus Herzog,Paepalanthus pulchellus Herzog,Paepalanthus lundii Körn.,Paepalanthus lundii Körn.
109242,Allium rotundum var. multiflorum Nyman,Allium ampeloprasum L.,Allium ampeloprasum L.,Allium ampeloprasum L.,Allium ampeloprasum L.,Allium polyanthum Schult. & Schult.f.,Allium polyanthum Schult. & Schult.f.
109243,Allium firmotunicatum var. album Grossh.,Allium ampeloprasum L.,Allium ampeloprasum L.,Allium ampeloprasum L.,Allium ampeloprasum L.,Allium leucanthum K.Koch,Allium leucanthum K.Koch
109253,Allium polyanthum Schult. & Schult.f.,Allium ampeloprasum L.,Allium ampeloprasum L.,Allium ampeloprasum L.,Allium ampeloprasum L.,Allium polyanthum Schult. & Schult.f.,Allium polyanthum Schult. & Schult.f.
109260,Allium porrum L.,Allium ampeloprasum L.,Allium ampeloprasum L.,Allium ampeloprasum L.,Allium ampeloprasum L.,Allium porrum L.,Allium porrum L.
109261,Allium porrum var. breve Alef.,Allium ampeloprasum L.,Allium ampeloprasum L.,Allium ampeloprasum L.,Allium ampeloprasum L.,Allium porrum L.,Allium porrum L.
109263,Allium porrum var. latum Alef.,Allium ampeloprasum L.,Allium ampeloprasum L.,Allium ampeloprasum L.,Allium ampeloprasum L.,Allium porrum L.,Allium porrum L.
109265,Allium porrum var. viviparum Alef.,Allium ampeloprasum L.,Allium ampeloprasum L.,Allium ampeloprasum L.,Allium ampeloprasum L.,Allium porrum L.,Allium porrum L.
109266,Porrum commune Rchb.,Allium ampeloprasum L.,Allium ampeloprasum L.,Allium ampeloprasum L.,Allium ampeloprasum L.,Allium porrum L.,Allium porrum L.
109267,Allium leucanthum K.Koch,Allium ampeloprasum L.,Allium ampeloprasum L.,Allium ampeloprasum L.,Allium ampeloprasum L.,Allium leucanthum K.Koch,Allium leucanthum K.Koch
109268,Porrum sativum Mill.,Allium ampeloprasum L.,Allium ampeloprasum L.,Allium ampeloprasum L.,Allium ampeloprasum L.,Allium porrum L.,Allium porrum L.
109269,Allium leucanthum var. tridentatum Ogan.,Allium ampeloprasum L.,Allium ampeloprasum L.,Allium ampeloprasum L.,Allium ampeloprasum L.,Allium leucanthum K.Koch,Allium leucanthum K.Koch
109271,Allium multiflorum DC.,Allium ampeloprasum L.,Allium ampeloprasum L.,Allium ampeloprasum L.,Allium ampeloprasum L.,Allium polyanthum Schult. & Schult.f.,Allium polyanthum Schult. & Schult.f.
109279,Allium laetum Salisb.,Allium ampeloprasum L.,Allium ampeloprasum L.,Allium ampeloprasum L.,Allium ampeloprasum L.,Allium porrum L.,Allium porrum L.
109288,Allium ampeloprasum subsp. leucanthum (K.Koch) K.Richt.,Allium ampeloprasum L.,Allium ampeloprasum L.,Allium ampeloprasum L.,Allium ampeloprasum L.,Allium leucanthum K.Koch,Allium leucanthum K.Koch
109289,Allium ampeloprasum var. leucanthum (K.Koch) Ledeb.,Allium ampeloprasum L.,Allium ampeloprasum L.,Allium ampeloprasum L.,Allium ampeloprasum L.,Allium leucanthum K.Koch,Allium leucanthum K.Koch
109291,Allium ampeloprasum subsp. porrum (L.) Hayek,Allium ampeloprasum L.,Allium ampeloprasum L.,Allium ampeloprasum L.,Allium ampeloprasum L.,Allium porrum L.,Allium porrum L.
109292,Allium ampeloprasum var. porrum (L.) J.Gay,Allium ampeloprasum L.,Allium ampeloprasum L.,Allium ampeloprasum L.,Allium ampeloprasum L.,Allium porrum L.,Allium porrum L.
114219,Gagea amblyopetala var. montana Pascher,Gagea amblyopetala Boiss. & Heldr.,Gagea amblyopetala Boiss. & Heldr.,Gagea amblyopetala Boiss. & Heldr.,Gagea amblyopetala Boiss. & Heldr.,Gagea heldreichii (A.Terracc.) Lojac.,Gagea heldreichii (A.Terracc.) Lojac.
115900,Allium alaschanicum Y.Z.Zhao,Allium flavovirens Regel,Allium flavovirens Regel,Allium leucocephalum Turcz. ex Ledeb.,Allium leucocephalum Turcz. ex Ledeb.,Allium alaschanicum Y.Z.Zhao,Allium alaschanicum Y.Z.Zhao
116310,Thysanotus elatior R.Br.,Thysanotus tuberosus subsp. tuberosus,Thysanotus tuberosus subsp. tuberosus,Thysanotus tuberosus subsp. tuberosus,Thysanotus tuberosus R.Br.,Thysanotus elatior R.Br.,Thysanotus elatior R.Br.
116595,Potamogeton alpinus var. rivularis (Hartm.) Hagstr.,Potamogeton alpinus subsp. alpinus,Potamogeton alpinus subsp. alpinus,Potamogeton alpinus subsp. alpinus,Potamogeton alpinus Balb.,Potamogeton × rivularis Gillot,Potamogeton × rivularis Gillot
116607,Potamogeton × lanceolatus subsp. rivularis (Gillot) Magnin,Potamogeton alpinus subsp. alpinus,Potamogeton alpinus subsp. alpinus,Potamogeton alpinus subsp. alpinus,Potamogeton alpinus Balb.,Potamogeton × rivularis Gillot,Potamogeton × rivularis Gillot
116608,Potamogeton rufescens subsp. rivularis (Gillot) K.Richt.,Potamogeton alpinus subsp. alpinus,Potamogeton alpinus subsp. alpinus,Potamogeton alpinus subsp. alpinus,Potamogeton alpinus Balb.,Potamogeton × rivularis Gillot,Potamogeton × rivularis Gillot
120162,"Syrianthus aschersonii (Foster) M.B.Crespo, Mart.-Azorín & Mavrodiev",Iris grant-duffii Baker,Iris grant-duffii Baker,Iris grant-duffii Baker,Iris grant-duffii Baker,Iris aschersonii Foster,Iris aschersonii Foster
120163,Iris aschersonii Foster,Iris grant-duffii Baker,Iris grant-duffii Baker,Iris grant-duffii Baker,Iris grant-duffii Baker,Iris aschersonii Foster,Iris aschersonii Foster
121107,Romulea ramiflora var. parlatorei (Tod.) Rouy,Romulea revelierei Jord. & Fourr.,Romulea revelierei Jord. & Fourr.,Romulea revelierei Jord. & Fourr.,Romulea revelierei Jord. & Fourr.,Romulea columnae subsp. columnae,Romulea columnae Sebast. & Mauri
123600,Polemonium campanuloides L.f.,Retzia capensis Thunb.,Retzia capensis Thunb.,Retzia capensis Thunb.,Retzia capensis Thunb.,Prismatocarpus campanuloides (L.f.) Sond.,Prismatocarpus campanuloides (L.f.) Sond.
123601,Retzia campanuloides (L.f.) Spreng.,Retzia capensis Thunb.,Retzia capensis Thunb.,Retzia capensis Thunb.,Retzia capensis Thunb.,Prismatocarpus campanuloides (L.f.) Sond.,Prismatocarpus campanuloides (L.f.) Sond.
123602,Polemonium roelloides L.f.,Retzia capensis Thunb.,Retzia capensis Thunb.,Retzia capensis Thunb.,Retzia capensis Thunb.,Prismatocarpus pedunculatus (P.J.Bergius) A.DC.,Prismatocarpus pedunculatus (P.J.Bergius) A.DC.
123604,Retzia roelloides (L.f.) Spreng.,Retzia capensis Thunb.,Retzia capensis Thunb.,Retzia capensis Thunb.,Retzia capensis Thunb.,Prismatocarpus pedunculatus (P.J.Bergius) A.DC.,Prismatocarpus pedunculatus (P.J.Bergius) A.DC.
131142,Cyphia volubilis var. latipetala (C.Presl) E.Wimm.,Cyphia volubilis (Burm.f.) Willd.,Cyphia volubilis (Burm.f.) Willd.,Cyphia volubilis (Burm.f.) Willd.,Cyphia volubilis (Burm.f.) Willd.,Cyphia latipetala C.Presl,Cyphia latipetala C.Presl
131143,Cyphia volubilis var. longipes E.Wimm.,Cyphia volubilis (Burm.f.) Willd.,Cyphia volubilis (Burm.f.) Willd.,Cyphia volubilis (Burm.f.) Willd.,Cyphia volubilis (Burm.f.) Willd.,Cyphia angustiloba C.Presl,Cyphia angustiloba C.Presl
131144,Cyphia angustiloba C.Presl,Cyphia volubilis (Burm.f.) Willd.,Cyphia volubilis (Burm.f.) Willd.,Cyphia volubilis (Burm.f.) Willd.,Cyphia volubilis (Burm.f.) Willd.,Cyphia angustiloba C.Presl,Cyphia angustiloba C.Presl
131148,Cyphia longipetala C.Presl,Cyphia volubilis (Burm.f.) Willd.,Cyphia volubilis (Burm.f.) Willd.,Cyphia volubilis (Burm.f.) Willd.,Cyphia volubilis (Burm.f.) Willd.,Cyphia longipetala C.Presl,Cyphia longipetala C.Presl
131149,Cyphia latipetala C.Presl,Cyphia volubilis (Burm.f.) Willd.,Cyphia volubilis (Burm.f.) Willd.,Cyphia volubilis (Burm.f.) Willd.,Cyphia volubilis (Burm.f.) Willd.,Cyphia latipetala C.Presl,Cyphia latipetala C.Presl
