398494,Solanum pseudosaponaceum Blume,Solanum torvum Sw.,Solanum torvum Sw.,Solanum torvum Sw.,Solanum torvum Sw.,Solanum pseudosaponaceum Blume,Solanum pseudosaponaceum Blume
398500,Solanum torvum var. pleiotomum C.Y.Wu & S.C.Huang,Solanum torvum Sw.,Solanum torvum Sw.,Solanum torvum Sw.,Solanum torvum Sw.,Solanum chrysotrichum Schltdl.,Solanum chrysotrichum Schltdl.
398514,Solanum sarmentosum Nees,Solanum trilobatum L.,Solanum trilobatum L.,Solanum trilobatum L.,Solanum trilobatum L.,Solanum cyanocarphium Blume,Solanum cyanocarphium Blume
398518,Solanum maingayi Kuntze,Solanum trilobatum L.,Solanum trilobatum L.,Solanum trilobatum L.,Solanum trilobatum L.,Solanum cyanocarphium Blume,Solanum cyanocarphium Blume
401452,Onopordum illyricum f. delortii (Timb.-Lagr.) Rouy,Onopordum illyricum subsp. illyricum,Onopordum illyricum subsp. illyricum,Onopordum illyricum subsp. illyricum,Onopordum illyricum L.,Onopordum × delortii Timb.-Lagr.,Onopordum × delortii Timb.-Lagr.
401453,Onopordum illyricum var. delortii (Timb.-Lagr.) Gaut.,Onopordum illyricum subsp. illyricum,Onopordum illyricum subsp. illyricum,Onopordum illyricum subsp. illyricum,Onopordum illyricum L.,Onopordum × delortii Timb.-Lagr.,Onopordum × delortii Timb.-Lagr.
401616,Arctium intermedium Lange,Cousinia chlorocephala C.A.Mey. ex DC.,Cousinia chlorocephala C.A.Mey. ex DC.,Cousinia chlorocephala C.A.Mey. ex DC.,Cousinia chlorocephala C.A.Mey. ex DC.,Arctium nemorosum Lej.,Arctium nemorosum Lej.
401817,Saussurea multicaulis (DC.) Sch.Bip.,Saussurea alpina (L.) DC.,Saussurea alpina (L.) DC.,Saussurea alpina (L.) DC.,Saussurea alpina (L.) DC.,Saussurea lyrata (Bunge) Franch.,Saussurea lyrata (Bunge) Franch.
405987,Vernonia andohii C.D.Adams,Brenandendron donianum (DC.) H.Rob.,Brenandendron donianum (DC.) H.Rob.,Brenandendron donianum (DC.) H.Rob.,Brenandendron donianum (DC.) H.Rob.,Vernonia andohii C.D.Adams,Vernonia andohii C.D.Adams
407187,Taraxacum acromaurum Dahlst.,Taraxacum cymbifolium H.Lindb. ex Dahlst.,Taraxacum cymbifolium H.Lindb. ex Dahlst.,Taraxacum cymbifolium H.Lindb. ex Dahlst.,Taraxacum cymbifolium H.Lindb. ex Dahlst.,Taraxacum acromaurum Dahlst.,Taraxacum acromaurum Dahlst.
407392,Taraxacum limbatum f. psammophilum (G.E.Haglund) R.Doll,Taraxacum limbatum Dahlst.,Taraxacum limbatum Dahlst.,Taraxacum limbatum Dahlst.,Taraxacum limbatum Dahlst.,Taraxacum psammophilum (G.E.Haglund) Saarsoo,Taraxacum psammophilum (G.E.Haglund) Saarsoo
407437,Taraxacum compactum Schischk.,Taraxacum microspermum Schischk.,Taraxacum microspermum Schischk.,Taraxacum microspermum Schischk.,Taraxacum microspermum Schischk.,Taraxacum compactum Schischk.,Taraxacum compactum Schischk.
408014,Chondrilla sonchifolia (Willd.) Poir.,Lactuca indica L.,Lactuca indica L.,Lactuca indica L.,Lactuca indica L.,Launaea intybacea (Jacq.) Beauverd,Launaea intybacea (Jacq.) Beauverd
408690,Crepis incana Lapeyr.,Andryala integrifolia L.,Andryala integrifolia L.,Andryala integrifolia L.,Andryala integrifolia L.,Andryala ragusina L.,Andryala ragusina L.
409835,Hieracium wiesbaurianum subsp. nervulosum (Arv.-Touv. & Gaut.) Zahn,Hieracium glaucinum subsp. petiolare (Jord.) Greuter,Hieracium glaucinum subsp. petiolare (Jord.) Greuter,Hieracium glaucinum subsp. petiolare (Jord.) Greuter,Hieracium glaucinum Jord.,Hieracium hypochoeroides subsp. nervulosum (Arv.-Touv. & Gaut.) Greuter,Hieracium hypochoeroides S.Gibson
409836,Hieracium wiesbaurianum subsp. subcanens (Arv.-Touv. & Gaut.) Zahn,Hieracium glaucinum subsp. petiolare (Jord.) Greuter,Hieracium glaucinum subsp. petiolare (Jord.) Greuter,Hieracium glaucinum subsp. petiolare (Jord.) Greuter,Hieracium glaucinum Jord.,Hieracium hypochoeroides subsp. subcanens (Arv.-Touv. & Gaut.) Greuter,Hieracium hypochoeroides S.Gibson
409837,Hieracium wiesbaurianum subsp. ventosicum (Arv.-Touv. & Gaut.) Zahn,Hieracium glaucinum subsp. petiolare (Jord.) Greuter,Hieracium glaucinum subsp. petiolare (Jord.) Greuter,Hieracium glaucinum subsp. petiolare (Jord.) Greuter,Hieracium glaucinum Jord.,Hieracium hypochoeroides subsp. ventosicum (Arv.-Touv. & Gaut.) Greuter,Hieracium hypochoeroides S.Gibson
410356,Hieracium wiesbaurianum subsp. lithophilum (Arv.-Touv.) Zahn,Hieracium leiopogon subsp. leiopogon,Hieracium leiopogon subsp. leiopogon,Hieracium leiopogon subsp. leiopogon,Hieracium leiopogon Gren. ex Verl.,Hieracium hypochoeroides subsp. lithophilum (Arv.-Touv.) Greuter,Hieracium hypochoeroides S.Gibson
410357,Hieracium wiesbaurianum subsp. subcinereum (Arv.-Touv. & Gaut.) Zahn,Hieracium leiopogon subsp. leiopogon,Hieracium leiopogon subsp. leiopogon,Hieracium leiopogon subsp. leiopogon,Hieracium leiopogon Gren. ex Verl.,Hieracium hypochoeroides subsp. subcinereum (Arv.-Touv. & Gaut.) Greuter,Hieracium hypochoeroides S.Gibson
410358,Hieracium wiesbaurianum subsp. fissifurcum (Arv.-Touv. & Gaut.) Zahn,Hieracium leiopogon subsp. leiopogon,Hieracium leiopogon subsp. leiopogon,Hieracium leiopogon subsp. leiopogon,Hieracium leiopogon Gren. ex Verl.,Hieracium hypochoeroides subsp. fissifurcum (Arv.-Touv. & Gaut.) Greuter,Hieracium hypochoeroides S.Gibson
412508,Pilosella fennica subsp. exorrhabda (Nägeli & Peter) Soják,Pilosella floribunda (Wimm. & Grab.) Fr.,Pilosella floribunda (Wimm. & Grab.) Fr.,Pilosella floribunda (Wimm. & Grab.) Fr.,Pilosella floribunda (Wimm. & Grab.) Fr.,Pilosella levieri (Peter) Soják,Pilosella levieri (Peter) Soják
412648,Pilosella hypeurya subsp. lamprocoma (Nägeli & Peter) H.P.Fuchs,Pilosella hypeurya (Peter) Soják,Pilosella hypeurya (Peter) Soják,Pilosella hypeurya (Peter) Soják,Pilosella hypeurya (Peter) Soják,Pilosella lamprocoma (Nägeli & Peter) Schljakov,Pilosella lamprocoma (Nägeli & Peter) Schljakov
413103,Pilosella erythriophylla subsp. rojowskii (Rehmann) Soják,Pilosella piloselloides subsp. piloselloides,Pilosella piloselloides subsp. piloselloides,Pilosella piloselloides subsp. piloselloides,Pilosella piloselloides (Vill.) Soják,Pilosella bauhini (Schult.) Arv.-Touv.,Pilosella bauhini (Schult.) Arv.-Touv.
413348,Pilosella ziziana subsp. leptophylla (Nägeli & Peter) Soják,Pilosella ziziana (Tausch) F.W.Schultz & Sch.Bip.,Pilosella ziziana (Tausch) F.W.Schultz & Sch.Bip.,Pilosella ziziana (Tausch) F.W.Schultz & Sch.Bip.,Pilosella ziziana (Tausch) F.W.Schultz & Sch.Bip.,Pilosella densiflora (Tausch) Soják,Pilosella densiflora (Tausch) Soják
413359,Lapsana rhagadiolus L.,Rhagadiolus edulis Gaertn.,Rhagadiolus edulis Gaertn.,Rhagadiolus edulis Gaertn.,Rhagadiolus edulis Gaertn.,Rhagadiolus stellatus (L.) Gaertn.,Rhagadiolus stellatus (L.) Gaertn.
413571,Hedypnois polymorpha subsp. cretica (L.) Arcang.,Hedypnois rhagadioloides (L.) F.W.Schmidt,Hedypnois rhagadioloides (L.) F.W.Schmidt,Hedypnois rhagadioloides (L.) F.W.Schmidt,Hedypnois rhagadioloides (L.) F.W.Schmidt,Hedypnois cretica (L.) Dum.Cours.,Hedypnois cretica (L.) Dum.Cours.
413573,Hedypnois cretica (L.) Dum.Cours.,Hedypnois rhagadioloides (L.) F.W.Schmidt,Hedypnois rhagadioloides (L.) F.W.Schmidt,Hedypnois rhagadioloides (L.) F.W.Schmidt,Hedypnois rhagadioloides (L.) F.W.Schmidt,Hedypnois cretica (L.) Dum.Cours.,Hedypnois cretica (L.) Dum.Cours.
413576,Hedypnois cretica var. gracilior Boiss.,Hedypnois rhagadioloides (L.) F.W.Schmidt,Hedypnois rhagadioloides (L.) F.W.Schmidt,Hedypnois rhagadioloides (L.) F.W.Schmidt,Hedypnois rhagadioloides (L.) F.W.Schmidt,Hedypnois cretica (L.) Dum.Cours.,Hedypnois cretica (L.) Dum.Cours.
413577,Hedypnois polymorpha var. cretica (L.) Rouy,Hedypnois rhagadioloides (L.) F.W.Schmidt,Hedypnois rhagadioloides (L.) F.W.Schmidt,Hedypnois rhagadioloides (L.) F.W.Schmidt,Hedypnois rhagadioloides (L.) F.W.Schmidt,Hedypnois cretica (L.) Dum.Cours.,Hedypnois cretica (L.) Dum.Cours.
413596,Hedypnois rhagadioloides subsp. cretica (L.) Hayek,Hedypnois rhagadioloides (L.) F.W.Schmidt,Hedypnois rhagadioloides (L.) F.W.Schmidt,Hedypnois rhagadioloides (L.) F.W.Schmidt,Hedypnois rhagadioloides (L.) F.W.Schmidt,Hedypnois cretica (L.) Dum.Cours.,Hedypnois cretica (L.) Dum.Cours.
413599,Hyoseris cretica L.,Hedypnois rhagadioloides (L.) F.W.Schmidt,Hedypnois rhagadioloides (L.) F.W.Schmidt,Hedypnois rhagadioloides (L.) F.W.Schmidt,Hedypnois rhagadioloides (L.) F.W.Schmidt,Hedypnois cretica (L.) Dum.Cours.,Hedypnois cretica (L.) Dum.Cours.
413607,Rhagadiolus creticus (L.) All.,Hedypnois rhagadioloides (L.) F.W.Schmidt,Hedypnois rhagadioloides (L.) F.W.Schmidt,Hedypnois rhagadioloides (L.) F.W.Schmidt,Hedypnois rhagadioloides (L.) F.W.Schmidt,Hedypnois cretica (L.) Dum.Cours.,Hedypnois cretica (L.) Dum.Cours.
415056,Tephroseris tenuifolia (Gaudin) Holub,Tephroseris helenitis (L.) B.Nord.,Tephroseris helenitis (L.) B.Nord.,Tephroseris helenitis (L.) B.Nord.,Tephroseris helenitis (L.) B.Nord.,Tephroseris longifolia (Jacq.) Griseb. & Schenk,Tephroseris longifolia (Jacq.) Griseb. & Schenk
415091,Tephroseris microrrhiza Schur,Tephroseris integrifolia subsp. integrifolia,Tephroseris integrifolia subsp. integrifolia,Tephroseris integrifolia subsp. integrifolia,Tephroseris integrifolia (L.) Holub,Tephroseris papposa subsp. papposa,Tephroseris papposa (Rchb.) Schur
415170,Tephroseris papposa subsp. kitaibelii (Jáv.) B.Nord.,Tephroseris papposa subsp. papposa,Tephroseris papposa subsp. papposa,Tephroseris papposa subsp. papposa,Tephroseris papposa (Rchb.) Schur,Tephroseris crassifolia Griseb. & Schenk,Tephroseris crassifolia Griseb. & Schenk
415878,Senecio cliffordii N.D.Atwood & S.L.Welsh,Packera spellenbergii (T.M.Barkley) C.Jeffrey,Packera spellenbergii (T.M.Barkley) C.Jeffrey,Packera spellenbergii (T.M.Barkley) C.Jeffrey,Packera spellenbergii (T.M.Barkley) C.Jeffrey,Packera cliffordii (N.D.Atwood & S.L.Welsh) O'Kane,Packera cliffordii (N.D.Atwood & S.L.Welsh) O'Kane
416224,Senecio humillimus var. vegetus Wedd.,Senecio humillimus Sch.Bip.,Senecio humillimus Sch.Bip.,Senecio humillimus Sch.Bip.,Senecio humillimus Sch.Bip.,Senecio vegetus (Wedd.) Cabrera,Senecio vegetus (Wedd.) Cabrera
416898,Monadenium lunulatum Chiov.,Kleinia pendula (Forssk.) DC.,Kleinia pendula (Forssk.) DC.,Kleinia pendula (Forssk.) DC.,Kleinia pendula (Forssk.) DC.,Kleinia lunulata (Chiov.) Thulin,Kleinia lunulata (Chiov.) Thulin
418866,Helichrysum banksii A.Cunn. ex DC.,Xerochrysum bracteatum (Vent.) Tzvelev,Xerochrysum bracteatum (Vent.) Tzvelev,Xerochrysum bracteatum (Vent.) Tzvelev,Xerochrysum bracteatum (Vent.) Tzvelev,Xerochrysum banksii (A.Cunn. ex DC.) T.L.Collins & I.Telford,Xerochrysum banksii (A.Cunn. ex DC.) T.L.Collins & I.Telford
419436,Gnaphalium petiolatum L.,Helichrysum petiolare Hilliard & B.L.Burtt,Helichrysum petiolare Hilliard & B.L.Burtt,Helichrysum petiolare Hilliard & B.L.Burtt,Helichrysum petiolare Hilliard & B.L.Burtt,Staehelina petiolata (L.) Hilliard & B.L.Burtt,Staehelina petiolata (L.) Hilliard & B.L.Burtt
421141,Olearia hookeri var. microcephala Benth.,Olearia hookeri (F.Muell. ex Sond.) Benth.,Olearia hookeri (F.Muell. ex Sond.) Benth.,Olearia hookeri (F.Muell. ex Sond.) Benth.,Olearia hookeri (F.Muell. ex Sond.) Benth.,Olearia ramulosa (Labill.) Benth.,Olearia ramulosa (Labill.) Benth.
423233,Solidago galetorum (Greene) Friesner,Euthamia caroliniana (L.) Greene ex Porter & Britton,Euthamia caroliniana (L.) Greene ex Porter & Britton,Euthamia caroliniana (L.) Greene ex Porter & Britton,Euthamia caroliniana (L.) Greene ex Porter & Britton,Euthamia galetorum Greene,Euthamia galetorum Greene
425977,Artemisia aethiopica L.,Artemisia herba-alba Asso,Artemisia herba-alba Asso,Artemisia herba-alba Asso,Artemisia herba-alba Asso,Artemisia argentea L'Hér.,Artemisia argentea L'Hér.
426052,Artemisia inculta Delile,Artemisia sieberi Besser,Artemisia sieberi Besser,Artemisia sieberi Besser,Artemisia sieberi Besser,Artemisia inculta Delile,Artemisia inculta Delile
427073,Leucanthemum vulgare subsp. eliasii (Sennen & Pau) Sennen & Pau,Leucanthemum vulgare subsp. vulgare,Leucanthemum vulgare subsp. vulgare,Leucanthemum vulgare subsp. vulgare,Leucanthemum vulgare Lam.,"Leucanthemum eliasii (Sennen & Pau) Vogt, Konowalik & Oberpr.","Leucanthemum eliasii (Sennen & Pau) Vogt, Konowalik & Oberpr."
427276,Leucanthemum vulgare var. pallidum (Fiori) Briq. & Cavill.,Leucanthemum pallens (J.Gay ex Perreym.) DC.,Leucanthemum pallens (J.Gay ex Perreym.) DC.,Leucanthemum pallens (J.Gay ex Perreym.) DC.,Leucanthemum pallens (J.Gay ex Perreym.) DC.,Leucanthemum ircutianum subsp. leucolepis (Briq. & Cavill.) Vogt & Greuter,Leucanthemum ircutianum DC.
428906,Coreopsis nuecensoides E.B.Sm.,Coreopsis nuecensis A.Heller,Coreopsis nuecensis A.Heller,Coreopsis nuecensis A.Heller,Coreopsis nuecensis A.Heller,Coreopsis nuecensoides E.B.Sm.,Coreopsis nuecensoides E.B.Sm.
429111,Enydra woollsii F.Muell.,Enydra fluctuans Lour.,Enydra fluctuans Lour.,Enydra fluctuans Lour.,Enydra fluctuans Lour.,Enydra woollsii F.Muell.,Enydra woollsii F.Muell.
429228,Franseria bipinnatifida Nutt.,Ambrosia camphorata (Greene) W.W.Payne,Ambrosia camphorata (Greene) W.W.Payne,Ambrosia camphorata (Greene) W.W.Payne,Ambrosia camphorata (Greene) W.W.Payne,Ambrosia chamissonis (Less.) Greene,Ambrosia chamissonis (Less.) Greene
430566,Wedelia macrodonta var. parviflora Hassl.,Wedelia macrodonta DC.,Wedelia macrodonta DC.,Wedelia macrodonta DC.,Wedelia macrodonta DC.,Wedelia pallida Gardner,Wedelia pallida Gardner
437875,Selaginella hengduanshanicola W.M.Chu,Selaginella helvetica subsp. helvetica,Selaginella helvetica subsp. helvetica,Selaginella helvetica subsp. helvetica,Selaginella helvetica (L.) Spring,Selaginella tibetica Ching & S.K.Wu,Selaginella tibetica Ching & S.K.Wu
437877,Selaginella tibetica Ching & S.K.Wu,Selaginella helvetica subsp. helvetica,Selaginella helvetica subsp. helvetica,Selaginella helvetica subsp. helvetica,Selaginella helvetica (L.) Spring,Selaginella tibetica Ching & S.K.Wu,Selaginella tibetica Ching & S.K.Wu
438054,Selaginella jugorum Hand.-Mazz.,Selaginella nipponica Franch. & Sav.,Selaginella nipponica Franch. & Sav.,Selaginella nipponica Franch. & Sav.,Selaginella nipponica Franch. & Sav.,Selaginella jugorum Hand.-Mazz.,Selaginella jugorum Hand.-Mazz.
438580,Isoetes lacustris subsp. brochonii (Motelay) R.C.V.Douin,Isoetes lacustris L.,Isoetes lacustris L.,Isoetes lacustris L.,Isoetes lacustris L.,Isoetes × brochonii Motelay,Isoetes × brochonii Motelay
438748,Lycopodium complanatum subvar. foliaceum Farw.,Lycopodium complanatum L.,Lycopodium complanatum L.,Lycopodium complanatum L.,Lycopodium complanatum L.,Lycopodium digitatum Dill. ex A.Braun,Lycopodium digitatum Dill. ex A.Braun
440056,Trichomanes commutatum J.W.Sturm,Trichomanes pedicellatum Desv.,Trichomanes pedicellatum Desv.,Trichomanes pedicellatum Desv.,Trichomanes pedicellatum Desv.,Trichomanes ankersii C.Parker ex Hook. & Grev.,Trichomanes ankersii C.Parker ex Hook. & Grev.
440127,Dicranopteris linearis var. latiloba Holttum,Dicranopteris splendida (Hand.-Mazz.) Tagawa,Dicranopteris splendida (Hand.-Mazz.) Tagawa,Dicranopteris splendida (Hand.-Mazz.) Tagawa,Dicranopteris splendida (Hand.-Mazz.) Tagawa,Dicranopteris linearis var. latiloba Holttum,Dicranopteris linearis (Burm.f.) Underw.
442346,Asplenium surinamense Fée,Asplenium angustum Sw.,Asplenium angustum Sw.,Asplenium angustum Sw.,Asplenium angustum Sw.,Asplenium serratum L.,Asplenium serratum L.
442916,Davallia hosei Baker,Tapeinidium luzonicum (Hook.) K.U.Kramer,Tapeinidium luzonicum (Hook.) K.U.Kramer,Tapeinidium luzonicum (Hook.) K.U.Kramer,Tapeinidium luzonicum (Hook.) K.U.Kramer,Tapeinidium gracile (Blume) Alderw.,Tapeinidium gracile (Blume) Alderw.
443948,Dryopteris thelypteris var. koreana Nakai,Thelypteris palustris subsp. palustris,Thelypteris palustris subsp. palustris,Thelypteris palustris subsp. palustris,Thelypteris palustris Schott,Thelypteris glanduligera var. glanduligera,Thelypteris glanduligera (Kunze) Ching
445461,Polystichum pseudomakinoi var. ambiguum Tagawa,Polystichum pseudomakinoi Tagawa,Polystichum pseudomakinoi Tagawa,Polystichum pseudomakinoi Tagawa,Polystichum pseudomakinoi Tagawa,Polystichum tagawanum Sa.Kurata,Polystichum tagawanum Sa.Kurata
445606,Dryopteris nokoensis Tagawa,Dryopteris nidus (Baker) Li Bing Zhang,Dryopteris nidus (Baker) Li Bing Zhang,Dryopteris nidus (Baker) Li Bing Zhang,Dryopteris nidus (Baker) Li Bing Zhang,Dryopteris transmorrisonensis (Hayata) Hayata,Dryopteris transmorrisonensis (Hayata) Hayata
445898,Arachniodes fengyangshanensis Cheng & C.F.Zhang ex Y.T.Hsieh,Arachniodes aristata (G.Forst.) Tindale,Arachniodes aristata (G.Forst.) Tindale,Arachniodes aristata (G.Forst.) Tindale,Arachniodes aristata (G.Forst.) Tindale,Arachniodes carvifolia (Kunze) Ching,Arachniodes carvifolia (Kunze) Ching
448338,Loxogramme biformis Tagawa,Loxogramme salicifolia (Makino) Makino,Loxogramme salicifolia (Makino) Makino,Loxogramme salicifolia (Makino) Makino,Loxogramme salicifolia (Makino) Makino,Loxogramme biformis Tagawa,Loxogramme biformis Tagawa
448713,Pyrrosia intermedia (Goy) K.H.Shing,Pyrrosia drakeana (Franch.) Ching,Pyrrosia drakeana (Franch.) Ching,Pyrrosia drakeana (Franch.) Ching,Pyrrosia drakeana (Franch.) Ching,Pyrrosia confluens var. dielsii (C.Chr.) Hovenkamp,Pyrrosia confluens (R.Br.) Ching
449325,Polypodium acrosorum Kunze,Niphidium anocarpos (Kunze) Lellinger,Niphidium anocarpos (Kunze) Lellinger,Niphidium anocarpos (Kunze) Lellinger,Niphidium anocarpos (Kunze) Lellinger,Niphidium crassifolium (L.) Lellinger,Niphidium crassifolium (L.) Lellinger
449533,Polypodium gauthieri (Fée) C.Chr.,Serpocaulon triseriale (Sw.) A.R.Sm.,Serpocaulon triseriale (Sw.) A.R.Sm.,Serpocaulon triseriale (Sw.) A.R.Sm.,Serpocaulon triseriale (Sw.) A.R.Sm.,Serpocaulon meniscifolium (Langsd. & Fisch.) A.R.Sm.,Serpocaulon meniscifolium (Langsd. & Fisch.) A.R.Sm.
449865,Microtrichomanes parvulum (Poir.) Copel.,Trichomanes tamarisciforme Jacq.,Trichomanes tamarisciforme Jacq.,Trichomanes tamarisciforme Jacq.,Trichomanes tamarisciforme Jacq.,Trichomanes parvulum Poir.,Trichomanes parvulum Poir.
450029,Lacosteopsis orientalis (C.Chr.) Nakaike,Trichomanes birmanicum Bedd.,Trichomanes birmanicum Bedd.,Trichomanes birmanicum Bedd.,Trichomanes birmanicum Bedd.,Trichomanes orientale C.Chr.,Trichomanes orientale C.Chr.
450259,Gymnosphaera melanotricha (Tardieu) Tardieu,Alsophila bullata Baker,Alsophila bullata Baker,,,Gymnosphaera boivinii var. lobata (Rakotondr.) S.Y.Dong,Gymnosphaera boivinii (Mett. ex Ettingsh.) Tardieu
450261,Alsophila castanea Baker,Alsophila bullata Baker,Alsophila bullata Baker,,,Gymnosphaera boivinii var. boivinii,Gymnosphaera boivinii (Mett. ex Ettingsh.) Tardieu
450262,Alsophila melanotricha Tardieu,Alsophila bullata Baker,Alsophila bullata Baker,,,Gymnosphaera boivinii var. lobata (Rakotondr.) S.Y.Dong,Gymnosphaera boivinii (Mett. ex Ettingsh.) Tardieu
450263,Cyathea badia Domin,Alsophila bullata Baker,Alsophila bullata Baker,,,Gymnosphaera boivinii var. boivinii,Gymnosphaera boivinii (Mett. ex Ettingsh.) Tardieu
450265,Cyathea melanotricha (Tardieu) Tindale,Alsophila bullata Baker,Alsophila bullata Baker,,,Gymnosphaera boivinii var. lobata (Rakotondr.) S.Y.Dong,Gymnosphaera boivinii (Mett. ex Ettingsh.) Tardieu
450266,Cyathea rigidula Baker,Alsophila bullata Baker,Alsophila bullata Baker,,,Gymnosphaera boivinii var. boivinii,Gymnosphaera boivinii (Mett. ex Ettingsh.) Tardieu
452373,Dryopteris presliana Ching,Thelypteris gymnopteridifrons (Hayata) C.M.Kuo,Thelypteris gymnopteridifrons (Hayata) C.M.Kuo,Thelypteris gymnopteridifrons (Hayata) C.M.Kuo,Thelypteris gymnopteridifrons (Hayata) C.M.Kuo,Thelypteris aspera (C.Presl) K.Iwats.,Thelypteris aspera (C.Presl) K.Iwats.
452374,Abacopteris presliana Ching,Thelypteris gymnopteridifrons (Hayata) C.M.Kuo,Thelypteris gymnopteridifrons (Hayata) C.M.Kuo,Thelypteris gymnopteridifrons (Hayata) C.M.Kuo,Thelypteris gymnopteridifrons (Hayata) C.M.Kuo,Thelypteris aspera (C.Presl) K.Iwats.,Thelypteris aspera (C.Presl) K.Iwats.
452379,Alsophila fragilis Zoll. & Moritzi,Thelypteris lineata (Blume) K.Iwats.,Thelypteris lineata (Blume) K.Iwats.,Thelypteris lineata (Blume) K.Iwats.,Thelypteris lineata (Blume) K.Iwats.,Arachniodes aristata (G.Forst.) Tindale,Arachniodes aristata (G.Forst.) Tindale
452384,Meniscium fragile Kunze,Thelypteris lineata (Blume) K.Iwats.,Thelypteris lineata (Blume) K.Iwats.,Thelypteris lineata (Blume) K.Iwats.,Thelypteris lineata (Blume) K.Iwats.,Arachniodes aristata (G.Forst.) Tindale,Arachniodes aristata (G.Forst.) Tindale
453310,Arachniodes heyuanensis Ching,Arachniodes cornu-cervi (D.Don) Fraser-Jenk.,Arachniodes cornu-cervi (D.Don) Fraser-Jenk.,Arachniodes cornu-cervi (D.Don) Fraser-Jenk.,Arachniodes cornu-cervi (D.Don) Fraser-Jenk.,Arachniodes carvifolia (Kunze) Ching,Arachniodes carvifolia (Kunze) Ching
453416,Paradavallodes chingiae (Ching) Ching,Davallodes membranulosa (Wall. ex Hook.) Copel.,Davallodes membranulosa (Wall. ex Hook.) Copel.,Davallodes membranulosa (Wall. ex Hook.) Copel.,Davallodes membranulosa (Wall. ex Hook.) Copel.,Davallodes chingiae Ching,Davallodes chingiae Ching
459502,Mappia ovata var. insularis Matsum.,Mappia nimmoniana (J.Graham) Byng & Stull,Mappia nimmoniana (J.Graham) Byng & Stull,Mappia nimmoniana (J.Graham) Byng & Stull,Mappia nimmoniana (J.Graham) Byng & Stull,Mappia insularis (Matsum.) Hatus.,Mappia insularis (Matsum.) Hatus.
459998,Ulex parviflorus subsp. willkommii (Webb) Borja & al.,Ulex parviflorus subsp. parviflorus,Ulex parviflorus subsp. parviflorus,Ulex parviflorus subsp. parviflorus,Ulex parviflorus Pourr.,Stauracanthus genistoides (Brot.) Samp.,Stauracanthus genistoides (Brot.) Samp.
460001,Ulex parviflorus var. willkommii (Webb) C.Vicioso,Ulex parviflorus subsp. parviflorus,Ulex parviflorus subsp. parviflorus,Ulex parviflorus subsp. parviflorus,Ulex parviflorus Pourr.,Stauracanthus genistoides (Brot.) Samp.,Stauracanthus genistoides (Brot.) Samp.
460003,Ulex scaber var. willkommii (Webb) Samp.,Ulex parviflorus subsp. parviflorus,Ulex parviflorus subsp. parviflorus,Ulex parviflorus subsp. parviflorus,Ulex parviflorus Pourr.,Stauracanthus genistoides (Brot.) Samp.,Stauracanthus genistoides (Brot.) Samp.
460007,Ulex willkommii Webb,Ulex parviflorus subsp. parviflorus,Ulex parviflorus subsp. parviflorus,Ulex parviflorus subsp. parviflorus,Ulex parviflorus Pourr.,Stauracanthus genistoides (Brot.) Samp.,Stauracanthus genistoides (Brot.) Samp.
460050,Acacia seyal var. kassonionga De Wild.,Vachellia seyal var. seyal,Vachellia seyal var. seyal,Vachellia seyal var. seyal,Vachellia seyal (Delile) P.J.H.Hurter,Vachellia hockii (De Wild.) Seigler & Ebinger,Vachellia hockii (De Wild.) Seigler & Ebinger
460052,Acacia seyal var. lescrauwaetii De Wild.,Vachellia seyal var. seyal,Vachellia seyal var. seyal,Vachellia seyal var. seyal,Vachellia seyal (Delile) P.J.H.Hurter,Vachellia hockii (De Wild.) Seigler & Ebinger,Vachellia hockii (De Wild.) Seigler & Ebinger
460054,Acacia seyal var. seretii De Wild.,Vachellia seyal var. seyal,Vachellia seyal var. seyal,Vachellia seyal var. seyal,Vachellia seyal (Delile) P.J.H.Hurter,Vachellia hockii (De Wild.) Seigler & Ebinger,Vachellia hockii (De Wild.) Seigler & Ebinger
462564,Helianthemum apenninum var. croceum (Desf.) Pau,Helianthemum apenninum subsp. stoechadifolium (Brot.) Samp.,Helianthemum apenninum subsp. stoechadifolium (Brot.) Samp.,Helianthemum apenninum subsp. stoechadifolium (Brot.) Samp.,Helianthemum apenninum (L.) Mill.,Helianthemum croceum (Desf.) Pers.,Helianthemum croceum (Desf.) Pers.
464542,Scorzonera tuberosa var. sericeolanata Bunge,"Gelasia tuberosa (Pall.) Zaika, Sukhor. & N.Kilian","Gelasia tuberosa (Pall.) Zaika, Sukhor. & N.Kilian","Gelasia tuberosa (Pall.) Zaika, Sukhor. & N.Kilian","Gelasia tuberosa (Pall.) Zaika, Sukhor. & N.Kilian",Scorzonera sericeolanata (Bunge) Krasch. & Lipsch.,Scorzonera sericeolanata (Bunge) Krasch. & Lipsch.
467672,Lithops karasmontana var. aiaisensis (de Boer) D.T.Cole,Lithops karasmontana subsp. karasmontana,Lithops karasmontana subsp. karasmontana,Lithops karasmontana subsp. karasmontana,Lithops karasmontana (Dinter & Schwantes) N.E.Br.,Lithops eberlanzii var. aiaisensis (de Boer) R.A.Earle & A.J.Young,Lithops eberlanzii (Dinter & Schwantes) N.E.Br.
468594,Navarretia pilosifaucis H.St.John & Weitman,Navarretia intertexta subsp. intertexta,Navarretia intertexta subsp. intertexta,Navarretia intertexta subsp. intertexta,Navarretia intertexta (Benth.) Hook.,Navarretia leucocephala subsp. suksdorfii (Howell) L.A.Johnson & D.Gowen,Navarretia leucocephala Benth.
469055,Odontites divergens Jord.,Odontites vulgaris subsp. vulgaris,Odontites vulgaris subsp. vulgaris,Odontites vulgaris subsp. vulgaris,Odontites vulgaris Moench,Odontites vernus subsp. vernus,Odontites vernus (Bellardi) Dumort.
469070,Odontites serotinus var. divergens (Jord.) Corb.,Odontites vulgaris subsp. vulgaris,Odontites vulgaris subsp. vulgaris,Odontites vulgaris subsp. vulgaris,Odontites vulgaris Moench,Odontites vernus subsp. vernus,Odontites vernus (Bellardi) Dumort.
469080,Odontites ruber subsp. canescens (Rchb.) Pignatti,Odontites vulgaris subsp. vulgaris,Odontites vulgaris subsp. vulgaris,Odontites vulgaris subsp. vulgaris,Odontites vulgaris Moench,Odontites vernus subsp. vernus,Odontites vernus (Bellardi) Dumort.
469085,Odontites vulgaris subsp. pumilus (Nordst.) Soó,Odontites vulgaris subsp. vulgaris,Odontites vulgaris subsp. vulgaris,Odontites vulgaris subsp. vulgaris,Odontites vulgaris Moench,Odontites vernus subsp. vernus,Odontites vernus (Bellardi) Dumort.
469087,Odontites vulgaris subsp. canescens (Rchb.) Soó,Odontites vulgaris subsp. vulgaris,Odontites vulgaris subsp. vulgaris,Odontites vulgaris subsp. vulgaris,Odontites vulgaris Moench,Odontites vernus subsp. vernus,Odontites vernus (Bellardi) Dumort.
469091,Odontites vernus var. canescens (Rchb.) E.Mayer,Odontites vulgaris subsp. vulgaris,Odontites vulgaris subsp. vulgaris,Odontites vulgaris subsp. vulgaris,Odontites vulgaris Moench,Odontites vernus subsp. vernus,Odontites vernus (Bellardi) Dumort.
