681359,Knautia dipsacifolia subsp. arvernensis (Briq.) O.Bolòs & Vigo,Knautia subcanescens Jord.,Knautia subcanescens Jord.,Knautia subcanescens Jord.,Knautia subcanescens Jord.,Knautia arvernensis (Briq.) Szabó,Knautia arvernensis (Briq.) Szabó
681675,Lobivia pentlandii var. forbesii (A.Dietr.) Y.Itô ex Backeb.,Lobivia pentlandii (Hook.) Britton & Rose,Lobivia pentlandii (Hook.) Britton & Rose,Lobivia pentlandii (Hook.) Britton & Rose,Lobivia pentlandii (Hook.) Britton & Rose,Acanthocalycium rhodotrichum subsp. rhodotrichum,Acanthocalycium rhodotrichum (K.Schum.) Schlumpb.
681747,Lepidium heterophyllum f. canescens (Gren. & Godr.) Samp.,Lepidium hirtum (L.) Sm.,Lepidium hirtum (L.) Sm.,Lepidium hirtum (L.) Sm.,Lepidium hirtum (L.) Sm.,Lepidium heterophyllum subsp. heterophyllum,Lepidium heterophyllum Benth.
681983,Lepidium orbiculare H.St.John,Lepidium serra H.Mann,Lepidium serra H.Mann,Lepidium serra H.Mann,Lepidium serra H.Mann,Lepidium orbiculare H.St.John,Lepidium orbiculare H.St.John
682945,Leea talbotii King ex Talbot,Leea macrophylla Roxb. ex Hornem.,Leea macrophylla Roxb. ex Hornem.,Leea macrophylla Roxb. ex Hornem.,Leea macrophylla Roxb. ex Hornem.,Leea setuligera C.B.Clarke,Leea setuligera C.B.Clarke
682974,Leea sambucina Willd.,Leea javanica Blume,Leea javanica Blume,Leea javanica Blume,Leea javanica Blume,Leea indica (Burm.f.) Merr.,Leea indica (Burm.f.) Merr.
684289,"Tetragonolobus bivonaeus (Guss.) Ces., Pass. & Gibelli",Lotus biflorus Desr.,Lotus biflorus Desr.,Lotus biflorus Desr.,Lotus biflorus Desr.,Lotus maritimus L.,Lotus maritimus L.
684381,Lotus cytisoides subsp. conradiae Gamisans,Lotus cytisoides L.,Lotus cytisoides L.,Lotus cytisoides L.,Lotus cytisoides L.,Lotus creticus L.,Lotus creticus L.
684985,Linum austriacum var. saxicola (Jord.) Nyman,Linum alpinum Jacq.,Linum alpinum Jacq.,Linum alpinum Jacq.,Linum alpinum Jacq.,Linum austriacum subsp. austriacum,Linum austriacum L.
686070,Lathyrus rigidus var. pilosellus M.Peck,Lathyrus rigidus T.G.White,Lathyrus rigidus T.G.White,Lathyrus rigidus T.G.White,Lathyrus rigidus T.G.White,Lathyrus nevadensis var. nevadensis,Lathyrus nevadensis S.Watson
687262,Lomatium alatum var. purpureum Jeps.,Lomatium triternatum var. macrocarpum (J.M.Coult. & Rose) Mathias,Lomatium triternatum var. macrocarpum (J.M.Coult. & Rose) Mathias,Lomatium triternatum var. macrocarpum (J.M.Coult. & Rose) Mathias,Lomatium triternatum (Pursh) J.M.Coult. & Rose,Lomatium caruifolium var. caruifolium,Lomatium caruifolium (Hook. & Arn.) J.M.Coult. & Rose
694057,Gilia minima var. caerulea Orcutt,Navarretia leucocephala subsp. minima (Nutt.) A.G.Day,Navarretia leucocephala subsp. minima (Nutt.) A.G.Day,Navarretia minima Nutt.,Navarretia minima Nutt.,Navarretia leucocephala subsp. suksdorfii (Howell) L.A.Johnson & D.Gowen,Navarretia leucocephala Benth.
694059,Navarretia suksdorfii Howell,Navarretia leucocephala subsp. minima (Nutt.) A.G.Day,Navarretia leucocephala subsp. minima (Nutt.) A.G.Day,Navarretia minima Nutt.,Navarretia minima Nutt.,Navarretia leucocephala subsp. suksdorfii (Howell) L.A.Johnson & D.Gowen,Navarretia leucocephala Benth.
696201,Ononis natrix subsp. picta (Desf.) Nyman,Ononis natrix L.,Ononis natrix L.,Ononis natrix L.,Ononis natrix L.,Ononis ramosissima Desf.,Ononis ramosissima Desf.
696202,Ononis natrix proles picta (Desf.) Samp.,Ononis natrix L.,Ononis natrix L.,Ononis natrix L.,Ononis natrix L.,Ononis ramosissima Desf.,Ononis ramosissima Desf.
697121,Onosma incanescens DC.,Onosma rostellata Lehm.,Onosma rostellata Lehm.,Onosma rostellata Lehm.,Onosma rostellata Lehm.,Maharanga incanescens (DC.) L.Cecchi & Hilger,Maharanga incanescens (DC.) L.Cecchi & Hilger
697772,Oxalis diffusa Boreau,Oxalis corniculata L.,Oxalis corniculata L.,Oxalis corniculata L.,Oxalis corniculata L.,Oxalis dillenii Jacq.,Oxalis dillenii Jacq.
697785,Oxalis corniculata var. longepedunculata (Sennen) R.Knuth,Oxalis corniculata L.,Oxalis corniculata L.,Oxalis corniculata L.,Oxalis corniculata L.,Oxalis stricta L.,Oxalis stricta L.
698062,Oxalis corniculata proles navieri (Jord.) Rouy,Oxalis dillenii Jacq.,Oxalis dillenii Jacq.,Oxalis dillenii Jacq.,Oxalis dillenii Jacq.,Oxalis stricta L.,Oxalis stricta L.
698064,Oxalis corniculata subsp. navieri (Jord.) Tourlet,Oxalis dillenii Jacq.,Oxalis dillenii Jacq.,Oxalis dillenii Jacq.,Oxalis dillenii Jacq.,Oxalis stricta L.,Oxalis stricta L.
698066,Xanthoxalis dillenii var. piletorum (Wiegand) Holub,Oxalis dillenii Jacq.,Oxalis dillenii Jacq.,Oxalis dillenii Jacq.,Oxalis dillenii Jacq.,Oxalis stricta L.,Oxalis stricta L.
698068,Oxalis dillenii var. piletorum (Wiegand) Priszter,Oxalis dillenii Jacq.,Oxalis dillenii Jacq.,Oxalis dillenii Jacq.,Oxalis dillenii Jacq.,Oxalis stricta L.,Oxalis stricta L.
698070,Oxalis longepedunculata Sennen,Oxalis dillenii Jacq.,Oxalis dillenii Jacq.,Oxalis dillenii Jacq.,Oxalis dillenii Jacq.,Oxalis stricta L.,Oxalis stricta L.
698074,Oxalis stricta var. navieri (Jord.) Nyman,Oxalis dillenii Jacq.,Oxalis dillenii Jacq.,Oxalis dillenii Jacq.,Oxalis dillenii Jacq.,Oxalis stricta L.,Oxalis stricta L.
699917,Ouratea oleifolia var. subvelutina (Planch.) Engl.,Ouratea oleifolia (A.St.-Hil.) Engl.,Ouratea oleifolia (A.St.-Hil.) Engl.,Ouratea oleifolia (A.St.-Hil.) Engl.,Ouratea oleifolia (A.St.-Hil.) Engl.,Ouratea subvelutina (Planch.) Sastre & Offroy,Ouratea subvelutina (Planch.) Sastre & Offroy
701665,Kohlrauschia prolifera subsp. nanteuilii (Burnat) M.Laínz,Petrorhagia prolifera (L.) P.W.Ball & Heywood,Petrorhagia prolifera (L.) P.W.Ball & Heywood,Petrorhagia prolifera (L.) P.W.Ball & Heywood,Petrorhagia prolifera (L.) P.W.Ball & Heywood,Petrorhagia nanteuilii (Burnat) P.W.Ball & Heywood,Petrorhagia nanteuilii (Burnat) P.W.Ball & Heywood
701897,Polyosma laetevirens var. robusta Ridl.,Polyosma ridleyi King,Polyosma ridleyi King,Polyosma ridleyi King,Polyosma ridleyi King,Polyosma robusta (Ridl.) Saw,Polyosma robusta (Ridl.) Saw
702839,Pachira aquatica var. manausensis A.Robyns,Pachira aquatica Aubl.,Pachira aquatica Aubl.,Pachira aquatica Aubl.,Pachira aquatica Aubl.,Pachira manausensis (A.Robyns) V.N.Yoshik. & C.D.M.Ferreira,Pachira manausensis (A.Robyns) V.N.Yoshik. & C.D.M.Ferreira
703272,Notocactus katharinae Vliet,Parodia herteri (Werderm.) N.P.Taylor,Parodia herteri (Werderm.) N.P.Taylor,Parodia herteri (Werderm.) N.P.Taylor,Parodia herteri (Werderm.) N.P.Taylor,Parodia horstii (F.Ritter) N.P.Taylor,Parodia horstii (F.Ritter) N.P.Taylor
703699,Notocactus muegelianus T.Engel,Parodia ottonis (Lehm.) N.P.Taylor,Parodia ottonis (Lehm.) N.P.Taylor,Parodia ottonis (Lehm.) N.P.Taylor,Parodia ottonis (Lehm.) N.P.Taylor,Parodia horstii (F.Ritter) N.P.Taylor,Parodia horstii (F.Ritter) N.P.Taylor
708676,Terminalia eriantha Benth.,Terminalia dichotoma G.Mey.,Terminalia dichotoma G.Mey.,Terminalia dichotoma G.Mey.,Terminalia dichotoma G.Mey.,Terminalia lucida Hoffmanns. ex Mart.,Terminalia lucida Hoffmanns. ex Mart.
711879,Trianthema decandrum var. flavum (Blatt. & Hallb.) Santapau,Zaleya decandra (L.) Burm.f.,Zaleya decandra (L.) Burm.f.,Zaleya decandra (L.) Burm.f.,Zaleya decandra (L.) Burm.f.,Zaleya govindia (Buch.-Ham. ex G.Don) N.C.Nair,Zaleya govindia (Buch.-Ham. ex G.Don) N.C.Nair
711882,Trianthema pentandrum var. flavum Blatt. & Hallb.,Zaleya decandra (L.) Burm.f.,Zaleya decandra (L.) Burm.f.,Zaleya decandra (L.) Burm.f.,Zaleya decandra (L.) Burm.f.,Zaleya govindia (Buch.-Ham. ex G.Don) N.C.Nair,Zaleya govindia (Buch.-Ham. ex G.Don) N.C.Nair
713193,Ulmarronia corymbosa (L.) Friesen,Varronia polycephala Lam.,Varronia polycephala Lam.,Varronia polycephala Lam.,Varronia polycephala Lam.,Varronia linnaei (Stearn) J.S.Mill.,Varronia linnaei (Stearn) J.S.Mill.
714532,Viola tenella Poir.,Viola parvula Tineo,Viola parvula Tineo,Viola parvula Tineo,Viola parvula Tineo,Viola kitaibeliana subsp. kitaibeliana,Viola kitaibeliana Schult.
714619,Viola × montivaga House,Viola × melissifolia Greene,Viola × melissifolia Greene,Viola × melissifolia Greene,Viola × melissifolia Greene,Viola × montivaga House,Viola × montivaga House
714680,Viola emarginata var. acutiloba Brainerd,Viola sagittata Aiton,Viola sagittata Aiton,Viola sagittata Aiton,Viola sagittata Aiton,Viola × holmiana House,Viola × holmiana House
714692,Viola alleghanensis Schult.,Viola sagittata Aiton,Viola sagittata Aiton,Viola sagittata Aiton,Viola sagittata Aiton,Viola fimbriatula Sm.,Viola fimbriatula Sm.
714738,Viola × caesariensis House,Viola × robinsoniana House,Viola × robinsoniana House,Viola × robinsoniana House,Viola × robinsoniana House,Viola × caesariensis House,Viola × caesariensis House
714791,Viola × festata House,Viola × porteriana Pollard,Viola × porteriana Pollard,Viola × porteriana Pollard,Viola × porteriana Pollard,Viola × festata House,Viola × festata House
714815,Viola × discors House,Viola × populifolia Greene,Viola × populifolia Greene,Viola × populifolia Greene,Viola × populifolia Greene,Viola × discors House,Viola × discors House
714817,Viola × peckiana House,Viola × populifolia Greene,Viola × populifolia Greene,Viola × populifolia Greene,Viola × populifolia Greene,Viola × peckiana House,Viola × peckiana House
714819,Viola × slavinii House,Viola × populifolia Greene,Viola × populifolia Greene,Viola × populifolia Greene,Viola × populifolia Greene,Viola × slavinii House,Viola × slavinii House
715339,Viola palmata var. angelliae (Pollard) W.Stone,Viola subsinuata (Greene) Greene,Viola subsinuata (Greene) Greene,Viola subsinuata (Greene) Greene,Viola subsinuata (Greene) Greene,Viola × angelliae Pollard,Viola × angelliae Pollard
716186,Viola × conturbata House,Viola × bissellii House,Viola × bissellii House,Viola × bissellii House,Viola × bissellii House,Viola × conturbata House,Viola × conturbata House
716287,Viola cucullata var. glaberrima Ging.,Viola cucullata Aiton,Viola cucullata Aiton,Viola cucullata Aiton,Viola cucullata Aiton,Viola sororia Willd.,Viola sororia Willd.
716296,Viola ciliata Willd. ex Schult.,Viola cucullata Aiton,Viola cucullata Aiton,Viola cucullata Aiton,Viola cucullata Aiton,Viola hastata Michx.,Viola hastata Michx.
716315,Viola × fernaldii House,Viola × conjugens Greene,Viola × conjugens Greene,Viola × conjugens Greene,Viola × conjugens Greene,Viola × fernaldii House,Viola × fernaldii House
718728,Pithecellobium cauliflorum f. niveum Lindm.,Zygia cauliflora (Willd.) Killip ex Record,Zygia cauliflora (Willd.) Killip ex Record,Zygia cauliflora (Willd.) Killip ex Record,Zygia cauliflora (Willd.) Killip ex Record,Zygia cataractae (Kunth) L.Rico,Zygia cataractae (Kunth) L.Rico
719250,Senna speciosa Roxb.,Senna sulfurea (DC. ex Collad.) H.S.Irwin & Barneby,Senna sulfurea (DC. ex Collad.) H.S.Irwin & Barneby,Senna sulfurea (DC. ex Collad.) H.S.Irwin & Barneby,Senna sulfurea (DC. ex Collad.) H.S.Irwin & Barneby,Senna surattensis (Burm.f.) H.S.Irwin & Barneby,Senna surattensis (Burm.f.) H.S.Irwin & Barneby
719352,Sisymbrium austriacum var. erysimifolium (Pourr.) DC.,Sisymbrium chrysanthum Jord.,Sisymbrium chrysanthum Jord.,Sisymbrium chrysanthum Jord.,Sisymbrium chrysanthum Jord.,Sisymbrium austriacum Jacq.,Sisymbrium austriacum Jacq.
720720,Sarcocornia fruticosa var. deflexa (Rouy) Lahondere & Gamisans,Salicornia fruticosa (L.) L.,Salicornia fruticosa (L.) L.,Salicornia fruticosa (L.) L.,Salicornia fruticosa (L.) L.,Salicornia alpini subsp. alpini,Salicornia alpini Lag.
721432,Anacampseros caerulescens Timb.-Lagr.,Sedum caeruleum L.,Sedum caeruleum L.,Sedum caeruleum L.,Sedum caeruleum L.,Hylotelephium maximum subsp. maximum,Hylotelephium maximum (L.) Holub
721757,Salsola pseudotragus (Beck) Iljin,Salsola tragus L.,Salsola tragus L.,Salsola tragus L.,Salsola tragus L.,Salsola australis R.Br.,Salsola australis R.Br.
722361,Silene ajanensis subsp. villosula (Trautv.) Vorosch.,Silene ajanensis (Regel & Tiling) Vorosch.,Silene ajanensis (Regel & Tiling) Vorosch.,Silene ajanensis (Regel & Tiling) Vorosch.,Silene ajanensis (Regel & Tiling) Vorosch.,Silene villosula (Trautv.) V.V.Petrovsky & Elven,Silene villosula (Trautv.) V.V.Petrovsky & Elven
723298,Melandrium apetalum var. vegetum Popov,Silene wahlbergella Chowdhuri,Silene wahlbergella Chowdhuri,Silene wahlbergella Chowdhuri,Silene wahlbergella Chowdhuri,Silene uralensis subsp. uralensis,Silene uralensis (Rupr.) Bocquet
723570,Silene vulgaris f. microphylla (Boiss.) Váczy,Silene microphylla Boiss.,Silene microphylla Boiss.,Silene microphylla Boiss.,Silene microphylla Boiss.,Silene vulgaris subsp. megalosperma (Sartori ex Heldr.) Hayek,Silene vulgaris (Moench) Garcke
725283,Jussiaea peruviana var. hassleriana (Chodat) H.Lév.,Ludwigia peruviana (L.) H.Hara,Ludwigia peruviana (L.) H.Hara,Ludwigia peruviana (L.) H.Hara,Ludwigia peruviana (L.) H.Hara,Ludwigia hassleriana (Chodat) Ramamoorthy,Ludwigia hassleriana (Chodat) Ramamoorthy
725369,Jussiaea myrtifolia var. lanceolata (Cambess.) Micheli,Ludwigia sericea (Cambess.) H.Hara,Ludwigia sericea (Cambess.) H.Hara,Ludwigia sericea (Cambess.) H.Hara,Ludwigia sericea (Cambess.) H.Hara,Ludwigia irwinii Ramamoorthy,Ludwigia irwinii Ramamoorthy
726014,Thomasia hexandra S.Moore,Lysiosepalum involucratum (Turcz.) Druce,Lysiosepalum involucratum (Turcz.) Druce,Lysiosepalum involucratum (Turcz.) Druce,Lysiosepalum involucratum (Turcz.) Druce,Lysiosepalum hexandrum (S.Moore) S.Moore,Lysiosepalum hexandrum (S.Moore) S.Moore
726015,Lysiosepalum hexandrum (S.Moore) S.Moore,Lysiosepalum involucratum (Turcz.) Druce,Lysiosepalum involucratum (Turcz.) Druce,Lysiosepalum involucratum (Turcz.) Druce,Lysiosepalum involucratum (Turcz.) Druce,Lysiosepalum hexandrum (S.Moore) S.Moore,Lysiosepalum hexandrum (S.Moore) S.Moore
726722,Lamourouxia stenoglossa Hunnewell & L.B.Sm.,Lamourouxia xalapensis Kunth,Lamourouxia xalapensis Kunth,Lamourouxia xalapensis Kunth,Lamourouxia xalapensis Kunth,Lamourouxia stenoglossa Hunnewell & L.B.Sm.,Lamourouxia stenoglossa Hunnewell & L.B.Sm.
727890,Vanieria fruticosa (Roxb.) Chun,Maclura cochinchinensis (Lour.) Corner,Maclura cochinchinensis (Lour.) Corner,Maclura cochinchinensis (Lour.) Corner,Maclura cochinchinensis (Lour.) Corner,Maclura fruticosa (Roxb.) Corner,Maclura fruticosa (Roxb.) Corner
728752,Malvastrum fragrans Eastw.,Malacothamnus jonesii (Munz) Kearney,Malacothamnus jonesii (Munz) Kearney,Malacothamnus jonesii (Munz) Kearney,Malacothamnus jonesii (Munz) Kearney,Malacothamnus niveus (Eastw.) Kearney,Malacothamnus niveus (Eastw.) Kearney
728753,Malvastrum gracile Eastw.,Malacothamnus jonesii (Munz) Kearney,Malacothamnus jonesii (Munz) Kearney,Malacothamnus jonesii (Munz) Kearney,Malacothamnus jonesii (Munz) Kearney,Malacothamnus gracilis (Eastw.) Kearney,Malacothamnus gracilis (Eastw.) Kearney
728756,Malacothamnus gracilis (Eastw.) Kearney,Malacothamnus jonesii (Munz) Kearney,Malacothamnus jonesii (Munz) Kearney,Malacothamnus jonesii (Munz) Kearney,Malacothamnus jonesii (Munz) Kearney,Malacothamnus gracilis (Eastw.) Kearney,Malacothamnus gracilis (Eastw.) Kearney
728765,Malvastrum hallii Eastw.,Malacothamnus fasciculatus (Nutt.) Greene,Malacothamnus fasciculatus (Nutt.) Greene,Malacothamnus fasciculatus (Nutt.) Greene,Malacothamnus fasciculatus (Nutt.) Greene,Malacothamnus hallii (Eastw.) Kearney,Malacothamnus hallii (Eastw.) Kearney
728767,Malvastrum mendocinense Eastw.,Malacothamnus fasciculatus (Nutt.) Greene,Malacothamnus fasciculatus (Nutt.) Greene,Malacothamnus fasciculatus (Nutt.) Greene,Malacothamnus fasciculatus (Nutt.) Greene,Malacothamnus mendocinensis (Eastw.) Kearney,Malacothamnus mendocinensis (Eastw.) Kearney
728772,Sphaeralcea fasciculata var. elmeri Jeps.,Malacothamnus fasciculatus (Nutt.) Greene,Malacothamnus fasciculatus (Nutt.) Greene,Malacothamnus fasciculatus (Nutt.) Greene,Malacothamnus fasciculatus (Nutt.) Greene,Malacothamnus hallii (Eastw.) Kearney,Malacothamnus hallii (Eastw.) Kearney
728775,Malacothamnus mendocinensis (Eastw.) Kearney,Malacothamnus fasciculatus (Nutt.) Greene,Malacothamnus fasciculatus (Nutt.) Greene,Malacothamnus fasciculatus (Nutt.) Greene,Malacothamnus fasciculatus (Nutt.) Greene,Malacothamnus mendocinensis (Eastw.) Kearney,Malacothamnus mendocinensis (Eastw.) Kearney
728776,Malacothamnus nuttallii Abrams,Malacothamnus fasciculatus (Nutt.) Greene,Malacothamnus fasciculatus (Nutt.) Greene,Malacothamnus fasciculatus (Nutt.) Greene,Malacothamnus fasciculatus (Nutt.) Greene,Malacothamnus nuttallii Abrams,Malacothamnus nuttallii Abrams
728779,Malveopsis arcuata Greene,Malacothamnus fasciculatus (Nutt.) Greene,Malacothamnus fasciculatus (Nutt.) Greene,Malacothamnus fasciculatus (Nutt.) Greene,Malacothamnus fasciculatus (Nutt.) Greene,Malacothamnus arcuatus (Greene) Greene,Malacothamnus arcuatus (Greene) Greene
730274,Brunellia quadrilocularis Hook. & Arn.,Melicope quadrangularis (H.St.John & E.P.Hume) T.G.Hartley & B.C.Stone,Melicope quadrangularis (H.St.John & E.P.Hume) T.G.Hartley & B.C.Stone,Melicope quadrangularis (H.St.John & E.P.Hume) T.G.Hartley & B.C.Stone,Melicope quadrangularis (H.St.John & E.P.Hume) T.G.Hartley & B.C.Stone,Melicope quadrilocularis (Hook. & Arn.) T.G.Hartley,Melicope quadrilocularis (Hook. & Arn.) T.G.Hartley
730413,Matayba sororopaniana Steyerm.,Matayba spruceana (Benth.) Radlk.,Matayba spruceana (Benth.) Radlk.,Matayba spruceana (Benth.) Radlk.,Matayba spruceana (Benth.) Radlk.,Matayba inelegans Radlk.,Matayba inelegans Radlk.
730424,Cupania laevigata Miq.,Matayba guianensis Aubl.,Matayba guianensis Aubl.,Matayba guianensis Aubl.,Matayba guianensis Aubl.,Matayba laevigata Radlk.,Matayba laevigata Radlk.
730447,Cupania laevigata Rich.,Matayba guianensis Aubl.,Matayba guianensis Aubl.,Matayba guianensis Aubl.,Matayba guianensis Aubl.,Matayba arborescens (Aubl.) Radlk.,Matayba arborescens (Aubl.) Radlk.
731739,Trichilia lobulata C.DC.,Trichilia pallens C.DC.,Trichilia pallens C.DC.,Trichilia pallens C.DC.,Trichilia pallens C.DC.,Trichilia pallida Sw.,Trichilia pallida Sw.
731750,Trichilia polyneura C.DC.,Trichilia reticulata P.Wilson,Trichilia reticulata P.Wilson,Trichilia reticulata P.Wilson,Trichilia reticulata P.Wilson,Trichilia septentrionalis C.DC.,Trichilia septentrionalis C.DC.
733151,Thomasia paniculata Lindl.,Thomasia pauciflora Lindl.,Thomasia pauciflora Lindl.,Thomasia pauciflora Lindl.,Thomasia pauciflora Lindl.,Thomasia paniculata Lindl.,Thomasia paniculata Lindl.
733777,Ranunculus elbrusensis f. bungeanus (Boiss.) Parsa,Ranunculus elbrusensis Boiss.,Ranunculus elbrusensis Boiss.,Ranunculus elbrusensis Boiss.,Ranunculus elbrusensis Boiss.,Ranunculus pichleri Freyn ex Stapf,Ranunculus pichleri Freyn ex Stapf
734136,Ranunculus glabratus (Lynge) Ericsson,Ranunculus auricomus L.,Ranunculus auricomus L.,Ranunculus auricomus L.,Ranunculus auricomus L.,Ranunculus boecheri (Fagerstr. & G.Kvist) Ericsson,Ranunculus boecheri (Fagerstr. & G.Kvist) Ericsson
734825,Ranunculus acris subvar. glabrescens (Toyok.) Tamura,Ranunculus paishanensis Kitag.,Ranunculus paishanensis Kitag.,Ranunculus paishanensis Kitag.,Ranunculus paishanensis Kitag.,Ranunculus japonicus var. japonicus,Ranunculus japonicus Thunb.
734843,Ranunculus lenormandii proles lutarius (Revel) Rouy & Foucaud,Ranunculus omiophyllus Ten.,Ranunculus omiophyllus Ten.,Ranunculus omiophyllus Ten.,Ranunculus omiophyllus Ten.,Ranunculus × lutarius (Revel) Bouvet,Ranunculus × lutarius (Revel) Bouvet
734845,Ranunculus lenormandii subsp. lutarius (Revel) Cout.,Ranunculus omiophyllus Ten.,Ranunculus omiophyllus Ten.,Ranunculus omiophyllus Ten.,Ranunculus omiophyllus Ten.,Ranunculus × lutarius (Revel) Bouvet,Ranunculus × lutarius (Revel) Bouvet
734847,Ranunculus lenormandii var. lutarius (Revel) P.Fourn.,Ranunculus omiophyllus Ten.,Ranunculus omiophyllus Ten.,Ranunculus omiophyllus Ten.,Ranunculus omiophyllus Ten.,Ranunculus × lutarius (Revel) Bouvet,Ranunculus × lutarius (Revel) Bouvet
734849,Batrachium lenormandii subsp. lutarium (Revel) Corb.,Ranunculus omiophyllus Ten.,Ranunculus omiophyllus Ten.,Ranunculus omiophyllus Ten.,Ranunculus omiophyllus Ten.,Ranunculus × lutarius (Revel) Bouvet,Ranunculus × lutarius (Revel) Bouvet
734947,Batrachium salsuginosum Dumort.,Ranunculus saniculifolius Viv.,Ranunculus saniculifolius Viv.,Ranunculus saniculifolius Viv.,Ranunculus saniculifolius Viv.,Ranunculus baudotii Godr.,Ranunculus baudotii Godr.
734962,Ranunculus fucoides Freyn,Ranunculus saniculifolius Viv.,Ranunculus saniculifolius Viv.,Ranunculus saniculifolius Viv.,Ranunculus saniculifolius Viv.,Ranunculus fucoides Freyn,Ranunculus fucoides Freyn
734963,Ranunculus baudotii var. submersus Gren.,Ranunculus saniculifolius Viv.,Ranunculus saniculifolius Viv.,Ranunculus saniculifolius Viv.,Ranunculus saniculifolius Viv.,Ranunculus baudotii Godr.,Ranunculus baudotii Godr.
734965,Ranunculus baudotii Godr.,Ranunculus saniculifolius Viv.,Ranunculus saniculifolius Viv.,Ranunculus saniculifolius Viv.,Ranunculus saniculifolius Viv.,Ranunculus baudotii Godr.,Ranunculus baudotii Godr.
734966,Batrachium marinum f. terrestre Brenner,Ranunculus saniculifolius Viv.,Ranunculus saniculifolius Viv.,Ranunculus saniculifolius Viv.,Ranunculus saniculifolius Viv.,Ranunculus baudotii Godr.,Ranunculus baudotii Godr.
734967,Ranunculus confusus Gren.,Ranunculus saniculifolius Viv.,Ranunculus saniculifolius Viv.,Ranunculus saniculifolius Viv.,Ranunculus saniculifolius Viv.,Ranunculus baudotii Godr.,Ranunculus baudotii Godr.
734968,Batrachium tenellum (Viv.) Dumort.,Ranunculus saniculifolius Viv.,Ranunculus saniculifolius Viv.,Ranunculus saniculifolius Viv.,Ranunculus saniculifolius Viv.,Ranunculus baudotii Godr.,Ranunculus baudotii Godr.
734969,Ranunculus leontinensis Freyn,Ranunculus saniculifolius Viv.,Ranunculus saniculifolius Viv.,Ranunculus saniculifolius Viv.,Ranunculus saniculifolius Viv.,Ranunculus baudotii Godr.,Ranunculus baudotii Godr.
734970,Ranunculus baudotii var. fluitans Gren.,Ranunculus saniculifolius Viv.,Ranunculus saniculifolius Viv.,Ranunculus saniculifolius Viv.,Ranunculus saniculifolius Viv.,Ranunculus baudotii Godr.,Ranunculus baudotii Godr.
734972,Batrachium marinum Fr.,Ranunculus saniculifolius Viv.,Ranunculus saniculifolius Viv.,Ranunculus saniculifolius Viv.,Ranunculus saniculifolius Viv.,Ranunculus baudotii Godr.,Ranunculus baudotii Godr.
734973,"Ranunculus aquatilis subsp. fucoides (Freyn) O.Bolòs, Vigo, Masalles & Ninot",Ranunculus saniculifolius Viv.,Ranunculus saniculifolius Viv.,Ranunculus saniculifolius Viv.,Ranunculus saniculifolius Viv.,Ranunculus fucoides Freyn,Ranunculus fucoides Freyn
734974,Ranunculus baudotii var. terrestris Gren.,Ranunculus saniculifolius Viv.,Ranunculus saniculifolius Viv.,Ranunculus saniculifolius Viv.,Ranunculus saniculifolius Viv.,Ranunculus baudotii Godr.,Ranunculus baudotii Godr.
734975,Ranunculus peltatus subsp. baudotii (Godr.) Meikle ex C.D.K.Cook,Ranunculus saniculifolius Viv.,Ranunculus saniculifolius Viv.,Ranunculus saniculifolius Viv.,Ranunculus saniculifolius Viv.,Ranunculus baudotii Godr.,Ranunculus baudotii Godr.
734976,Ranunculus peltatus subsp. fucoides (Freyn) Muñoz Garm.,Ranunculus saniculifolius Viv.,Ranunculus saniculifolius Viv.,Ranunculus saniculifolius Viv.,Ranunculus saniculifolius Viv.,Ranunculus fucoides Freyn,Ranunculus fucoides Freyn
734977,Batrachium fucoides (Freyn) Holub,Ranunculus saniculifolius Viv.,Ranunculus saniculifolius Viv.,Ranunculus saniculifolius Viv.,Ranunculus saniculifolius Viv.,Ranunculus fucoides Freyn,Ranunculus fucoides Freyn
734979,Ranunculus petiveri Amo,Ranunculus saniculifolius Viv.,Ranunculus saniculifolius Viv.,Ranunculus saniculifolius Viv.,Ranunculus saniculifolius Viv.,Ranunculus baudotii Godr.,Ranunculus baudotii Godr.
734980,Batrachium baudotii (Godr.) F.W.Schultz,Ranunculus saniculifolius Viv.,Ranunculus saniculifolius Viv.,Ranunculus saniculifolius Viv.,Ranunculus saniculifolius Viv.,Ranunculus baudotii Godr.,Ranunculus baudotii Godr.
734981,Ranunculus gelertii E.H.L.Krause,Ranunculus saniculifolius Viv.,Ranunculus saniculifolius Viv.,Ranunculus saniculifolius Viv.,Ranunculus saniculifolius Viv.,Ranunculus baudotii Godr.,Ranunculus baudotii Godr.
734982,Batrachium circinatum subsp. fucoides (Freyn) Nyman,Ranunculus saniculifolius Viv.,Ranunculus saniculifolius Viv.,Ranunculus saniculifolius Viv.,Ranunculus saniculifolius Viv.,Ranunculus fucoides Freyn,Ranunculus fucoides Freyn
734983,Ranunculus tenellus Viv.,Ranunculus saniculifolius Viv.,Ranunculus saniculifolius Viv.,Ranunculus saniculifolius Viv.,Ranunculus saniculifolius Viv.,Ranunculus baudotii Godr.,Ranunculus baudotii Godr.
734984,Ranunculus dubius Freyn,Ranunculus saniculifolius Viv.,Ranunculus saniculifolius Viv.,Ranunculus saniculifolius Viv.,Ranunculus saniculifolius Viv.,Ranunculus baudotii Godr.,Ranunculus baudotii Godr.
734985,Batrachium baudotii subsp. leontinensis (Freyn) Nyman,Ranunculus saniculifolius Viv.,Ranunculus saniculifolius Viv.,Ranunculus saniculifolius Viv.,Ranunculus saniculifolius Viv.,Ranunculus baudotii Godr.,Ranunculus baudotii Godr.
734987,Ranunculus baudotii subf. pedicellatus H.Lindb.,Ranunculus saniculifolius Viv.,Ranunculus saniculifolius Viv.,Ranunculus saniculifolius Viv.,Ranunculus saniculifolius Viv.,Ranunculus baudotii Godr.,Ranunculus baudotii Godr.
734988,Ranunculus trichophyllos Loscos,Ranunculus saniculifolius Viv.,Ranunculus saniculifolius Viv.,Ranunculus saniculifolius Viv.,Ranunculus saniculifolius Viv.,Ranunculus baudotii Godr.,Ranunculus baudotii Godr.
734989,Batrachium confusum var. salsuginosum (Dumort.) A.Pihl,Ranunculus saniculifolius Viv.,Ranunculus saniculifolius Viv.,Ranunculus saniculifolius Viv.,Ranunculus saniculifolius Viv.,Ranunculus baudotii Godr.,Ranunculus baudotii Godr.
734990,Ranunculus lejospermus subsp. marinus (Fr.) Tullb.,Ranunculus saniculifolius Viv.,Ranunculus saniculifolius Viv.,Ranunculus saniculifolius Viv.,Ranunculus saniculifolius Viv.,Ranunculus baudotii Godr.,Ranunculus baudotii Godr.
