866483,Solanum trongum var. sinuatopinnatifidum Dunal,Solanum capsicoides All.,Solanum capsicoides All.,Solanum capsicoides All.,Solanum capsicoides All.,Solanum melongena subsp. melongena,Solanum melongena L.
866498,Solanum cardiophyllum var. ehrenbergii (Bitter) Correll,Solanum cardiophyllum Lindl.,Solanum cardiophyllum Lindl.,Solanum cardiophyllum Lindl.,Solanum cardiophyllum Lindl.,Solanum ehrenbergii Rydb.,Solanum ehrenbergii Rydb.
866582,Solanum jacquemontii Dunal,Solanum cordatum Forssk.,Solanum cordatum Forssk.,Solanum cordatum Forssk.,Solanum cordatum Forssk.,Solanum hovei Dunal,Solanum hovei Dunal
866954,Lycopersicon esculentum var. racemigerum (Lange) Brezhnev,Solanum lycopersicoides Dunal,Solanum lycopersicoides Dunal,Solanum lycopersicoides Dunal,Solanum lycopersicoides Dunal,Solanum pimpinellifolium L.,Solanum pimpinellifolium L.
867074,Solanum khasianum C.B.Clarke,Solanum myriacanthum Dunal,Solanum myriacanthum Dunal,Solanum myriacanthum Dunal,Solanum myriacanthum Dunal,Solanum aculeatissimum Jacq.,Solanum aculeatissimum Jacq.
867162,Solanum griffithii (C.B.Clarke) Kuntze,Solanum procumbens Lour.,Solanum procumbens Lour.,Solanum procumbens Lour.,Solanum procumbens Lour.,Solanum trilobatum L.,Solanum trilobatum L.
867163,Solanum trilobatum var. griffithii C.B.Clarke,Solanum procumbens Lour.,Solanum procumbens Lour.,Solanum procumbens Lour.,Solanum procumbens Lour.,Solanum trilobatum L.,Solanum trilobatum L.
867166,Solanum miyakojimense T.Yamaz. & A.Takushi,Solanum procumbens Lour.,Solanum procumbens Lour.,Solanum procumbens Lour.,Solanum procumbens Lour.,Solanum miyakojimense T.Yamaz. & A.Takushi,Solanum miyakojimense T.Yamaz. & A.Takushi
867186,Solanum poka Dunal,Solanum pubescens Willd.,Solanum pubescens Willd.,Solanum pubescens Willd.,Solanum pubescens Willd.,Solanum poka Dunal,Solanum poka Dunal
867188,Solanum pubescens var. lobatum C.B.Clarke,Solanum pubescens Willd.,Solanum pubescens Willd.,Solanum pubescens Willd.,Solanum pubescens Willd.,Solanum violaceum Ortega,Solanum violaceum Ortega
867496,Solanum himalense var. soumbe Dunal,Solanum violaceum Ortega,Solanum violaceum Ortega,Solanum violaceum Ortega,Solanum violaceum Ortega,Solanum multiflorum Roth,Solanum multiflorum Roth
867500,Solanum erosum Van Heurck & Müll.Arg.,Solanum violaceum Ortega,Solanum violaceum Ortega,Solanum violaceum Ortega,Solanum violaceum Ortega,Solanum multiflorum Roth,Solanum multiflorum Roth
867503,Solanum himalense Dunal,Solanum violaceum Ortega,Solanum violaceum Ortega,Solanum violaceum Ortega,Solanum violaceum Ortega,Solanum melongena subsp. cumingii (Dunal) J.Samuel,Solanum melongena L.
867504,Solanum indicum L.,Solanum violaceum Ortega,Solanum violaceum Ortega,Solanum violaceum Ortega,Solanum violaceum Ortega,Solanum lasiocarpum Dunal,Solanum lasiocarpum Dunal
867512,Solanum indicum var. recurvatum C.Y.Wu & S.C.Huang,Solanum violaceum Ortega,Solanum violaceum Ortega,Solanum violaceum Ortega,Solanum violaceum Ortega,Solanum deflexicarpum C.Y.Wu & S.C.Huang,Solanum deflexicarpum C.Y.Wu & S.C.Huang
871398,Microlonchus tenellus Spach,Mantisalca salmantica (L.) Briq. & Cavill.,Mantisalca salmantica (L.) Briq. & Cavill.,Mantisalca salmantica (L.) Briq. & Cavill.,Mantisalca salmantica (L.) Briq. & Cavill.,Mantisalca duriaei (Spach) Briq. & Cavill.,Mantisalca duriaei (Spach) Briq. & Cavill.
871816,Centaurea carthamoides Chevall.,Centaurea albonitens Turrill,Centaurea albonitens Turrill,Centaurea albonitens Turrill,Centaurea albonitens Turrill,Phonus lanatus (L.) Hill,Phonus lanatus (L.) Hill
872258,Centaurea nigriceps Dobrocz.,Centaurea phrygia subsp. melanocalathia (Borbás) Dostál,Centaurea phrygia subsp. melanocalathia (Borbás) Dostál,Centaurea × melanocalathia Borbás,Centaurea × melanocalathia Borbás,Centaurea phrygia subsp. nigriceps (Dobrocz.) Dostál,Centaurea phrygia L.
876447,Launaea acanthoclada Maire,Launaea arborescens (Batt.) Murb.,Launaea arborescens (Batt.) Murb.,Launaea arborescens (Batt.) Murb.,Launaea arborescens (Batt.) Murb.,Launaea lanifera Pau,Launaea lanifera Pau
876609,Picridium ligulatum Vent.,Reichardia tingitana var. tingitana,Reichardia tingitana var. tingitana,Reichardia tingitana var. tingitana,Reichardia tingitana (L.) Roth,Reichardia ligulata (Vent.) G.Kunkel & Sunding,Reichardia ligulata (Vent.) G.Kunkel & Sunding
876818,Stephanomeria runcinata var. myrioclada (D.C.Eaton) Jeps.,Stephanomeria runcinata Nutt.,Stephanomeria runcinata Nutt.,Stephanomeria runcinata Nutt.,Stephanomeria runcinata Nutt.,Stephanomeria tenuifolia (Torr.) H.M.Hall,Stephanomeria tenuifolia (Torr.) H.M.Hall
878060,Hieracium aveyronense Arv.-Touv. & Gaut.,Hieracium hypochoeroides subsp. hypochoeroides,Hieracium hypochoeroides subsp. hypochoeroides,Hieracium hypochoeroides subsp. hypochoeroides,Hieracium hypochoeroides S.Gibson,Hieracium planchonianum subsp. planchonianum,Hieracium planchonianum Timb.-Lagr. & Loret
879226,Hieracium ramondii subsp. neoleontodon (Arv.-Touv. & Gaut.) Zahn,Hieracium ramondii Griseb.,Hieracium ramondii Griseb.,Hieracium ramondii Griseb.,Hieracium ramondii Griseb.,Hieracium cerinthoides subsp. cerinthoides,Hieracium cerinthoides L.
880095,Hieracium billyanum var. parvulum de Retz,Pilosella billyana (de Retz) Mateo,Pilosella billyana (de Retz) Mateo,Pilosella billyana (de Retz) Mateo,Pilosella billyana (de Retz) Mateo,Pilosella parvula (de Retz) Mateo,Pilosella parvula (de Retz) Mateo
880203,Pilosella caespitosa subsp. brevipila (Nägeli & Peter) P.D.Sell & C.West,Pilosella caespitosa subsp. caespitosa,Pilosella caespitosa subsp. caespitosa,Pilosella caespitosa subsp. caespitosa,Pilosella caespitosa (Dumort.) P.D.Sell & C.West,Pilosella onegensis Norrl.,Pilosella onegensis Norrl.
880729,Scorzonera glastifolia var. asphodeloides (Wallr.) DC.,Pseudopodospermum hispanicum subsp. hispanicum,Pseudopodospermum hispanicum subsp. hispanicum,Pseudopodospermum hispanicum subsp. hispanicum,"Pseudopodospermum hispanicum (L.) Zaika, Sukhor. & N.Kilian","Pseudopodospermum strictum (Hornem.) Zaika, Sukhor. & N.Kilian","Pseudopodospermum strictum (Hornem.) Zaika, Sukhor. & N.Kilian"
880832,Scorzonera laciniata var. calcitrapifolia (Vahl) Moris,Scorzonera laciniata L.,Scorzonera laciniata L.,Scorzonera laciniata L.,Scorzonera laciniata L.,Scorzonera calcitrapifolia Vahl,Scorzonera calcitrapifolia Vahl
880837,Scorzonera laciniata var. decumbens (Guss.) Fiori,Scorzonera laciniata L.,Scorzonera laciniata L.,Scorzonera laciniata L.,Scorzonera laciniata L.,Scorzonera calcitrapifolia Vahl,Scorzonera calcitrapifolia Vahl
880856,Scorzonera laciniata f. decumbens (Guss.) O.Bolòs & Vigo,Scorzonera laciniata L.,Scorzonera laciniata L.,Scorzonera laciniata L.,Scorzonera laciniata L.,Scorzonera calcitrapifolia Vahl,Scorzonera calcitrapifolia Vahl
880986,Pilosella glaucescens subsp. kerneri (Nägeli & Peter) Soják,Pilosella bauhini (Schult.) Arv.-Touv.,Pilosella bauhini (Schult.) Arv.-Touv.,Pilosella bauhini (Schult.) Arv.-Touv.,Pilosella bauhini (Schult.) Arv.-Touv.,Pilosella piloselloides subsp. magyarica (Peter) S.Bräut. & Greuter,Pilosella piloselloides (Vill.) Soják
881555,Leontodon asper var. setulosus Halácsy,Leontodon biscutellifolius DC.,Leontodon biscutellifolius DC.,Leontodon biscutellifolius DC.,Leontodon biscutellifolius DC.,Leontodon crispus Vill.,Leontodon crispus Vill.
881586,Leontodon saxatilis subsp. crassifolius (Welw. ex Mariz) P.Silva,Leontodon longirostris (Finch & P.D.Sell) Talavera,Leontodon longirostris (Finch & P.D.Sell) Talavera,Leontodon longirostris (Finch & P.D.Sell) Talavera,Leontodon longirostris (Finch & P.D.Sell) Talavera,Leontodon saxatilis subsp. saxatilis,Leontodon saxatilis Lam.
883669,Senecio cordatus subsp. auriculatus (Jacq.) Arcang.,Jacobaea alpina subsp. alpina,Jacobaea alpina subsp. alpina,Jacobaea alpina subsp. alpina,Jacobaea alpina (L.) Moench,Jacobaea subalpina (W.D.J.Koch) Pelser & Veldkamp,Jacobaea subalpina (W.D.J.Koch) Pelser & Veldkamp
884482,Senecio depilis Phil.,Dendrophorbium americanum (L.f.) C.Jeffrey,Dendrophorbium americanum (L.f.) C.Jeffrey,Dendrophorbium americanum (L.f.) C.Jeffrey,Dendrophorbium americanum (L.f.) C.Jeffrey,Acrisione denticulata var. denticulata,Acrisione denticulata (Hook. & Arn.) B.Nord.
885375,Conyza tenorei C.Presl ex Spreng.,Phagnalon graecum Boiss. & Heldr.,Phagnalon graecum Boiss. & Heldr.,Phagnalon graecum Boiss. & Heldr.,Phagnalon graecum Boiss. & Heldr.,Phagnalon rupestre subsp. illyricum (H.Lindb.) Ginzb.,Phagnalon rupestre (L.) DC.
886033,"Helichrysum roseum var. patens (Ewart, Jean White & B.Rees) J.M.Black",Rhodanthe chlorocephala subsp. rosea (Hook.) Paul G.Wilson,Rhodanthe chlorocephala subsp. rosea (Hook.) Paul G.Wilson,Rhodanthe chlorocephala subsp. rosea (Hook.) Paul G.Wilson,Rhodanthe chlorocephala (Turcz.) Paul G.Wilson,Rhodanthe troedelii (F.Muell.) Paul G.Wilson,Rhodanthe troedelii (F.Muell.) Paul G.Wilson
886841,Gnaphalium roseum var. angustifolium Benth.,Pseudognaphalium attenuatum (DC.) Anderb.,Pseudognaphalium attenuatum (DC.) Anderb.,Pseudognaphalium attenuatum (DC.) Anderb.,Pseudognaphalium attenuatum (DC.) Anderb.,Pseudognaphalium roseum (Kunth) Anderb.,Pseudognaphalium roseum (Kunth) Anderb.
886842,Gnaphalium roseum var. hololeucum Benth.,Pseudognaphalium attenuatum (DC.) Anderb.,Pseudognaphalium attenuatum (DC.) Anderb.,Pseudognaphalium attenuatum (DC.) Anderb.,Pseudognaphalium attenuatum (DC.) Anderb.,Pseudognaphalium roseum (Kunth) Anderb.,Pseudognaphalium roseum (Kunth) Anderb.
886843,Gnaphalium roseum var. sordescens Benth.,Pseudognaphalium attenuatum (DC.) Anderb.,Pseudognaphalium attenuatum (DC.) Anderb.,Pseudognaphalium attenuatum (DC.) Anderb.,Pseudognaphalium attenuatum (DC.) Anderb.,Pseudognaphalium roseum (Kunth) Anderb.,Pseudognaphalium roseum (Kunth) Anderb.
886928,Gnaphalium ivesii A.Nelson & J.F.Macbr.,Pseudognaphalium viscosum (Kunth) Anderb.,Pseudognaphalium viscosum (Kunth) Anderb.,Pseudognaphalium viscosum (Kunth) Anderb.,Pseudognaphalium viscosum (Kunth) Anderb.,Pseudognaphalium macounii (Greene) Kartesz,Pseudognaphalium macounii (Greene) Kartesz
887039,Gnaphalium dealbatum var. luteofuscum (Webb) Lobin,Vellereophyton dealbatum (Thunb.) Hilliard & B.L.Burtt,Vellereophyton dealbatum (Thunb.) Hilliard & B.L.Burtt,Vellereophyton dealbatum (Thunb.) Hilliard & B.L.Burtt,Vellereophyton dealbatum (Thunb.) Hilliard & B.L.Burtt,Pseudognaphalium luteoalbum (L.) Hilliard & B.L.Burtt,Pseudognaphalium luteoalbum (L.) Hilliard & B.L.Burtt
887040,Gnaphalium luteofuscum Webb,Vellereophyton dealbatum (Thunb.) Hilliard & B.L.Burtt,Vellereophyton dealbatum (Thunb.) Hilliard & B.L.Burtt,Vellereophyton dealbatum (Thunb.) Hilliard & B.L.Burtt,Vellereophyton dealbatum (Thunb.) Hilliard & B.L.Burtt,Pseudognaphalium luteoalbum (L.) Hilliard & B.L.Burtt,Pseudognaphalium luteoalbum (L.) Hilliard & B.L.Burtt
895235,Coreopsis drummondii var. wrightii A.Gray,Coreopsis basalis (Otto & A.Dietr.) S.F.Blake,Coreopsis basalis (Otto & A.Dietr.) S.F.Blake,Coreopsis basalis (Otto & A.Dietr.) S.F.Blake,Coreopsis basalis (Otto & A.Dietr.) S.F.Blake,Coreopsis wrightii (A.Gray) H.M.Parker ex E.B.Sm.,Coreopsis wrightii (A.Gray) H.M.Parker ex E.B.Sm.
895237,Coreopsis wrightii (A.Gray) H.M.Parker ex E.B.Sm.,Coreopsis basalis (Otto & A.Dietr.) S.F.Blake,Coreopsis basalis (Otto & A.Dietr.) S.F.Blake,Coreopsis basalis (Otto & A.Dietr.) S.F.Blake,Coreopsis basalis (Otto & A.Dietr.) S.F.Blake,Coreopsis wrightii (A.Gray) H.M.Parker ex E.B.Sm.,Coreopsis wrightii (A.Gray) H.M.Parker ex E.B.Sm.
895396,Coreopsis falcata F.E.Boynton,Coreopsis gladiata Walter,Coreopsis gladiata Walter,Coreopsis gladiata Walter,Coreopsis gladiata Walter,Coreopsis falcata F.E.Boynton,Coreopsis falcata F.E.Boynton
895397,Coreopsis floridana E.B.Sm.,Coreopsis gladiata Walter,Coreopsis gladiata Walter,Coreopsis gladiata Walter,Coreopsis gladiata Walter,Coreopsis floridana E.B.Sm.,Coreopsis floridana E.B.Sm.
895399,Coreopsis linifolia Nutt.,Coreopsis gladiata Walter,Coreopsis gladiata Walter,Coreopsis gladiata Walter,Coreopsis gladiata Walter,Coreopsis linifolia Nutt.,Coreopsis linifolia Nutt.
895402,Coreopsis oniscicarpa Fernald,Coreopsis gladiata Walter,Coreopsis gladiata Walter,Coreopsis gladiata Walter,Coreopsis gladiata Walter,Coreopsis linifolia Nutt.,Coreopsis linifolia Nutt.
895403,Coreopsis oniscicarpa var. simulans Fernald,Coreopsis gladiata Walter,Coreopsis gladiata Walter,Coreopsis gladiata Walter,Coreopsis gladiata Walter,Coreopsis linifolia Nutt.,Coreopsis linifolia Nutt.
896968,Aspilia squarrosa var. serratifolia Chodat,Wedelia squarrosa (Baker) B.L.Turner,Wedelia squarrosa (Baker) B.L.Turner,Wedelia squarrosa (Baker) B.L.Turner,Wedelia squarrosa (Baker) B.L.Turner,Wedelia pallida Gardner,Wedelia pallida Gardner
897393,Viguiera immarginata (DC.) Herter,Aldama angustifolia (Hook. & Arn.) E.E.Schill. & Panero,Aldama angustifolia (Hook. & Arn.) E.E.Schill. & Panero,Aldama angustifolia (Hook. & Arn.) E.E.Schill. & Panero,Aldama angustifolia (Hook. & Arn.) E.E.Schill. & Panero,Aldama anchusifolia var. immarginata (DC.) Magenta & Pirani,Aldama anchusifolia (DC.) E.E.Schill. & Panero
899711,Adenostemma decumbens (Sw.) D.Don ex Heynh.,Adenostemma brasilianum (Pers.) Cass.,Adenostemma brasilianum (Pers.) Cass.,Adenostemma brasilianum (Pers.) Cass.,Adenostemma brasilianum (Pers.) Cass.,Adenostemma verbesina Kuntze,Adenostemma verbesina Kuntze
901289,Eupatorium decipiens Hook. & Arn.,Ophryosporus triangularis Meyen,Ophryosporus triangularis Meyen,Ophryosporus triangularis Meyen,Ophryosporus triangularis Meyen,Heterocondylus decipiens (Hook. & Arn.) R.M.King & H.Rob.,Heterocondylus decipiens (Hook. & Arn.) R.M.King & H.Rob.
903701,Lycopodium plumosum var. penniforme (Lam.) Steud.,Selaginella haenkeana Spring,Selaginella haenkeana Spring,Selaginella haenkeana Spring,Selaginella haenkeana Spring,Selaginella radiata (Aubl.) Baker,Selaginella radiata (Aubl.) Baker
904885,Isoetes echinospora var. muricata (Durieu) Engelm.,Isoetes echinospora Durieu,Isoetes echinospora Durieu,Isoetes echinospora Durieu,Isoetes echinospora Durieu,Isoetes setacea Lam.,Isoetes setacea Lam.
904890,Isoetes echinospora subf. lativelata Iversen,Isoetes echinospora Durieu,Isoetes echinospora Durieu,Isoetes echinospora Durieu,Isoetes echinospora Durieu,Isoetes tenella Léman ex Desv.,Isoetes tenella Léman ex Desv.
905876,Sphenomeris gracilis (Tagawa) Sa.Kurata,Odontosoria chinensis subsp. chinensis,Odontosoria chinensis subsp. chinensis,Odontosoria chinensis subsp. chinensis,Odontosoria chinensis (L.) J.Sm.,Odontosoria gracilis (Tagawa) Ralf Knapp,Odontosoria gracilis (Tagawa) Ralf Knapp
906591,Hymenophyllum okadae Masam.,Hymenophyllum barbatum (Bosch) Baker,Hymenophyllum barbatum (Bosch) Baker,Hymenophyllum barbatum (Bosch) Baker,Hymenophyllum barbatum (Bosch) Baker,Hymenophyllum okadae Masam.,Hymenophyllum okadae Masam.
909022,Asplenium matsumurae Christ,Asplenium serricula Fée,Asplenium serricula Fée,Asplenium serricula Fée,Asplenium serricula Fée,Asplenium matsumurae Christ,Asplenium matsumurae Christ
909603,Woodsia brandtii Franch. & Sav.,Woodsia polystichoides D.C.Eaton,Woodsia polystichoides D.C.Eaton,Woodsia polystichoides D.C.Eaton,Woodsia polystichoides D.C.Eaton,Woodsia macrochlaena Mett. ex Kuhn,Woodsia macrochlaena Mett. ex Kuhn
910646,Didymochlaena lunulata var. dimidiata (Kunze) Kuhn,Didymochlaena truncatula (Sw.) J.Sm.,Didymochlaena truncatula (Sw.) J.Sm.,Didymochlaena truncatula (Sw.) J.Sm.,Didymochlaena truncatula (Sw.) J.Sm.,Didymochlaena dimidiata Kunze,Didymochlaena dimidiata Kunze
910655,Didymochlaena dimidiata Kunze,Didymochlaena truncatula (Sw.) J.Sm.,Didymochlaena truncatula (Sw.) J.Sm.,Didymochlaena truncatula (Sw.) J.Sm.,Didymochlaena truncatula (Sw.) J.Sm.,Didymochlaena dimidiata Kunze,Didymochlaena dimidiata Kunze
910656,Didymochlaena sinuosa Desv.,Didymochlaena truncatula (Sw.) J.Sm.,Didymochlaena truncatula (Sw.) J.Sm.,Didymochlaena truncatula (Sw.) J.Sm.,Didymochlaena truncatula (Sw.) J.Sm.,Didymochlaena sinuosa Desv.,Didymochlaena sinuosa Desv.
910658,Diplazium pulcherrimum Raddi,Didymochlaena truncatula (Sw.) J.Sm.,Didymochlaena truncatula (Sw.) J.Sm.,Didymochlaena truncatula (Sw.) J.Sm.,Didymochlaena truncatula (Sw.) J.Sm.,Didymochlaena sinuosa Desv.,Didymochlaena sinuosa Desv.
910659,Monochlaena sinuosa (Desv.) Gaudich.,Didymochlaena truncatula (Sw.) J.Sm.,Didymochlaena truncatula (Sw.) J.Sm.,Didymochlaena truncatula (Sw.) J.Sm.,Didymochlaena truncatula (Sw.) J.Sm.,Didymochlaena sinuosa Desv.,Didymochlaena sinuosa Desv.
910937,Aspidium rigidum var. australe Ten.,Dryopteris villarii (Bellardi) Woyn. ex Schinz & Thell.,Dryopteris villarii (Bellardi) Woyn. ex Schinz & Thell.,Dryopteris villarii (Bellardi) Woyn. ex Schinz & Thell.,Dryopteris villarii (Bellardi) Woyn. ex Schinz & Thell.,Dryopteris pallida subsp. pallida,Dryopteris pallida (Bory) Maire & Petitm.
910941,Dryopteris villarii var. australis (Ten.) Diklić & V.Nikolić,Dryopteris villarii (Bellardi) Woyn. ex Schinz & Thell.,Dryopteris villarii (Bellardi) Woyn. ex Schinz & Thell.,Dryopteris villarii (Bellardi) Woyn. ex Schinz & Thell.,Dryopteris villarii (Bellardi) Woyn. ex Schinz & Thell.,Dryopteris pallida subsp. pallida,Dryopteris pallida (Bory) Maire & Petitm.
910982,Polystichum subapiciflorum Hayata,Polystichum biaristatum (Blume) T.Moore,Polystichum biaristatum (Blume) T.Moore,Polystichum biaristatum (Blume) T.Moore,Polystichum biaristatum (Blume) T.Moore,Polystichum subapiciflorum Hayata,Polystichum subapiciflorum Hayata
911006,Polystichum pseudodeltodon Tagawa,Polystichum deltodon (Baker) Diels,Polystichum deltodon (Baker) Diels,Polystichum deltodon (Baker) Diels,Polystichum deltodon (Baker) Diels,Polystichum pseudodeltodon Tagawa,Polystichum pseudodeltodon Tagawa
911093,Arachniodes foeniculacea Ching,Arachniodes coniifolia (T.Moore) Ching,Arachniodes coniifolia (T.Moore) Ching,Arachniodes coniifolia (T.Moore) Ching,Arachniodes coniifolia (T.Moore) Ching,Arachniodes foeniculacea Ching,Arachniodes foeniculacea Ching
911346,Polystichum subobliquum Tagawa,Polystichum obliquum (D.Don) T.Moore,Polystichum obliquum (D.Don) T.Moore,Polystichum obliquum (D.Don) T.Moore,Polystichum obliquum (D.Don) T.Moore,Polystichum subobliquum Tagawa,Polystichum subobliquum Tagawa
911667,Ctenitis calcarea Ching & Chu H.Wang,Ctenitis subglandulosa (Hance) Ching,Ctenitis subglandulosa (Hance) Ching,Ctenitis subglandulosa (Hance) Ching,Ctenitis subglandulosa (Hance) Ching,Ctenitis eatonii (Baker) Ching,Ctenitis eatonii (Baker) Ching
911730,Bolbitis yunnanensis Ching,Bolbitis hainanensis Ching & Chu H.Wang,Bolbitis hainanensis Ching & Chu H.Wang,Bolbitis hainanensis Ching & Chu H.Wang,Bolbitis hainanensis Ching & Chu H.Wang,Bolbitis subcordata (Copel.) Ching,Bolbitis subcordata (Copel.) Ching
911899,Stenochlaena sorbifolia var. leptocarpa (Fée) Domin,Teratophyllum brightiae (F.Muell.) Holttum,Teratophyllum brightiae (F.Muell.) Holttum,Teratophyllum brightiae (F.Muell.) Holttum,Teratophyllum brightiae (F.Muell.) Holttum,Teratophyllum leptocarpum (Fée) Holttum,Teratophyllum leptocarpum (Fée) Holttum
912918,Humata subvestita (C.Chr.) Parris,Davallia repens (L.f.) Kuhn,Davallia repens (L.f.) Kuhn,Davallia repens (L.f.) Kuhn,Davallia repens (L.f.) Kuhn,Davallia subvestita (C.Chr.) Parris,Davallia subvestita (C.Chr.) Parris
912922,Pachypleuria brackenridgei (Brownlie) M.Kato,Davallia repens (L.f.) Kuhn,Davallia repens (L.f.) Kuhn,Davallia repens (L.f.) Kuhn,Davallia repens (L.f.) Kuhn,Davallia cumingii Hook.,Davallia cumingii Hook.
913066,Stenochlaena leptocarpa (Fée) Underw.,Lomariopsis spectabilis Mett.,Lomariopsis spectabilis Mett.,Lomariopsis spectabilis Mett.,Lomariopsis spectabilis Mett.,Teratophyllum leptocarpum (Fée) Holttum,Teratophyllum leptocarpum (Fée) Holttum
913497,Aspidium subquinquefidum P.Beauv.,Triplophyllum protensum (Afzel. ex Sw.) Holttum,Triplophyllum protensum (Afzel. ex Sw.) Holttum,Triplophyllum protensum (Afzel. ex Sw.) Holttum,Triplophyllum protensum (Afzel. ex Sw.) Holttum,Triplophyllum subquinquefidum (P.Beauv.) Pic.Serm.,Triplophyllum subquinquefidum (P.Beauv.) Pic.Serm.
913503,Polypodium pubescens Schumach.,Triplophyllum protensum (Afzel. ex Sw.) Holttum,Triplophyllum protensum (Afzel. ex Sw.) Holttum,Triplophyllum protensum (Afzel. ex Sw.) Holttum,Triplophyllum protensum (Afzel. ex Sw.) Holttum,Triplophyllum subquinquefidum (P.Beauv.) Pic.Serm.,Triplophyllum subquinquefidum (P.Beauv.) Pic.Serm.
914432,Mecosorus nudus Klotzsch,Grammitis graminea (Sw.) Ching,Grammitis graminea (Sw.) Ching,Grammitis graminea (Sw.) Ching,Grammitis graminea (Sw.) Ching,Grammitis furcata Hook. & Grev.,Grammitis furcata Hook. & Grev.
914566,Marginaria diversifolia C.Presl,Microgramma lycopodioides (L.) Copel.,Microgramma lycopodioides (L.) Copel.,Microgramma lycopodioides (L.) Copel.,Microgramma lycopodioides (L.) Copel.,Microgramma mauritiana (Willd.) Tardieu,Microgramma mauritiana (Willd.) Tardieu
915052,Cephalomanes meifolium (Willd.) K.Iwats.,Trichomanes pluma Hook.,Trichomanes pluma Hook.,Trichomanes pluma Hook.,Trichomanes pluma Hook.,Trichomanes parviflorum Poir.,Trichomanes parviflorum Poir.
915068,Macroglena parviflora (Poir.) Copel.,Trichomanes rigidum Sw.,Trichomanes rigidum Sw.,Trichomanes rigidum Sw.,Trichomanes rigidum Sw.,Trichomanes parviflorum Poir.,Trichomanes parviflorum Poir.
915257,Microgonium viridans (Mett.) B.K.Nayar & S.Kaur,Trichomanes minutum Blume,Trichomanes minutum Blume,Trichomanes minutum Blume,Trichomanes minutum Blume,Trichomanes latealatum (Bosch) Christ,Trichomanes latealatum (Bosch) Christ
915309,Hymenophyllum parallelocarpum Hayata,Hymenophyllum tenellum D.Don,Hymenophyllum tenellum D.Don,Hymenophyllum tenellum D.Don,Hymenophyllum tenellum D.Don,Hymenophyllum parallelocarpum Hayata,Hymenophyllum parallelocarpum Hayata
915311,Hymenophyllum punctisorum Rosenst.,Hymenophyllum tenellum D.Don,Hymenophyllum tenellum D.Don,Hymenophyllum tenellum D.Don,Hymenophyllum tenellum D.Don,Hymenophyllum punctisorum Rosenst.,Hymenophyllum punctisorum Rosenst.
915766,Cyathea remotifolia Bonap.,Alsophila simulans Baker,Alsophila simulans Baker,Alsophila simulans Baker,Alsophila simulans Baker,Cyathea remotifolia Bonap.,Cyathea remotifolia Bonap.
917417,Phegopteris urophylla Mett.,Thelypteris repanda (Fée) C.V.Morton,Thelypteris repanda (Fée) C.V.Morton,Thelypteris repanda (Fée) C.V.Morton,Thelypteris repanda (Fée) C.V.Morton,Thelypteris aspera (C.Presl) K.Iwats.,Thelypteris aspera (C.Presl) K.Iwats.
918417,Polypodium blumeanum C.Presl,Grammitis sumatrana (Baker) Copel.,Grammitis sumatrana (Baker) Copel.,Grammitis sumatrana (Baker) Copel.,Grammitis sumatrana (Baker) Copel.,Grammitis pilosiuscula Blume,Grammitis pilosiuscula Blume
919422,Asplenium sandwichianum Hook.,Diplazium sandwichense C.Presl,Diplazium sandwichense C.Presl,Diplazium sandwichense C.Presl,Diplazium sandwichense C.Presl,Diplazium sandwichianum (Hook.) Diels,Diplazium sandwichianum (Hook.) Diels
919424,Athyrium sandwichianum C.Presl,Diplazium sandwichense C.Presl,Diplazium sandwichense C.Presl,Diplazium sandwichense C.Presl,Diplazium sandwichense C.Presl,Diplazium sandwichianum (Hook.) Diels,Diplazium sandwichianum (Hook.) Diels
919425,Diplazium sandwichianum (Hook.) Diels,Diplazium sandwichense C.Presl,Diplazium sandwichense C.Presl,Diplazium sandwichense C.Presl,Diplazium sandwichense C.Presl,Diplazium sandwichianum (Hook.) Diels,Diplazium sandwichianum (Hook.) Diels
920306,Scorzonera laciniata var. intermedia (Guss.) Rouy,Scorzonera calcitrapifolia Vahl,Scorzonera calcitrapifolia Vahl,Scorzonera calcitrapifolia Vahl,Scorzonera calcitrapifolia Vahl,Scorzonera laciniata L.,Scorzonera laciniata L.
920867,Inula salicina subsp. semiamplexicaulis (Reut.) Nyman,"Pentanema salicinum (L.) D.Gut.Larr., Santos-Vicente, Anderb., E.Rico & M.M.Mart.Ort.","Pentanema salicinum (L.) D.Gut.Larr., Santos-Vicente, Anderb., E.Rico & M.M.Mart.Ort.","Pentanema salicinum (L.) D.Gut.Larr., Santos-Vicente, Anderb., E.Rico & M.M.Mart.Ort.","Pentanema salicinum (L.) D.Gut.Larr., Santos-Vicente, Anderb., E.Rico & M.M.Mart.Ort.",Pentanema × semiamplexicaule (Reut.) Seregin,Pentanema × semiamplexicaule (Reut.) Seregin
920871,"Inula vaillantii var. semiamplexicaulis (Reut.) Ces., Pass. & Gibelli","Pentanema salicinum (L.) D.Gut.Larr., Santos-Vicente, Anderb., E.Rico & M.M.Mart.Ort.","Pentanema salicinum (L.) D.Gut.Larr., Santos-Vicente, Anderb., E.Rico & M.M.Mart.Ort.","Pentanema salicinum (L.) D.Gut.Larr., Santos-Vicente, Anderb., E.Rico & M.M.Mart.Ort.","Pentanema salicinum (L.) D.Gut.Larr., Santos-Vicente, Anderb., E.Rico & M.M.Mart.Ort.",Pentanema × semiamplexicaule (Reut.) Seregin,Pentanema × semiamplexicaule (Reut.) Seregin
921206,Pellaea glaziovii var. minor Baker,Hemionitis aconitifolia Christenh.,Hemionitis aconitifolia Christenh.,Hemionitis aconitifolia Christenh.,Hemionitis aconitifolia Christenh.,Hemionitis pyornkrachzarkii Christenh.,Hemionitis pyornkrachzarkii Christenh.
921513,Notholaena scariosa (Sw.) Baker,Hemionitis squamosa (Gillies ex Hook. & Grev.) Christenh.,Hemionitis squamosa (Gillies ex Hook. & Grev.) Christenh.,Hemionitis squamosa (Gillies ex Hook. & Grev.) Christenh.,Hemionitis squamosa (Gillies ex Hook. & Grev.) Christenh.,Hemionitis scariosa (Sw.) Christenh.,Hemionitis scariosa (Sw.) Christenh.
922005,Pteris angusta Bory ex Willd.,Hemionitis horridula (Maxon) Christenh.,Hemionitis horridula (Maxon) Christenh.,Hemionitis aspera (Baker) ined.,Hemionitis aspera (Baker) ined.,Hemionitis dura (Willd.) Christenh.,Hemionitis dura (Willd.) Christenh.
922142,Polypodium semicryptum (Copel.) C.Chr.,Grammitis pectinata (T.Moore) Christenh.,Grammitis pectinata (T.Moore) Christenh.,Grammitis pectinata (T.Moore) Christenh.,Grammitis pectinata (T.Moore) Christenh.,Grammitis semicrypta (Copel.) Christenh.,Grammitis semicrypta (Copel.) Christenh.
