1029877,Borreria rubrostipulata DC.,Spermacoce capitata Ruiz & Pav.,Spermacoce capitata Ruiz & Pav.,Spermacoce capitata Ruiz & Pav.,Spermacoce capitata Ruiz & Pav.,Spermacoce quadrifaria (E.L.Cabral) Govaerts,Spermacoce quadrifaria (E.L.Cabral) Govaerts
1030629,Dendrocolla alba Ridl.,Thrixspermum trichoglottis (Hook.f.) Kuntze,Thrixspermum trichoglottis (Hook.f.) Kuntze,Thrixspermum trichoglottis (Hook.f.) Kuntze,Thrixspermum trichoglottis (Hook.f.) Kuntze,Thrixspermum pulchellum (Thwaites) Schltr.,Thrixspermum pulchellum (Thwaites) Schltr.
1031992,Eryngium paniculatum var. atrocephalum Kuntze,Eryngium paniculatum Cav. & Dombey ex F.Delaroche,Eryngium paniculatum Cav. & Dombey ex F.Delaroche,Eryngium paniculatum Cav. & Dombey ex F.Delaroche,Eryngium paniculatum Cav. & Dombey ex F.Delaroche,Eryngium eurycephalum Malme,Eryngium eurycephalum Malme
1031994,Eryngium paniculatum f. junior Urb.,Eryngium paniculatum Cav. & Dombey ex F.Delaroche,Eryngium paniculatum Cav. & Dombey ex F.Delaroche,Eryngium paniculatum Cav. & Dombey ex F.Delaroche,Eryngium paniculatum Cav. & Dombey ex F.Delaroche,Eryngium eurycephalum Malme,Eryngium eurycephalum Malme
1031996,Eryngium subulatum Vell.,Eryngium paniculatum Cav. & Dombey ex F.Delaroche,Eryngium paniculatum Cav. & Dombey ex F.Delaroche,Eryngium paniculatum Cav. & Dombey ex F.Delaroche,Eryngium paniculatum Cav. & Dombey ex F.Delaroche,Eryngium pandanifolium var. pandanifolium,Eryngium pandanifolium Cham. & Schltdl.
1032238,"Nepenthes angasanensis Maulder, D.Schub., B.R.Salmon & B.Quinn",Nepenthes mikei B.R.Salmon & Maulder,Nepenthes mikei B.R.Salmon & Maulder,Nepenthes mikei B.R.Salmon & Maulder,Nepenthes mikei B.R.Salmon & Maulder,"Nepenthes angasanensis Maulder, D.Schub., B.R.Salmon & B.Quinn","Nepenthes angasanensis Maulder, D.Schub., B.R.Salmon & B.Quinn"
1032414,Salix urophylla Lindl. ex Andersson,Salix tetrasperma Roxb.,Salix tetrasperma Roxb.,Salix tetrasperma Roxb.,Salix tetrasperma Roxb.,Salix acmophylla Boiss.,Salix acmophylla Boiss.
1033457,Alyssum alpinum Scop.,Alyssum montanum subsp. gmelinii (Jord.) Em.Schmid,Alyssum montanum subsp. gmelinii (Jord.) Em.Schmid,Alyssum gmelinii Jord.,Alyssum gmelinii Jord.,Kernera saxatilis (L.) Sweet,Kernera saxatilis (L.) Sweet
1034461,Hymenophyllum daedaleum Blume,Hymenophyllum australe Willd.,Hymenophyllum australe Willd.,Hymenophyllum australe Willd.,Hymenophyllum australe Willd.,Hymenophyllum javanicum Spreng.,Hymenophyllum javanicum Spreng.
1034462,Hymenophyllum erosum Blume,Hymenophyllum australe Willd.,Hymenophyllum australe Willd.,Hymenophyllum australe Willd.,Hymenophyllum australe Willd.,Hymenophyllum javanicum Spreng.,Hymenophyllum javanicum Spreng.
1034464,Hymenophyllum micranthum Bosch,Hymenophyllum australe Willd.,Hymenophyllum australe Willd.,Hymenophyllum australe Willd.,Hymenophyllum australe Willd.,Hymenophyllum javanicum Spreng.,Hymenophyllum javanicum Spreng.
1034584,Hymenophyllum fimbriatum J.Sm. ex Hook.,Hymenophyllum javanicum Spreng.,Hymenophyllum javanicum Spreng.,Hymenophyllum javanicum Spreng.,Hymenophyllum javanicum Spreng.,Hymenophyllum fimbriatum J.Sm. ex Hook.,Hymenophyllum fimbriatum J.Sm. ex Hook.
1036766,Carex chlorolepis Steud.,Carex phalaroides Kunth,Carex phalaroides Kunth,Carex phalaroides Kunth,Carex phalaroides Kunth,Carex chlorolepis Steud.,Carex chlorolepis Steud.
1037910,Saussurea japonica var. lineariloba Nakai,Saussurea japonica var. japonica,Saussurea japonica var. japonica,Saussurea japonica var. japonica,Saussurea japonica (Thunb.) DC.,Saussurea pulchella (Fisch.) Fisch. ex Colla,Saussurea pulchella (Fisch.) Fisch. ex Colla
1038190,Sorbus trilobata var. oxyloba Boiss.,Eriolobus trilobatus (Labill. ex Poir.) M.Roem.,Eriolobus trilobatus (Labill. ex Poir.) M.Roem.,Malus trilobata (Labill. ex Poir.) C.K.Schneid.,Malus trilobata (Labill. ex Poir.) C.K.Schneid.,Malus florentina (Zuccagni) C.K.Schneid.,Malus florentina (Zuccagni) C.K.Schneid.
1038191,Crataegus trilobata Labill.,Eriolobus trilobatus (Labill. ex Poir.) M.Roem.,Eriolobus trilobatus (Labill. ex Poir.) M.Roem.,Malus trilobata (Labill. ex Poir.) C.K.Schneid.,Malus trilobata (Labill. ex Poir.) C.K.Schneid.,Malus florentina (Zuccagni) C.K.Schneid.,Malus florentina (Zuccagni) C.K.Schneid.
1038192,Pyrus trilobata var. rumelica Dingler,Eriolobus trilobatus (Labill. ex Poir.) M.Roem.,Eriolobus trilobatus (Labill. ex Poir.) M.Roem.,Malus trilobata (Labill. ex Poir.) C.K.Schneid.,Malus trilobata (Labill. ex Poir.) C.K.Schneid.,Malus florentina (Zuccagni) C.K.Schneid.,Malus florentina (Zuccagni) C.K.Schneid.
1038193,Eriolobus trilobatus var. sorgerae Browicz,Eriolobus trilobatus (Labill. ex Poir.) M.Roem.,Eriolobus trilobatus (Labill. ex Poir.) M.Roem.,Malus trilobata (Labill. ex Poir.) C.K.Schneid.,Malus trilobata (Labill. ex Poir.) C.K.Schneid.,Malus florentina (Zuccagni) C.K.Schneid.,Malus florentina (Zuccagni) C.K.Schneid.
1039070,Saussurea ussuriensis f. sinuata Kitag.,Saussurea controversa DC.,Saussurea controversa DC.,Saussurea controversa DC.,Saussurea controversa DC.,Saussurea firma (Kitag.) Kitam.,Saussurea firma (Kitag.) Kitam.
1039916,Hieracium ilergabonum Pau,Hieracium arragonense Scheele,Hieracium arragonense Scheele,Hieracium arragonense Scheele,Hieracium arragonense Scheele,Hieracium ilergabonum Pau,Hieracium ilergabonum Pau
1040071,Memorialis dalzellii Wedd.,Pouzolzia integrifolia Dalzell,Pouzolzia integrifolia Dalzell,Gonostegia integrifolia (Dalzell) Miq.,Gonostegia integrifolia (Dalzell) Miq.,Gonostegia hirta (Blume) Miq.,Gonostegia hirta (Blume) Miq.
1041724,Ottonia muelleri Trel.,Piper xylosteoides (Kunth) Steud.,Piper xylosteoides (Kunth) Steud.,Piper xylosteoides (Kunth) Steud.,Piper xylosteoides (Kunth) Steud.,Piper miquelianum C.DC.,Piper miquelianum C.DC.
1042141,Angelica erythrocarpa H.Wolff,Angelica laxifoliata Diels,Angelica laxifoliata Diels,Angelica laxifoliata Diels,Angelica laxifoliata Diels,Angelica erythrocarpa H.Wolff,Angelica erythrocarpa H.Wolff
1042881,Dendrobium perakense Hook.f.,Eria javanica (Sw.) Blume,Eria javanica (Sw.) Blume,Bulbophyllum gibbosum (Blume) Lindl.,Bulbophyllum gibbosum (Blume) Lindl.,Eria stellata Lindl.,Eria stellata Lindl.
1042882,Eria inamoena Schltr.,Eria javanica (Sw.) Blume,Eria javanica (Sw.) Blume,Bulbophyllum gibbosum (Blume) Lindl.,Bulbophyllum gibbosum (Blume) Lindl.,Eria stellata Lindl.,Eria stellata Lindl.
1042883,Dendrolirium rugosum Blume,Eria javanica (Sw.) Blume,Eria javanica (Sw.) Blume,Bulbophyllum gibbosum (Blume) Lindl.,Bulbophyllum gibbosum (Blume) Lindl.,Eria stellata Lindl.,Eria stellata Lindl.
1042884,Octomeria vaginata Breda,Eria javanica (Sw.) Blume,Eria javanica (Sw.) Blume,Bulbophyllum gibbosum (Blume) Lindl.,Bulbophyllum gibbosum (Blume) Lindl.,Eria stellata Lindl.,Eria stellata Lindl.
1042885,Eria fragrans Rchb.f.,Eria javanica (Sw.) Blume,Eria javanica (Sw.) Blume,Bulbophyllum gibbosum (Blume) Lindl.,Bulbophyllum gibbosum (Blume) Lindl.,Eria stellata Lindl.,Eria stellata Lindl.
1042886,Eria stellata Lindl.,Eria javanica (Sw.) Blume,Eria javanica (Sw.) Blume,Bulbophyllum gibbosum (Blume) Lindl.,Bulbophyllum gibbosum (Blume) Lindl.,Eria stellata Lindl.,Eria stellata Lindl.
1042887,Eria micholitzii Kraenzl.,Eria javanica (Sw.) Blume,Eria javanica (Sw.) Blume,Bulbophyllum gibbosum (Blume) Lindl.,Bulbophyllum gibbosum (Blume) Lindl.,Eria stellata Lindl.,Eria stellata Lindl.
1042888,Eria papuana Kraenzl.,Eria javanica (Sw.) Blume,Eria javanica (Sw.) Blume,Bulbophyllum gibbosum (Blume) Lindl.,Bulbophyllum gibbosum (Blume) Lindl.,Eria stellata Lindl.,Eria stellata Lindl.
1042889,Eria pseudostellata Schltr.,Eria javanica (Sw.) Blume,Eria javanica (Sw.) Blume,Bulbophyllum gibbosum (Blume) Lindl.,Bulbophyllum gibbosum (Blume) Lindl.,Eria stellata Lindl.,Eria stellata Lindl.
1043566,Thymus zelenetzkyi Klokov & Des.-Shost.,Thymus roegneri K.Koch,Thymus roegneri K.Koch,Thymus roegneri K.Koch,Thymus roegneri K.Koch,Thymus callieri Borbás ex Velen.,Thymus callieri Borbás ex Velen.
1044677,Marsdenia gonavensis Urb.,Ruehssia haitiensis (Urb.) Acev.-Rodr.,Ruehssia haitiensis (Urb.) Acev.-Rodr.,Ruehssia haitiensis (Urb.) Acev.-Rodr.,Ruehssia haitiensis (Urb.) Acev.-Rodr.,Ruehssia gonavensis (Urb.) Morillo,Ruehssia gonavensis (Urb.) Morillo
1044812,Tetranthera ferruginea R.Br.,Litsea umbellata (Lour.) Merr.,Litsea umbellata (Lour.) Merr.,Litsea umbellata (Lour.) Merr.,Litsea umbellata (Lour.) Merr.,Litsea breviumbellata C.K.Allen,Litsea breviumbellata C.K.Allen
1045738,Acanthonychia ramosissima var. rosetta (Cambess.) Rohrb.,Cardionema ramosissima (Weinm.) A.Nelson & J.F.Macbr.,Cardionema ramosissima (Weinm.) A.Nelson & J.F.Macbr.,Cardionema ramosissima (Weinm.) A.Nelson & J.F.Macbr.,Cardionema ramosissima (Weinm.) A.Nelson & J.F.Macbr.,Cardionema rosetta (Cambess.) A.Nelson & J.F.Macbr.,Cardionema rosetta (Cambess.) A.Nelson & J.F.Macbr.
1045970,Lagenophora javanica Blume ex DC.,Myriactis wightii var. wightii,Myriactis wightii var. wightii,Myriactis wightii var. wightii,Myriactis wightii DC.,Myriactis javanica (Blume) DC.,Myriactis javanica (Blume) DC.
1046038,Hymenophyllum coloratum A.Braun ex Bosch,Hymenophyllum tenellum D.Don,Hymenophyllum tenellum D.Don,Hymenophyllum tenellum D.Don,Hymenophyllum tenellum D.Don,Hymenophyllum paniculiflorum C.Presl,Hymenophyllum paniculiflorum C.Presl
1046039,Hymenophyllum discosum Christ,Hymenophyllum tenellum D.Don,Hymenophyllum tenellum D.Don,Hymenophyllum tenellum D.Don,Hymenophyllum tenellum D.Don,Hymenophyllum paniculiflorum C.Presl,Hymenophyllum paniculiflorum C.Presl
1046054,Hymenophyllum paniculiflorum C.Presl,Hymenophyllum tenellum D.Don,Hymenophyllum tenellum D.Don,Hymenophyllum tenellum D.Don,Hymenophyllum tenellum D.Don,Hymenophyllum paniculiflorum C.Presl,Hymenophyllum paniculiflorum C.Presl
1047018,Hieracium laricense Timb.-Lagr. & Gaut.,Hieracium solidagineum Fr.,Hieracium solidagineum Fr.,Hieracium solidagineum Fr.,Hieracium solidagineum Fr.,Hieracium laricense Timb.-Lagr. & Gaut.,Hieracium laricense Timb.-Lagr. & Gaut.
1047395,Artemisia vulgaris var. kamschatica Besser,Artemisia vulgaris subsp. vulgaris,Artemisia vulgaris subsp. vulgaris,Artemisia vulgaris subsp. vulgaris,Artemisia vulgaris L.,Artemisia argyi var. argyi,Artemisia argyi H.Lév. & Vaniot
1047414,Vitis inserta A.Kern.,Parthenocissus quinquefolia (L.) Planch.,Parthenocissus quinquefolia (L.) Planch.,Parthenocissus quinquefolia (L.) Planch.,Parthenocissus quinquefolia (L.) Planch.,Parthenocissus inserta (A.Kern.) Fritsch,Parthenocissus inserta (A.Kern.) Fritsch
1047542,Ruschia velutina L.Bolus,Eberlanzia schneideriana (A.Berger) H.E.K.Hartmann,Eberlanzia schneideriana (A.Berger) H.E.K.Hartmann,Eberlanzia schneideriana (A.Berger) H.E.K.Hartmann,Eberlanzia schneideriana (A.Berger) H.E.K.Hartmann,Eberlanzia velutina (L.Bolus) Klak & P.C.van Wyk,Eberlanzia velutina (L.Bolus) Klak & P.C.van Wyk
1048720,Paepalanthus vaginatus Körn.,Syngonanthus fischerianus (Bong.) Ruhland,Syngonanthus fischerianus (Bong.) Ruhland,Syngonanthus fischerianus (Bong.) Ruhland,Syngonanthus fischerianus (Bong.) Ruhland,Paepalanthus vaginatus Körn.,Paepalanthus vaginatus Körn.
1049449,Eria striolata Rchb.f.,Eria javanica (Sw.) Blume,Eria javanica (Sw.) Blume,Bulbophyllum gibbosum (Blume) Lindl.,Bulbophyllum gibbosum (Blume) Lindl.,Eria stellata Lindl.,Eria stellata Lindl.
1049452,Eria cochleata Lindl.,Eria javanica (Sw.) Blume,Eria javanica (Sw.) Blume,Bulbophyllum gibbosum (Blume) Lindl.,Bulbophyllum gibbosum (Blume) Lindl.,Eria cochleata Lindl.,Eria cochleata Lindl.
1051005,Muhlenbergia gracilis var. enervis Scribn. ex Beal,Muhlenbergia quadridentata (Kunth) Trin.,Muhlenbergia quadridentata (Kunth) Trin.,Muhlenbergia quadridentata (Kunth) Trin.,Muhlenbergia quadridentata (Kunth) Trin.,Muhlenbergia montana (Nutt.) Hitchc.,Muhlenbergia montana (Nutt.) Hitchc.
1052083,Salix purpurea subsp. leucodermis Yalt.,Salix elbrusensis Boiss.,Salix elbrusensis Boiss.,Salix elbrusensis Boiss.,Salix elbrusensis Boiss.,Salix purpurea subsp. leucodermis Yalt.,Salix purpurea L.
1052558,Saussurea glomerata var. chinensis F.H.Chen,Saussurea japonica var. japonica,Saussurea japonica var. japonica,Saussurea japonica var. japonica,Saussurea japonica (Thunb.) DC.,Saussurea amara (L.) DC.,Saussurea amara (L.) DC.
1052715,Bellis javanica Blume,Myriactis wightii var. wightii,Myriactis wightii var. wightii,Myriactis wightii var. wightii,Myriactis wightii DC.,Myriactis javanica (Blume) DC.,Myriactis javanica (Blume) DC.
1053455,Paronychia rosetta Cambess.,Cardionema ramosissima (Weinm.) A.Nelson & J.F.Macbr.,Cardionema ramosissima (Weinm.) A.Nelson & J.F.Macbr.,Cardionema ramosissima (Weinm.) A.Nelson & J.F.Macbr.,Cardionema ramosissima (Weinm.) A.Nelson & J.F.Macbr.,Cardionema rosetta (Cambess.) A.Nelson & J.F.Macbr.,Cardionema rosetta (Cambess.) A.Nelson & J.F.Macbr.
1053899,Ruschia pillansii L.Bolus,Eberlanzia schneideriana (A.Berger) H.E.K.Hartmann,Eberlanzia schneideriana (A.Berger) H.E.K.Hartmann,Eberlanzia schneideriana (A.Berger) H.E.K.Hartmann,Eberlanzia schneideriana (A.Berger) H.E.K.Hartmann,Eberlanzia pillansii (L.Bolus) Klak & P.C.van Wyk,Eberlanzia pillansii (L.Bolus) Klak & P.C.van Wyk
1054602,Mecodium paramnioides H.G.Zhou & W.M.Chu,Hymenophyllum tenellum D.Don,Hymenophyllum tenellum D.Don,Hymenophyllum tenellum D.Don,Hymenophyllum tenellum D.Don,Hymenophyllum paramnioides (H.G.Zhou & W.M.Chu) X.C.Zhang,Hymenophyllum paramnioides (H.G.Zhou & W.M.Chu) X.C.Zhang
1054603,Hymenophyllum fujisanense Nakai,Hymenophyllum tenellum D.Don,Hymenophyllum tenellum D.Don,Hymenophyllum tenellum D.Don,Hymenophyllum tenellum D.Don,Hymenophyllum fujisanense Nakai,Hymenophyllum fujisanense Nakai
1055229,Monochilus zollingeri Rchb.f.,Zeuxine gracilis (Breda) Blume,Zeuxine gracilis (Breda) Blume,Zeuxine gracilis (Breda) Blume,Zeuxine gracilis (Breda) Blume,Zeuxine zollingeri (Rchb.f.) Ormerod & Juswara,Zeuxine zollingeri (Rchb.f.) Ormerod & Juswara
1055263,Huxleya linifolia Ewart & B.Rees,Volkameria aculeata L.,Volkameria aculeata L.,Volkameria aculeata L.,Volkameria aculeata L.,Volkameria linifolia (Ewart & B.Rees) Mabb. & Y.W.Yuan,Volkameria linifolia (Ewart & B.Rees) Mabb. & Y.W.Yuan
1056178,Borreria parviflora var. scabra Griseb.,Spermacoce eryngioides (Cham. & Schltdl.) Kuntze,Spermacoce eryngioides (Cham. & Schltdl.) Kuntze,Spermacoce eryngioides (Cham. & Schltdl.) Kuntze,Spermacoce eryngioides (Cham. & Schltdl.) Kuntze,Spermacoce affinis (DC.) R.M.Salas,Spermacoce affinis (DC.) R.M.Salas
1056539,Juncus minutulus V.I.Krecz. & Gontsch.,Juncus minutulus (Albert & Jahand.) Prain,Juncus minutulus (Albert & Jahand.) Prain,Juncus minutulus (Albert & Jahand.) Prain,Juncus minutulus (Albert & Jahand.) Prain,Juncus bufonius L.,Juncus bufonius L.
1058000,Polypodium loriceum f. duplisora Domin,Serpocaulon loriceum (L.) A.R.Sm.,Serpocaulon loriceum (L.) A.R.Sm.,Serpocaulon loriceum (L.) A.R.Sm.,Serpocaulon loriceum (L.) A.R.Sm.,Serpocaulon falcaria (Kunze) A.R.Sm.,Serpocaulon falcaria (Kunze) A.R.Sm.
1058673,Bovea sinaica Decne.,Lindenbergia indica (L.) Vatke,Lindenbergia indica (L.) Vatke,Lindenbergia indica (L.) Vatke,Lindenbergia indica (L.) Vatke,Lindenbergia sinaica (Decne.) Benth.,Lindenbergia sinaica (Decne.) Benth.
1059464,Pulicaria uliginosa Hoffmanns. & Link,Pulicaria arabica (L.) Cass.,Pulicaria arabica (L.) Cass.,Pulicaria arabica (L.) Cass.,Pulicaria arabica (L.) Cass.,Pulicaria paludosa Link,Pulicaria paludosa Link
1059912,Trichomanes montanum Hook.,Trichomanes reptans Sw.,Trichomanes reptans Sw.,Trichomanes reptans Sw.,Trichomanes reptans Sw.,Trichomanes robinsonii Hook. ex Baker,Trichomanes robinsonii Hook. ex Baker
1059916,Trichomanes robinsonii Hook. ex Baker,Trichomanes reptans Sw.,Trichomanes reptans Sw.,Trichomanes reptans Sw.,Trichomanes reptans Sw.,Trichomanes robinsonii Hook. ex Baker,Trichomanes robinsonii Hook. ex Baker
1060894,Polygala pulchella var. robusta Grondona,Polygala pulchella A.St.-Hil. & Moq.,Polygala pulchella A.St.-Hil. & Moq.,Senega pulchella (A.St.-Hil. & Moq.) J.F.B.Pastore,Senega pulchella (A.St.-Hil. & Moq.) J.F.B.Pastore,Senega robusta (Grondona) J.F.B.Pastore,Senega robusta (Grondona) J.F.B.Pastore
1060895,Polygala pulchella f. major Chodat,Polygala pulchella A.St.-Hil. & Moq.,Polygala pulchella A.St.-Hil. & Moq.,Senega pulchella (A.St.-Hil. & Moq.) J.F.B.Pastore,Senega pulchella (A.St.-Hil. & Moq.) J.F.B.Pastore,Senega robusta (Grondona) J.F.B.Pastore,Senega robusta (Grondona) J.F.B.Pastore
1062909,Sobralia lindenii W.Watson,Sobralia rosea Poepp. & Endl.,Sobralia rosea Poepp. & Endl.,Sobralia rosea Poepp. & Endl.,Sobralia rosea Poepp. & Endl.,Sobralia pulcherrima Garay,Sobralia pulcherrima Garay
1065047,Pediocactus simpsonii var. indranus Hochstätter,Pediocactus simpsonii (Engelm.) Britton & Rose,Pediocactus simpsonii (Engelm.) Britton & Rose,Pediocactus simpsonii (Engelm.) Britton & Rose,Pediocactus simpsonii (Engelm.) Britton & Rose,Pediocactus indranus (Hochstätter) Hochstätter,Pediocactus indranus (Hochstätter) Hochstätter
1065606,Rosa × hibernica var. grovesii Baker,Rosa × hibernica Templeton,Rosa × hibernica Templeton,Rosa × hibernica Templeton,Rosa × hibernica Templeton,Rosa × grovesii (Baker) Maskew,Rosa × grovesii (Baker) Maskew
1067100,Gnaphalium lanatum G.Forst.,Euchiton involucratus (G.Forst.) Holub,Euchiton involucratus (G.Forst.) Holub,Euchiton involucratus (G.Forst.) Holub,Euchiton involucratus (G.Forst.) Holub,"Pseudognaphalium lanatum (G.Forst.) Smissen, Breitw. & de Lange","Pseudognaphalium lanatum (G.Forst.) Smissen, Breitw. & de Lange"
1068089,Panicum pedicellatum Vasey,Dichanthelium transiens (Swallen) Sánchez-Ken,Dichanthelium transiens (Swallen) Sánchez-Ken,Dichanthelium transiens (Swallen) Sánchez-Ken,Dichanthelium transiens (Swallen) Sánchez-Ken,Dichanthelium pedicellatum Gould,Dichanthelium pedicellatum Gould
1070058,Habenaria laciniata Dalzell,Habenaria digitata Lindl.,Habenaria digitata Lindl.,Habenaria digitata Lindl.,Habenaria digitata Lindl.,Habenaria laciniata Dalzell,Habenaria laciniata Dalzell
1070557,Juncus dioicus Steud.,Anarthria gracilis R.Br.,Anarthria gracilis R.Br.,Anarthria gracilis R.Br.,Anarthria gracilis R.Br.,Anarthria dioica (Steud.) Fomichev,Anarthria dioica (Steud.) Fomichev
1070963,Ephedra glauca Regel,Ephedra intermedia Schrenk & C.A.Mey.,Ephedra intermedia Schrenk & C.A.Mey.,Ephedra intermedia Schrenk & C.A.Mey.,Ephedra intermedia Schrenk & C.A.Mey.,Ephedra glauca Regel,Ephedra glauca Regel
1071909,Enkianthus calophyllus T.Z.Hsu,Enkianthus serrulatus (E.H.Wilson) C.K.Schneid.,Enkianthus serrulatus (E.H.Wilson) C.K.Schneid.,Enkianthus serrulatus (E.H.Wilson) C.K.Schneid.,Enkianthus serrulatus (E.H.Wilson) C.K.Schneid.,Enkianthus perulatus (Miq.) C.K.Schneid.,Enkianthus perulatus (Miq.) C.K.Schneid.
1073943,Brickellia extranea McVaugh,Brickellia oreithales (B.L.Rob.) Shinners,Brickellia oreithales (B.L.Rob.) Shinners,Brickellia oreithales (B.L.Rob.) Shinners,Brickellia oreithales (B.L.Rob.) Shinners,Brickellia extranea McVaugh,Brickellia extranea McVaugh
1091172,Osmunda piresii Brade,Osmunda spectabilis Willd.,Osmunda spectabilis Willd.,Osmunda spectabilis Willd.,Osmunda spectabilis Willd.,Osmunda piresii Brade,Osmunda piresii Brade
1092187,Polypodium loriceum var. obscurum Rosenst.,Serpocaulon loriceum (L.) A.R.Sm.,Serpocaulon loriceum (L.) A.R.Sm.,Serpocaulon loriceum (L.) A.R.Sm.,Serpocaulon loriceum (L.) A.R.Sm.,Serpocaulon concolorum (M.Kessler & A.R.Sm.) A.R.Sm.,Serpocaulon concolorum (M.Kessler & A.R.Sm.) A.R.Sm.
1092188,Polypodium loriceum var. squamuligerum Rosenst.,Serpocaulon loriceum (L.) A.R.Sm.,Serpocaulon loriceum (L.) A.R.Sm.,Serpocaulon loriceum (L.) A.R.Sm.,Serpocaulon loriceum (L.) A.R.Sm.,Serpocaulon concolorum (M.Kessler & A.R.Sm.) A.R.Sm.,Serpocaulon concolorum (M.Kessler & A.R.Sm.) A.R.Sm.
1093999,Phalaenopsis borneensis Garay,Phalaenopsis cornu-cervi (Breda) Blume & Rchb.f.,Phalaenopsis cornu-cervi (Breda) Blume & Rchb.f.,Phalaenopsis cornu-cervi (Breda) Blume & Rchb.f.,Phalaenopsis cornu-cervi (Breda) Blume & Rchb.f.,Phalaenopsis pantherina Rchb.f.,Phalaenopsis pantherina Rchb.f.
1095005,Saussurea polypodiifolia DC.,Saussurea elongata DC.,Saussurea elongata DC.,Saussurea elongata DC.,Saussurea elongata DC.,Saussurea recurvata (Maxim.) Lipsch.,Saussurea recurvata (Maxim.) Lipsch.
1095640,Opuntia campestris Britton & Rose,Cumulopuntia sphaerica (C.F.Först.) E.F.Anderson,Cumulopuntia sphaerica (C.F.Först.) E.F.Anderson,Cumulopuntia sphaerica (C.F.Först.) E.F.Anderson,Cumulopuntia sphaerica (C.F.Först.) E.F.Anderson,Cumulopuntia leucophaea (Phil.) Hoxey,Cumulopuntia leucophaea (Phil.) Hoxey
1097256,Alyssum xiphocarpum Candargy,Alyssum umbellatum Desv.,Alyssum umbellatum Desv.,Alyssum umbellatum Desv.,Alyssum umbellatum Desv.,Alyssum xiphocarpum Candargy,Alyssum xiphocarpum Candargy
1097842,Lithospermum muricatum Ruiz & Pav.,Plagiobothrys humilis (Ruiz & Pav.) I.M.Johnst.,Plagiobothrys humilis (Ruiz & Pav.) I.M.Johnst.,Plagiobothrys humilis (Ruiz & Pav.) I.M.Johnst.,Plagiobothrys humilis (Ruiz & Pav.) I.M.Johnst.,Plagiobothrys muricatus (Ruiz & Pav.) I.M.Johnst.,Plagiobothrys muricatus (Ruiz & Pav.) I.M.Johnst.
1102151,Phaseolus montanus Brandegee,Phaseolus acutifolius var. tenuifolius A.Gray,Phaseolus acutifolius var. tenuifolius A.Gray,Phaseolus acutifolius var. tenuifolius A.Gray,Phaseolus acutifolius A.Gray,Phaseolus montanus Brandegee,Phaseolus montanus Brandegee
1103447,Schinus dependens f. grandifolia Loes.,Schinus myrtifolia (Griseb.) Cabrera,Schinus myrtifolia (Griseb.) Cabrera,Schinus myrtifolia (Griseb.) Cabrera,Schinus myrtifolia (Griseb.) Cabrera,Schinus minutiflora Silva-Luz & Pirani,Schinus minutiflora Silva-Luz & Pirani
1104505,Coelogyne padangensis J.J.Sm. & Schltr.,Coelogyne fimbriata var. fimbriata,Coelogyne fimbriata var. fimbriata,Coelogyne fimbriata var. fimbriata,Coelogyne fimbriata Lindl.,Coelogyne pallens Ridl.,Coelogyne pallens Ridl.
1104506,Coelogyne pallens Ridl.,Coelogyne fimbriata var. fimbriata,Coelogyne fimbriata var. fimbriata,Coelogyne fimbriata var. fimbriata,Coelogyne fimbriata Lindl.,Coelogyne pallens Ridl.,Coelogyne pallens Ridl.
1105981,Panicum brodiei H.St.John,Dichanthelium lanuginosum (Elliott) Gould,Dichanthelium lanuginosum (Elliott) Gould,Dichanthelium lanuginosum (Elliott) Gould,Dichanthelium lanuginosum (Elliott) Gould,Dichanthelium brodiei (H.St.John) Wipff,Dichanthelium brodiei (H.St.John) Wipff
1106750,Nepenthes xiphioides B.R.Salmon & Maulder,Nepenthes pectinata Danser,Nepenthes pectinata Danser,Nepenthes pectinata Danser,Nepenthes pectinata Danser,Nepenthes gymnamphora Reinw. ex Nees,Nepenthes gymnamphora Reinw. ex Nees
1109914,Ilex cuneifolia Hook.,Jodina rhombifolia subsp. rhombifolia,Jodina rhombifolia subsp. rhombifolia,Jodina rhombifolia subsp. rhombifolia,Jodina rhombifolia (Hook. & Arn.) Reissek,Ilex obcordata var. obcordata,Ilex obcordata Sw.
1110042,Embryopteris peregrina Gaertn.,Diospyros malabarica (Desr.) Kostel.,Diospyros malabarica (Desr.) Kostel.,Diospyros malabarica (Desr.) Kostel.,Diospyros malabarica (Desr.) Kostel.,Diospyros peregrina (Gaertn.) Gürke,Diospyros peregrina (Gaertn.) Gürke
1110365,Polygala hostmannii Miq.,Polygala trichosperma Jacq.,Polygala trichosperma Jacq.,Senega trichosperma (Jacq.) J.F.B.Pastore,Senega trichosperma (Jacq.) J.F.B.Pastore,Senega appressa (Benth.) J.F.B.Pastore,Senega appressa (Benth.) J.F.B.Pastore
1110384,Collaea formosa Griseb.,Nanogalactia heterophylla (Gillies ex Hook.) L.P.Queiroz,Nanogalactia heterophylla (Gillies ex Hook.) L.P.Queiroz,Nanogalactia heterophylla (Gillies ex Hook.) L.P.Queiroz,Nanogalactia heterophylla (Gillies ex Hook.) L.P.Queiroz,Collaea argentina Griseb.,Collaea argentina Griseb.
1112546,Coelogyne fimbriata var. annamica Finet ex Gagnep.,Coelogyne fimbriata var. fimbriata,Coelogyne fimbriata var. fimbriata,Coelogyne fimbriata var. fimbriata,Coelogyne fimbriata Lindl.,Coelogyne pallens Ridl.,Coelogyne pallens Ridl.
1115879,Xanthium macrocarpum DC.,Xanthium strumarium L.,Xanthium strumarium L.,Xanthium strumarium L.,Xanthium strumarium L.,Xanthium orientale L.,Xanthium orientale L.
1118178,Paspalum pleostachyum Döll,Paspalum arundinaceum Poir.,Paspalum arundinaceum Poir.,Paspalum arundinaceum Poir.,Paspalum arundinaceum Poir.,Paspalum ligulare Nees,Paspalum ligulare Nees
1118185,Ophioglossum malviae M.Patel & M.N.Reddy,Ophioglossum rubellum Welw. ex A.Braun,Ophioglossum rubellum Welw. ex A.Braun,Ophioglossum rubellum Welw. ex A.Braun,Ophioglossum rubellum Welw. ex A.Braun,Ophioglossum oleosum Khand.,Ophioglossum oleosum Khand.
1119338,Carex berteroana Desv.,Carex aphylla Kunth,Carex aphylla Kunth,Carex aphylla Kunth,Carex aphylla Kunth,Carex pungens Boeckeler,Carex pungens Boeckeler
1119933,Cogswellia flava (Suksd.) J.M.Coult. & Rose,Lomatium martindalei (J.M.Coult. & Rose) J.M.Coult. & Rose,Lomatium martindalei (J.M.Coult. & Rose) J.M.Coult. & Rose,Lomatium martindalei (J.M.Coult. & Rose) J.M.Coult. & Rose,Lomatium martindalei (J.M.Coult. & Rose) J.M.Coult. & Rose,Lomatium macrocarpum (Nutt. ex Torr. & A.Gray) J.M.Coult. & Rose,Lomatium macrocarpum (Nutt. ex Torr. & A.Gray) J.M.Coult. & Rose
1119935,Lomatium flavum Suksd.,Lomatium martindalei (J.M.Coult. & Rose) J.M.Coult. & Rose,Lomatium martindalei (J.M.Coult. & Rose) J.M.Coult. & Rose,Lomatium martindalei (J.M.Coult. & Rose) J.M.Coult. & Rose,Lomatium martindalei (J.M.Coult. & Rose) J.M.Coult. & Rose,Lomatium macrocarpum (Nutt. ex Torr. & A.Gray) J.M.Coult. & Rose,Lomatium macrocarpum (Nutt. ex Torr. & A.Gray) J.M.Coult. & Rose
1119995,Sassafras officinale Siebold,Lindera triloba (Siebold & Zucc.) Blume,Lindera triloba (Siebold & Zucc.) Blume,Lindera triloba (Siebold & Zucc.) Blume,Lindera triloba (Siebold & Zucc.) Blume,Sassafras albidum (Nutt.) Nees,Sassafras albidum (Nutt.) Nees
