,taxon_name_w_authors,v12_accepted_name_w_author,v13_taxon_name_w_authors,v13_chained_accepted_name_w_author,v13_chained_accepted_species_w_author,v13_direct_accepted_name_w_author,v13_direct_accepted_species_w_author
4305,Mesembryanthemum lacunatum N.E.Br.,Eberlanzia schneideriana (A.Berger) H.E.K.Hartmann,Eberlanzia schneideriana (A.Berger) H.E.K.Hartmann,Eberlanzia schneideriana (A.Berger) H.E.K.Hartmann,Eberlanzia schneideriana (A.Berger) H.E.K.Hartmann,Eberlanzia velutina (L.Bolus) Klak & P.C.van Wyk,Eberlanzia velutina (L.Bolus) Klak & P.C.van Wyk
6062,Myrica pumila (Michx.) Small,Myrica cerifera L.,Myrica cerifera L.,Myrica cerifera L.,Myrica cerifera L.,Myrica pusilla Raf.,Myrica pusilla Raf.
8984,Piptadenia peregrina var. falcata (Benth.) Chodat & Hassl.,Anadenanthera peregrina (L.) Speg.,Anadenanthera peregrina (L.) Speg.,Anadenanthera peregrina (L.) Speg.,Anadenanthera peregrina (L.) Speg.,Anadenanthera falcata (Benth.) Speg.,Anadenanthera falcata (Benth.) Speg.
8985,Anadenanthera peregrina var. falcata (Benth.) Altschul,Anadenanthera peregrina (L.) Speg.,Anadenanthera peregrina (L.) Speg.,Anadenanthera peregrina (L.) Speg.,Anadenanthera peregrina (L.) Speg.,Anadenanthera falcata (Benth.) Speg.,Anadenanthera falcata (Benth.) Speg.
8986,Anadenanthera falcata (Benth.) Speg.,Anadenanthera peregrina (L.) Speg.,Anadenanthera peregrina (L.) Speg.,Anadenanthera peregrina (L.) Speg.,Anadenanthera peregrina (L.) Speg.,Anadenanthera falcata (Benth.) Speg.,Anadenanthera falcata (Benth.) Speg.
9688,Coprosma grandifolia Hook.f.,Coprosma lucida var. lucida,Coprosma lucida var. lucida,Coprosma lucida var. lucida,Coprosma lucida J.R.Forst. & G.Forst.,Coprosma grandifolia Hook.f.,Coprosma grandifolia Hook.f.
9824,Rubus foliosus var. monticola (Boulay) Sudre,Rubus foliosus Weihe,Rubus foliosus Weihe,Rubus foliosus Weihe,Rubus foliosus Weihe,Rubus pallidus Weihe,Rubus pallidus Weihe
9874,Quercus × tlemcenensis (A.DC.) Villar,Quercus × numidica Trab.,Quercus × numidica Trab.,Quercus × numidica Trab.,Quercus × numidica Trab.,Quercus × tlemcenensis Trab.,Quercus × tlemcenensis Trab.
9875,Quercus mirbeckii f. tlemcenensis (A.DC.) Trab.,Quercus × numidica Trab.,Quercus × numidica Trab.,Quercus × numidica Trab.,Quercus × numidica Trab.,Quercus × tlemcenensis Trab.,Quercus × tlemcenensis Trab.
9876,Quercus faginea var. tlemcenensis (A.DC.) Maire,Quercus × numidica Trab.,Quercus × numidica Trab.,Quercus × numidica Trab.,Quercus × numidica Trab.,Quercus × tlemcenensis Trab.,Quercus × tlemcenensis Trab.
9877,Quercus faginea subsp. tlemcenensis (A.DC.) Maire & Weiller ex Greuter & Burdet,Quercus × numidica Trab.,Quercus × numidica Trab.,Quercus × numidica Trab.,Quercus × numidica Trab.,Quercus × tlemcenensis Trab.,Quercus × tlemcenensis Trab.
9878,Quercus broteroi subsp. tlemcenensis (A.DC.) F.M.Vázquez & Coombes,Quercus × numidica Trab.,Quercus × numidica Trab.,Quercus × numidica Trab.,Quercus × numidica Trab.,Quercus × tlemcenensis Trab.,Quercus × tlemcenensis Trab.
10558,Coffea arabica var. angustifolia (Roxb.) Miq. ex A.Froehner,Pittosporum moluccanum (Lam.) Miq.,Pittosporum moluccanum (Lam.) Miq.,Pittosporum moluccanum (Lam.) Miq.,Pittosporum moluccanum (Lam.) Miq.,Pittosporum timorense Blume,Pittosporum timorense Blume
12996,Ficus courtallensis (Miq.) Baill.,Ficus arnottiana (Miq.) Miq.,Ficus arnottiana (Miq.) Miq.,Ficus arnottiana (Miq.) Miq.,Ficus arnottiana (Miq.) Miq.,Ficus hispida var. hispida,Ficus hispida L.f.
16895,Morella pumila (Michx.) Small,Myrica cerifera L.,Myrica cerifera L.,Myrica cerifera L.,Myrica cerifera L.,Myrica pusilla Raf.,Myrica pusilla Raf.
16896,Cerothamnus pumilus (Michx.) Small,Myrica cerifera L.,Myrica cerifera L.,Myrica cerifera L.,Myrica cerifera L.,Myrica pusilla Raf.,Myrica pusilla Raf.
17918,Rosa × involuta var. wilsonii (Borrer) Baker,Rosa × involuta Sm.,Rosa × involuta Sm.,Rosa × involuta Sm.,Rosa × involuta Sm.,Rosa × andrzeiowskii Steven ex Besser,Rosa × andrzeiowskii Steven ex Besser
18336,Passiflora foetida var. riparia (C.Wright ex Griseb.) Killip,Passiflora ciliata var. ciliata,Passiflora ciliata var. ciliata,Passiflora ciliata var. ciliata,Passiflora ciliata Aiton,Passiflora wrightiana H.T.Svoboda,Passiflora wrightiana H.T.Svoboda
22112,Lomandra micrantha var. sororia (Benth.) H.B.Will.,Lomandra micrantha subsp. tuberculata J.Everett,Lomandra micrantha subsp. tuberculata J.Everett,Lomandra micrantha subsp. tuberculata J.Everett,Lomandra micrantha (Endl.) Ewart,Lomandra oreophila B.J.Conn & A.L.Quirico,Lomandra oreophila B.J.Conn & A.L.Quirico
22113,Lomandra oreophila B.J.Conn & A.L.Quirico,Lomandra micrantha subsp. tuberculata J.Everett,Lomandra micrantha subsp. tuberculata J.Everett,Lomandra micrantha subsp. tuberculata J.Everett,Lomandra micrantha (Endl.) Ewart,Lomandra oreophila B.J.Conn & A.L.Quirico,Lomandra oreophila B.J.Conn & A.L.Quirico
22342,Polygala ariadnae Bernardi,Polygala mandonii Chodat,Polygala mandonii Chodat,Senega mandonii (Chodat) J.F.B.Pastore,Senega mandonii (Chodat) J.F.B.Pastore,Senega gracilis (Kunth) J.F.B.Pastore,Senega gracilis (Kunth) J.F.B.Pastore
23099,Paraspalathus simsiana (Eckl. & Zeyh.) C.Presl,Aspalathus araneosa L.,Aspalathus araneosa L.,Aspalathus araneosa L.,Aspalathus araneosa L.,Aspalathus callosa L.,Aspalathus callosa L.
23153,Polygala alba var. bicolor (Kunth) Chodat,Polygala alba Nutt.,Polygala alba Nutt.,Senega alba (Nutt.) J.F.B.Pastore & J.R.Abbott,Senega alba (Nutt.) J.F.B.Pastore & J.R.Abbott,Senega ambigua (Nutt.) J.F.B.Pastore & J.R.Abbott,Senega ambigua (Nutt.) J.F.B.Pastore & J.R.Abbott
23398,Pleione cycnoches (C.S.P.Parish & Rchb.f.) Kuntze,Coelogyne fuscescens Lindl.,Coelogyne fuscescens Lindl.,Coelogyne fuscescens Lindl.,Coelogyne fuscescens Lindl.,Coelogyne cycnoches C.S.P.Parish & Rchb.f.,Coelogyne cycnoches C.S.P.Parish & Rchb.f.
23954,Rosa pugetii var. thomasii (Puget ex Cottet) Heinr.Braun,Rosa marginata Wallr.,Rosa marginata Wallr.,Rosa marginata Wallr.,Rosa marginata Wallr.,Rosa abietina Gren. ex Christ,Rosa abietina Gren. ex Christ
24856,Rosa × cottetii var. aberrans (Wolley-Dod) P.V.Heath,Rosa × scabriuscula Winch ex Sm.,Rosa × scabriuscula Winch ex Sm.,Rosa × scabriuscula Winch ex Sm.,Rosa × scabriuscula Winch ex Sm.,Rosa × aberrans Wolley-Dod,Rosa × aberrans Wolley-Dod
25174,Mesembryanthemum floriferum N.E.Br.,Eberlanzia schneideriana (A.Berger) H.E.K.Hartmann,Eberlanzia schneideriana (A.Berger) H.E.K.Hartmann,Eberlanzia schneideriana (A.Berger) H.E.K.Hartmann,Eberlanzia schneideriana (A.Berger) H.E.K.Hartmann,Eberlanzia pillansii (L.Bolus) Klak & P.C.van Wyk,Eberlanzia pillansii (L.Bolus) Klak & P.C.van Wyk
25391,Juncus bufonius subsp. minutulus Soó,Juncus minutulus (Albert & Jahand.) Prain,Juncus minutulus (Albert & Jahand.) Prain,Juncus minutulus (Albert & Jahand.) Prain,Juncus minutulus (Albert & Jahand.) Prain,Juncus bufonius L.,Juncus bufonius L.
25634,Rosa × hibernica f. wilsonii (Borrer) Wolley-Dod,Rosa × hibernica Templeton,Rosa × hibernica Templeton,Rosa × hibernica Templeton,Rosa × hibernica Templeton,Rosa × andrzeiowskii Steven ex Besser,Rosa × andrzeiowskii Steven ex Besser
25678,Phalaenopsis cornu-cervi f. borneensis (Garay) O.Gruss & M.Wolff,Phalaenopsis cornu-cervi (Breda) Blume & Rchb.f.,Phalaenopsis cornu-cervi (Breda) Blume & Rchb.f.,Phalaenopsis cornu-cervi (Breda) Blume & Rchb.f.,Phalaenopsis cornu-cervi (Breda) Blume & Rchb.f.,Phalaenopsis pantherina Rchb.f.,Phalaenopsis pantherina Rchb.f.
28826,Meringium merrillii (Christ) Copel.,Hymenophyllum holochilum (Bosch) C.Chr.,Hymenophyllum holochilum (Bosch) C.Chr.,Hymenophyllum holochilum (Bosch) C.Chr.,Hymenophyllum holochilum (Bosch) C.Chr.,Hymenophyllum merrillii Christ,Hymenophyllum merrillii Christ
29202,Brachypodium pinnatum f. cespitosum (Host) Bolzon,Brachypodium pinnatum (L.) P.Beauv.,Brachypodium pinnatum (L.) P.Beauv.,Brachypodium pinnatum (L.) P.Beauv.,Brachypodium pinnatum (L.) P.Beauv.,Brachypodium rupestre subsp. cespitosum (Host) H.Scholz,Brachypodium rupestre (Host) Roem. & Schult.
29272,Brachypodium pinnatum proles cespitosum (Host) Rouy,Brachypodium pinnatum (L.) P.Beauv.,Brachypodium pinnatum (L.) P.Beauv.,Brachypodium pinnatum (L.) P.Beauv.,Brachypodium pinnatum (L.) P.Beauv.,Brachypodium rupestre subsp. cespitosum (Host) H.Scholz,Brachypodium rupestre (Host) Roem. & Schult.
29273,Brachypodium pinnatum subsp. cespitosum (Host) Hack.,Brachypodium pinnatum (L.) P.Beauv.,Brachypodium pinnatum (L.) P.Beauv.,Brachypodium pinnatum (L.) P.Beauv.,Brachypodium pinnatum (L.) P.Beauv.,Brachypodium rupestre subsp. cespitosum (Host) H.Scholz,Brachypodium rupestre (Host) Roem. & Schult.
29274,Brachypodium rupestre subsp. cespitosum (Host) H.Scholz,Brachypodium pinnatum (L.) P.Beauv.,Brachypodium pinnatum (L.) P.Beauv.,Brachypodium pinnatum (L.) P.Beauv.,Brachypodium pinnatum (L.) P.Beauv.,Brachypodium rupestre subsp. cespitosum (Host) H.Scholz,Brachypodium rupestre (Host) Roem. & Schult.
29275,Brachypodium pinnatum var. cespitosum (Host) Mert. & W.D.J.Koch,Brachypodium pinnatum (L.) P.Beauv.,Brachypodium pinnatum (L.) P.Beauv.,Brachypodium pinnatum (L.) P.Beauv.,Brachypodium pinnatum (L.) P.Beauv.,Brachypodium rupestre subsp. cespitosum (Host) H.Scholz,Brachypodium rupestre (Host) Roem. & Schult.
30471,Cephalomanes insigne var. makinoi (C.Chr.) Sa.Kurata,Trichomanes latealatum (Bosch) Christ,Trichomanes latealatum (Bosch) Christ,Trichomanes latealatum (Bosch) Christ,Trichomanes latealatum (Bosch) Christ,Trichomanes makinoi C.Chr.,Trichomanes makinoi C.Chr.
30678,Potentilla taurica var. tutuiatuensis (Prodan) Borza,Potentilla taurica Willd. ex D.F.K.Schltdl.,Potentilla taurica Willd. ex D.F.K.Schltdl.,Potentilla taurica Willd. ex D.F.K.Schltdl.,Potentilla taurica Willd. ex D.F.K.Schltdl.,Potentilla astracanica subsp. astracanica,Potentilla astracanica Jacq.
30903,Rosa × dumetorum var. hemitricha (Ripart ex Déségl.) Heinr.Braun,Rosa corymbifera Borkh.,Rosa corymbifera Borkh.,Rosa corymbifera Borkh.,Rosa corymbifera Borkh.,Rosa × hemitricha Ripart ex Déségl.,Rosa × hemitricha Ripart ex Déségl.
30909,Rosa canina f. hemitricha (Ripart ex Déségl.) Popek,Rosa corymbifera Borkh.,Rosa corymbifera Borkh.,Rosa corymbifera Borkh.,Rosa corymbifera Borkh.,Rosa × hemitricha Ripart ex Déségl.,Rosa × hemitricha Ripart ex Déségl.
30910,Rosa urbica var. hemitricha (Ripart ex Déségl.) Boullu,Rosa corymbifera Borkh.,Rosa corymbifera Borkh.,Rosa corymbifera Borkh.,Rosa corymbifera Borkh.,Rosa × hemitricha Ripart ex Déségl.,Rosa × hemitricha Ripart ex Déségl.
30939,Rosa × dumetorum f. hemitricha (Ripart ex Déségl.) Borbás,Rosa corymbifera Borkh.,Rosa corymbifera Borkh.,Rosa corymbifera Borkh.,Rosa corymbifera Borkh.,Rosa × hemitricha Ripart ex Déségl.,Rosa × hemitricha Ripart ex Déségl.
30971,Octomeria stellata (Lindl.) Spreng.,Eria javanica (Sw.) Blume,Eria javanica (Sw.) Blume,Bulbophyllum gibbosum (Blume) Lindl.,Bulbophyllum gibbosum (Blume) Lindl.,Eria stellata Lindl.,Eria stellata Lindl.
30972,Tainia stellata (Lindl.) Pfitzer,Eria javanica (Sw.) Blume,Eria javanica (Sw.) Blume,Bulbophyllum gibbosum (Blume) Lindl.,Bulbophyllum gibbosum (Blume) Lindl.,Eria stellata Lindl.,Eria stellata Lindl.
31033,Parthenocissus inserta (A.Kern.) Fritsch,Parthenocissus quinquefolia (L.) Planch.,Parthenocissus quinquefolia (L.) Planch.,Parthenocissus quinquefolia (L.) Planch.,Parthenocissus quinquefolia (L.) Planch.,Parthenocissus inserta (A.Kern.) Fritsch,Parthenocissus inserta (A.Kern.) Fritsch
31113,Rosa communis var. hemitricha (Ripart ex Déségl.) Rouy & E.G.Camus,Rosa corymbifera Borkh.,Rosa corymbifera Borkh.,Rosa corymbifera Borkh.,Rosa corymbifera Borkh.,Rosa × hemitricha Ripart ex Déségl.,Rosa × hemitricha Ripart ex Déségl.
31121,Pinalia stellata (Lindl.) Kuntze,Eria javanica (Sw.) Blume,Eria javanica (Sw.) Blume,Bulbophyllum gibbosum (Blume) Lindl.,Bulbophyllum gibbosum (Blume) Lindl.,Eria stellata Lindl.,Eria stellata Lindl.
31171,Rosa × nitidula f. ovifera (Borbás) Heinr.Braun,Rosa × nitidula Besser,Rosa × nitidula Besser,Rosa × nitidula Besser,Rosa × nitidula Besser,Rosa × malmundariensis Lej.,Rosa × malmundariensis Lej.
31759,Goswamia indica (B.L.Yadav & H.K.Goswami) Li Bing Zhang & Liang Zhang,Ophioglossum rubellum Welw. ex A.Braun,Ophioglossum rubellum Welw. ex A.Braun,Ophioglossum rubellum Welw. ex A.Braun,Ophioglossum rubellum Welw. ex A.Braun,Ophioglossum oleosum Khand.,Ophioglossum oleosum Khand.
31826,Goswamia malviae (M.Patel & M.N.Reddy) Li Bing Zhang & Liang Zhang,Ophioglossum rubellum Welw. ex A.Braun,Ophioglossum rubellum Welw. ex A.Braun,Ophioglossum rubellum Welw. ex A.Braun,Ophioglossum rubellum Welw. ex A.Braun,Ophioglossum oleosum Khand.,Ophioglossum oleosum Khand.
35082,Rubus genevieri subsp. herminicus (Samp.) Cout.,Rubus bracteatus Boreau,Rubus bracteatus Boreau,Rubus bracteatus Boreau,Rubus bracteatus Boreau,Rubus radula Weihe,Rubus radula Weihe
35083,Rubus genevieri var. herminicus (Samp.) Cout.,Rubus bracteatus Boreau,Rubus bracteatus Boreau,Rubus bracteatus Boreau,Rubus bracteatus Boreau,Rubus radula Weihe,Rubus radula Weihe
36810,Potentilla argentea guentheri (Spreng.) Döll,Potentilla argentea L.,Potentilla argentea L.,Potentilla argentea L.,Potentilla argentea L.,Potentilla wimanniana Günther & Schummel,Potentilla wimanniana Günther & Schummel
42431,Pyrus communis var. nivalis (Jacq.) Fiori,Pyrus communis subsp. communis,Pyrus communis subsp. communis,Pyrus communis subsp. communis,Pyrus communis L.,Pyrus nivalis Jacq.,Pyrus nivalis Jacq.
45805,Polygala aquilonia (Fernald & B.G.Schub.) Sorrie & Weakley,Polygala cruciata L.,Polygala cruciata L.,Senega cruciata (L.) J.F.B.Pastore & J.R.Abbott,Senega cruciata (L.) J.F.B.Pastore & J.R.Abbott,Senega aquilonia (Fernald & B.G.Schub.) J.F.B.Pastore & J.R.Abbott,Senega aquilonia (Fernald & B.G.Schub.) J.F.B.Pastore & J.R.Abbott
46170,Festuca yvesii subsp. bellottii (Auquier & Kerguélen) Kerguélen,"Lolium font-queri (St.-Yves) Banfi, Galasso, Foggi, Kopecký & Ardenghi","Lolium font-queri (St.-Yves) Banfi, Galasso, Foggi, Kopecký & Ardenghi","Lolium font-queri (St.-Yves) Banfi, Galasso, Foggi, Kopecký & Ardenghi","Lolium font-queri (St.-Yves) Banfi, Galasso, Foggi, Kopecký & Ardenghi",Festuca billyi Kerguélen & Plonka,Festuca billyi Kerguélen & Plonka
46769,Rubus chloocladus subsp. emollitus (Sudre) Soó,Rubus chloocladus W.C.R.Watson,Rubus chloocladus W.C.R.Watson,Rubus chloocladus W.C.R.Watson,Rubus chloocladus W.C.R.Watson,Rubus stenopetalus Lefèvre & P.J.Müll.,Rubus stenopetalus Lefèvre & P.J.Müll.
50189,Rubus pubescens subsp. emollitus (Sudre) Sudre,Rubus pubescens Raf.,Rubus pubescens Raf.,Rubus pubescens Raf.,Rubus pubescens Raf.,Rubus stenopetalus Lefèvre & P.J.Müll.,Rubus stenopetalus Lefèvre & P.J.Müll.
54816,Guajava cuprea (O.Berg) Kuntze,Psidium rufum Mart. ex DC.,Psidium rufum Mart. ex DC.,Psidium rufum Mart. ex DC.,Psidium rufum Mart. ex DC.,Psidium cupreum O.Berg,Psidium cupreum O.Berg
56258,Polygala cruciata subsp. aquilonia (Fernald & B.G.Schub.) A.Haines,Polygala cruciata L.,Polygala cruciata L.,Senega cruciata (L.) J.F.B.Pastore & J.R.Abbott,Senega cruciata (L.) J.F.B.Pastore & J.R.Abbott,Senega aquilonia (Fernald & B.G.Schub.) J.F.B.Pastore & J.R.Abbott,Senega aquilonia (Fernald & B.G.Schub.) J.F.B.Pastore & J.R.Abbott
58893,Echinonyctanthus leucanthus (Zucc. ex Pfeiff.) Lem.,Acanthocalycium leucanthum (Gillies ex Salm-Dyck) Schlumpb.,Acanthocalycium leucanthum (Gillies ex Salm-Dyck) Schlumpb.,Acanthocalycium leucanthum (Gillies ex Salm-Dyck) Schlumpb.,Acanthocalycium leucanthum (Gillies ex Salm-Dyck) Schlumpb.,Thelocactus leucacanthus (Zucc. ex Pfeiff.) Britton & Rose,Thelocactus leucacanthus (Zucc. ex Pfeiff.) Britton & Rose
60334,Iberis linifolia subsp. timeroyi (Jord.) Moreno,Iberis linifolia subsp. linifolia,Iberis linifolia subsp. linifolia,Iberis linifolia subsp. linifolia,Iberis linifolia L.,Iberis timeroyi Jord.,Iberis timeroyi Jord.
60390,Crepidomanes ramitrichum (Faden) Beentje,Trichomanes frappieri Cordem.,Trichomanes frappieri Cordem.,Trichomanes frappieri Cordem.,Trichomanes frappieri Cordem.,Trichomanes ramitrichum Faden,Trichomanes ramitrichum Faden
60391,Vandenboschia ramitricha (Faden) Pic.Serm.,Trichomanes frappieri Cordem.,Trichomanes frappieri Cordem.,Trichomanes frappieri Cordem.,Trichomanes frappieri Cordem.,Trichomanes ramitrichum Faden,Trichomanes ramitrichum Faden
60876,Rubus rudis var. laevifactus (P.J.Müll.) Focke,Rubus rudis Weihe,Rubus rudis Weihe,Rubus rudis Weihe,Rubus rudis Weihe,Rubus macrostachys P.J.Müll.,Rubus macrostachys P.J.Müll.
61023,Rubus vestitus subsp. teretiusculus (Kaltenb.) Nyman,Rubus vestitus Weihe,Rubus vestitus Weihe,Rubus vestitus Weihe,Rubus vestitus Weihe,Rubus teretiusculus Kaltenb.,Rubus teretiusculus Kaltenb.
63246,Oxytropis nigrescens var. pygmaea (Pall.) Cham.,Oxytropis gorodkovii Jurtzev,Oxytropis gorodkovii Jurtzev,Oxytropis gorodkovii Jurtzev,Oxytropis gorodkovii Jurtzev,Oxytropis nigrescens var. nigrescens,Oxytropis nigrescens (Pall.) Fisch. ex DC.
63263,Oxytropis nigrescens subsp. pygmaea (Pall.) Hultén,Oxytropis gorodkovii Jurtzev,Oxytropis gorodkovii Jurtzev,Oxytropis gorodkovii Jurtzev,Oxytropis gorodkovii Jurtzev,Oxytropis nigrescens var. nigrescens,Oxytropis nigrescens (Pall.) Fisch. ex DC.
63264,Oxytropis tschuktschorum Jurtzev,Oxytropis gorodkovii Jurtzev,Oxytropis gorodkovii Jurtzev,Oxytropis gorodkovii Jurtzev,Oxytropis gorodkovii Jurtzev,Oxytropis nigrescens var. nigrescens,Oxytropis nigrescens (Pall.) Fisch. ex DC.
63303,Oxytropis pygmaea (Pall.) Fernald,Oxytropis gorodkovii Jurtzev,Oxytropis gorodkovii Jurtzev,Oxytropis gorodkovii Jurtzev,Oxytropis gorodkovii Jurtzev,Oxytropis nigrescens var. nigrescens,Oxytropis nigrescens (Pall.) Fisch. ex DC.
63441,Cordia guazumifolia (Desv.) Roem. & Schult.,Varronia polycephala Lam.,Varronia polycephala Lam.,Varronia polycephala Lam.,Varronia polycephala Lam.,Varronia guazumifolia Desv.,Varronia guazumifolia Desv.
63907,Iberis intermedia subsp. timeroyi (Jord.) Nyman,Iberis linifolia subsp. linifolia,Iberis linifolia subsp. linifolia,Iberis linifolia subsp. linifolia,Iberis linifolia L.,Iberis timeroyi Jord.,Iberis timeroyi Jord.
65263,Eranthis hyemalis var. tubergenii (Bowles) P.D.Sell,Eranthis hyemalis (L.) Salisb.,Eranthis hyemalis (L.) Salisb.,Eranthis hyemalis (L.) Salisb.,Eranthis hyemalis (L.) Salisb.,Eranthis × tubergenii Bowles,Eranthis × tubergenii Bowles
65648,Eucalyptus tasmanica Blakely,Eucalyptus delegatensis subsp. tasmaniensis Boland,Eucalyptus delegatensis subsp. tasmaniensis Boland,Eucalyptus tasmaniensis (Boland) D.Nicolle,Eucalyptus tasmaniensis (Boland) D.Nicolle,Eucalyptus tenuiramis Miq.,Eucalyptus tenuiramis Miq.
71227,Gamochaeta subfalcata (Cabrera) Cabrera,Gamochaeta antillana (Urb.) Anderb.,Gamochaeta antillana (Urb.) Anderb.,Gamochaeta antillana (Urb.) Anderb.,Gamochaeta antillana (Urb.) Anderb.,Gamochaeta subfalcata (Cabrera) Cabrera,Gamochaeta subfalcata (Cabrera) Cabrera
71428,Hymenophyllum macrocarpum (C.Presl) Bosch,Hymenophyllum emarginatum Sw.,Hymenophyllum emarginatum Sw.,Hymenophyllum emarginatum Sw.,Hymenophyllum emarginatum Sw.,Hymenophyllum badium Hook. & Grev.,Hymenophyllum badium Hook. & Grev.
74683,Rosa communis var. virginea (Ripart ex Déségl.) Rouy & E.G.Camus,Rosa canina L.,Rosa canina L.,Rosa canina L.,Rosa canina L.,Rosa stylosa Desv.,Rosa stylosa Desv.
75080,Malveopsis spicata (L.) Kuntze,Malvastrum americanum (L.) Torr.,Malvastrum americanum (L.) Torr.,Malvastrum americanum (L.) Torr.,Malvastrum americanum (L.) Torr.,Melochia spicata (L.) Fryxell,Melochia spicata (L.) Fryxell
75817,Begonia lynchiana Hook.f.,Begonia cyathophora Poepp. & Endl.,Begonia cyathophora Poepp. & Endl.,Begonia cyathophora Poepp. & Endl.,Begonia cyathophora Poepp. & Endl.,Begonia bracteosa A.DC.,Begonia bracteosa A.DC.
76618,Potentilla cinerea var. clementei (Jord.) Nyman,Potentilla cinerea Chaix ex Vill.,Potentilla cinerea Chaix ex Vill.,Potentilla cinerea Chaix ex Vill.,Potentilla cinerea Chaix ex Vill.,Potentilla velutina Lehm.,Potentilla velutina Lehm.
76619,Potentilla cinerea clementei (Jord.) Th.Wolf,Potentilla cinerea Chaix ex Vill.,Potentilla cinerea Chaix ex Vill.,Potentilla cinerea Chaix ex Vill.,Potentilla cinerea Chaix ex Vill.,Potentilla velutina Lehm.,Potentilla velutina Lehm.
78922,Festuca lenensis subsp. albifolia (Reverd.) Tzvelev,Festuca lenensis Drobow,Festuca lenensis Drobow,Festuca lenensis Drobow,Festuca lenensis Drobow,Festuca albifolia Reverd.,Festuca albifolia Reverd.
79450,Phragmanthera redingii (De Wild.) Balle,Phragmanthera batangae (Engl.) Balle,Phragmanthera batangae (Engl.) Balle,Phragmanthera batangae (Engl.) Balle,Phragmanthera batangae (Engl.) Balle,Phragmanthera zygiarum (Hiern) Polhill & Wiens,Phragmanthera zygiarum (Hiern) Polhill & Wiens
79451,Tapinanthus redingii (De Wild.) Danser,Phragmanthera batangae (Engl.) Balle,Phragmanthera batangae (Engl.) Balle,Phragmanthera batangae (Engl.) Balle,Phragmanthera batangae (Engl.) Balle,Phragmanthera zygiarum (Hiern) Polhill & Wiens,Phragmanthera zygiarum (Hiern) Polhill & Wiens
79512,Rubus rhamnifolius var. cardiophyllus (Lefèvre & P.J.Müll.) Focke,Rubus germanicus Focke ex Thomé,Rubus germanicus Focke ex Thomé,Rubus germanicus Focke ex Thomé,Rubus germanicus Focke ex Thomé,Rubus cardiophyllus Lefèvre & P.J.Müll.,Rubus cardiophyllus Lefèvre & P.J.Müll.
80248,Dynamidium clementei (Jord.) Fourr.,Potentilla cinerea Chaix ex Vill.,Potentilla cinerea Chaix ex Vill.,Potentilla cinerea Chaix ex Vill.,Potentilla cinerea Chaix ex Vill.,Potentilla velutina Lehm.,Potentilla velutina Lehm.
80249,Potentilla subacaulis var. clementei (Jord.) Nyman,Potentilla cinerea Chaix ex Vill.,Potentilla cinerea Chaix ex Vill.,Potentilla cinerea Chaix ex Vill.,Potentilla cinerea Chaix ex Vill.,Potentilla velutina Lehm.,Potentilla velutina Lehm.
80250,Potentilla velutina var. clementei (Jord.) Th.Wolf,Potentilla cinerea Chaix ex Vill.,Potentilla cinerea Chaix ex Vill.,Potentilla cinerea Chaix ex Vill.,Potentilla cinerea Chaix ex Vill.,Potentilla velutina Lehm.,Potentilla velutina Lehm.
80251,Potentilla cinerea f. clementei (Jord.) Beck,Potentilla cinerea Chaix ex Vill.,Potentilla cinerea Chaix ex Vill.,Potentilla cinerea Chaix ex Vill.,Potentilla cinerea Chaix ex Vill.,Potentilla velutina Lehm.,Potentilla velutina Lehm.
84642,Ulmus carpinifolia f. sarniensis (Loudon) Rehder,Ulmus × hollandica Mill.,Ulmus × hollandica Mill.,Ulmus × hollandica Mill.,Ulmus × hollandica Mill.,Ulmus minor subsp. minor,Ulmus minor Mill.
84643,Ulmus stricta var. sarniensis (Loudon) Moss,Ulmus × hollandica Mill.,Ulmus × hollandica Mill.,Ulmus × hollandica Mill.,Ulmus × hollandica Mill.,Ulmus minor subsp. minor,Ulmus minor Mill.
84644,Ulmus minor var. sarniensis (Loudon) Richens,Ulmus × hollandica Mill.,Ulmus × hollandica Mill.,Ulmus × hollandica Mill.,Ulmus × hollandica Mill.,Ulmus minor subsp. minor,Ulmus minor Mill.
84645,Ulmus minor subsp. sarniensis (Loudon) Stace,Ulmus × hollandica Mill.,Ulmus × hollandica Mill.,Ulmus × hollandica Mill.,Ulmus × hollandica Mill.,Ulmus minor subsp. minor,Ulmus minor Mill.
84699,Ulmus glabra f. sarniensis (Loudon) C.K.Schneid.,Ulmus × hollandica Mill.,Ulmus × hollandica Mill.,Ulmus × hollandica Mill.,Ulmus × hollandica Mill.,Ulmus minor subsp. minor,Ulmus minor Mill.
84700,Ulmus campestris f. sarniensis (Loudon) Dippel,Ulmus × hollandica Mill.,Ulmus × hollandica Mill.,Ulmus × hollandica Mill.,Ulmus × hollandica Mill.,Ulmus minor subsp. minor,Ulmus minor Mill.
84826,Visenia spicata (L.) Colla,Malvastrum americanum (L.) Torr.,Malvastrum americanum (L.) Torr.,Malvastrum americanum (L.) Torr.,Malvastrum americanum (L.) Torr.,Melochia spicata (L.) Fryxell,Melochia spicata (L.) Fryxell
84827,Malveopsis spicata var. normalis Kuntze,Malvastrum americanum (L.) Torr.,Malvastrum americanum (L.) Torr.,Malvastrum americanum (L.) Torr.,Malvastrum americanum (L.) Torr.,Melochia spicata (L.) Fryxell,Melochia spicata (L.) Fryxell
84828,Melochia spicata (L.) Fryxell,Malvastrum americanum (L.) Torr.,Malvastrum americanum (L.) Torr.,Malvastrum americanum (L.) Torr.,Malvastrum americanum (L.) Torr.,Melochia spicata (L.) Fryxell,Melochia spicata (L.) Fryxell
84830,Malvastrum spicatum (L.) A.Gray,Malvastrum americanum (L.) Torr.,Malvastrum americanum (L.) Torr.,Malvastrum americanum (L.) Torr.,Malvastrum americanum (L.) Torr.,Melochia spicata (L.) Fryxell,Melochia spicata (L.) Fryxell
87167,Glyceria capillaris (Lilj.) Wahlenb.,Puccinellia distans (Jacq.) Parl.,Puccinellia distans (Jacq.) Parl.,Puccinellia distans (Jacq.) Parl.,Puccinellia distans (Jacq.) Parl.,Puccinellia capillaris (Lilj.) Jansen,Puccinellia capillaris (Lilj.) Jansen
87168,Hydrochloa capillaris (Lilj.) Hartm.,Puccinellia distans (Jacq.) Parl.,Puccinellia distans (Jacq.) Parl.,Puccinellia distans (Jacq.) Parl.,Puccinellia distans (Jacq.) Parl.,Puccinellia capillaris (Lilj.) Jansen,Puccinellia capillaris (Lilj.) Jansen
87169,Molinia capillaris (Lilj.) Hartm.,Puccinellia distans (Jacq.) Parl.,Puccinellia distans (Jacq.) Parl.,Puccinellia distans (Jacq.) Parl.,Puccinellia distans (Jacq.) Parl.,Puccinellia capillaris (Lilj.) Jansen,Puccinellia capillaris (Lilj.) Jansen
87244,Phippsia capillaris (Lilj.) Á.Löve & D.Löve,Puccinellia distans (Jacq.) Parl.,Puccinellia distans (Jacq.) Parl.,Puccinellia distans (Jacq.) Parl.,Puccinellia distans (Jacq.) Parl.,Puccinellia capillaris (Lilj.) Jansen,Puccinellia capillaris (Lilj.) Jansen
87245,Atropis suecica Holmb.,Puccinellia distans (Jacq.) Parl.,Puccinellia distans (Jacq.) Parl.,Puccinellia distans (Jacq.) Parl.,Puccinellia distans (Jacq.) Parl.,Puccinellia capillaris (Lilj.) Jansen,Puccinellia capillaris (Lilj.) Jansen
